PRODUIT PRINCIPAL;24332INV;8;Humidificateur pour concentrateur à oxygène Invacare  Platinum 9;actif;Humidificateur pour concentrateur à oxygène Invacare  Platinum 9;21,583;0;0;0;Hexamed;Invacare;MEDICAL;Respirateurs pulmonaires, concentrateurs à oxygène;0,6186391;60;Oui;;Humidificateur pour concentrateur à oxygène Invacare  Platinum 9;;https://www.hexamed-leasing.fr/31467-home_default/humidificateur-pour-concentrateur-a-oxygene-invacare-platinum-9.webp
PRODUIT PRINCIPAL;25817ECA;8;Pèse personne plateforme électronique Seca 675 - Classe III;actif;Pèse personne plateforme électronique Seca 675 - Classe III;1332,5;0;0;0;Hexamed;Seca;MEDICAL;Pèse-personnes médicaux;27,082969;60;Oui;;Pèse personne plateforme électronique Seca 675 - Classe III;;https://www.hexamed-leasing.fr/32439-home_default/pese-personne-plateforme-electronique-seca-675-classe-iii.webp
PRODUIT PRINCIPAL;25818ECA;8;Fauteuil de pesée sans fil Seca 959 - 360° wireless - Classe III;actif;Fauteuil de pesée sans fil Seca 959 - 360° wireless - Classe III;1275;0;0;0;Hexamed;Seca;MEDICAL;Pèse-personnes médicaux;25,950219;60;Oui;;Fauteuil de pesée sans fil Seca 959 - 360° wireless - Classe III;;https://www.hexamed-leasing.fr/19670-home_default/fauteuil-de-pesee-sans-fil-seca-959-360-wireless-classe-iii.webp
PRODUIT PRINCIPAL;26111NDE;8;Moniteur de surveillance des signes vitaux M1000 (PNI, SpO2, RESP, T,ECG);actif;Moniteur de surveillance des signes vitaux M1000 (PNI, SpO2, RESP, T,ECG);1208,333;0;0;0;Hexamed;BLT Biolight;MEDICAL;Moniteurs multiparamètres;23,9976141;60;Oui;;Moniteur de surveillance des signes vitaux M1000 (PNI, SpO2, RESP, T,ECG);;https://www.hexamed-leasing.fr/30739-home_default/moniteur-de-surveillance-des-signes-vitaux-m1000-pni-spo2-resp-tecg.webp
PRODUIT PRINCIPAL;26276LPH;8;Balance Impédancemètre professionnelle BC 430 MA S Tanita;actif;Balance Impédancemètre professionnelle BC 430 MA S Tanita;2041,667;0;0;0;Hexamed;Tanita;MEDICAL;Pèse-personnes médicaux;40,4950639;60;Oui;;Balance Impédancemètre professionnelle BC 430 MA S Tanita;;https://www.hexamed-leasing.fr/32469-home_default/balance-impedancemetre-professionnelle-bc-430-ma-s-tanita.webp
PRODUIT PRINCIPAL;26310HBG;8;Moniteur amagnétique Tesla Duo SP02 oxymètre de pouls;actif;Moniteur amagnétique Tesla Duo SP02 oxymètre de pouls;7516,667;0;0;0;Hexamed;Wardray Premise;MEDICAL;Matériel pour IRM;148,3525639;60;Oui;;Moniteur amagnétique Tesla Duo SP02 oxymètre de pouls;;https://www.hexamed-leasing.fr/21823-home_default/moniteur-amagnetique-teslaone-sp02-oxymetre-de-pouls.webp
PRODUIT PRINCIPAL;26557RAF;8;Bilirubinomètre M&B MBJ20;actif;Bilirubinomètre M&B MBJ20;2322,5;0;0;0;Hexamed;M&B Electronic;MEDICAL;Bilirubinomètre;45,946704;60;Oui;;Bilirubinomètre M&B MBJ20;;https://www.hexamed-leasing.fr/30586-home_default/bilirubinometre-mb-mbj20.webp
PRODUIT PRINCIPAL;26671RAF;8;Logiciel SE-1515 pour ECG Edan;actif;Logiciel SE-1515 pour ECG Edan;415,833;0;0;0;Hexamed;Edan;MEDICAL;Logiciels pour ECG et accessoires;8,3853641;60;Oui;;Logiciel SE-1515 pour ECG Edan;;https://www.hexamed-leasing.fr/30907-home_default/logiciel-se-1515-pour-ecg-edan.webp
PRODUIT PRINCIPAL;26684IMA;8;Oxy-capnographe Gima PC-900B;actif;Oxy-capnographe Gima PC-900B;1662,5;0;0;0;Hexamed;Gima;MEDICAL;Spiromètres, débitmètres et Capnographes;32,944704;60;Oui;;Oxy-capnographe Gima PC-900B;;https://www.hexamed-leasing.fr/30885-home_default/oxy-capnographe-gima-pc-900b.jpg
PRODUIT PRINCIPAL;26940RAF;8;Lampe d'examen LED Welch Allyn GS600 sur pied;actif;Lampe d'examen LED Welch Allyn GS600 sur pied;1058,333;0;0;0;Hexamed;Welch Allyn;MEDICAL;Lampes d'examen LED;21,2847271;60;Oui;;Lampe d'examen LED Welch Allyn GS600 sur pied;;https://www.hexamed-leasing.fr/31038-home_default/lampe-d-examen-led-welch-allyn-gs600-sur-pied.webp
PRODUIT PRINCIPAL;26941RAF;8;Lampe d'examen LED Welch Allyn GS900 sur pied;actif;Lampe d'examen LED Welch Allyn GS900 sur pied;2941,667;0;0;0;Hexamed;Welch Allyn;MEDICAL;Lampes d'examen LED;58,4671769;60;Oui;;Lampe d'examen LED Welch Allyn GS900 sur pied;;https://www.hexamed-leasing.fr/31039-home_default/lampe-d-examen-led-welch-allyn-gs900-sur-pied.webp
PRODUIT PRINCIPAL;27024ARD;8;Bras câble patient pour chariot de transport ECG Cardioline;actif;Bras câble patient pour chariot de transport ECG Cardioline;161,667;0;0;0;Hexamed;Cardioline;MEDICAL;Chariots de transport pour ECG;3,3782939;60;Oui;;Bras câble patient pour chariot de transport ECG Cardioline;;https://www.hexamed-leasing.fr/31213-home_default/bras-cable-patient-pour-chariot-de-transport-ecg-cardioline.webp
PRODUIT PRINCIPAL;27044VOG;8;Fauteuil de repos électrique Vog Medical Cerisy;actif;Fauteuil de repos électrique Vog Medical Cerisy;2058,333;0;0;0;Hexamed;Vog;MEDICAL;Mobilier d'examen Vog;42,0514821;60;Oui;;Fauteuil de repos électrique Vog Medical Cerisy;;https://www.hexamed-leasing.fr/31221-home_default/fauteuil-de-repos-electrique-vog-medical-cerisy.webp
PRODUIT PRINCIPAL;27045VOG;8;Fauteuil de prélèvement électrique Vog Médical Vrely;actif;Fauteuil de prélèvement électrique Vog Médical Vrely;2200;0;0;0;Hexamed;Vog;MEDICAL;Mobilier d'examen Vog;44,842322;60;Oui;;Fauteuil de prélèvement électrique Vog Médical Vrely;;https://www.hexamed-leasing.fr/31201-home_default/fauteuil-de-prelevement-electrique-vog-medical-vrely.webp
PRODUIT PRINCIPAL;27192ARI;8;Fauteuil hémodialyse et ambulatoire Carina Multika V2-607 (4 moteurs);actif;Fauteuil hémodialyse et ambulatoire Carina Multika V2-607 (4 moteurs);3665,842;0;0;0;Hexamed;Carina;MEDICAL;Mobilier médical Carina;73,7194094;60;Oui;;Fauteuil hémodialyse et ambulatoire Carina Multika V2-607 (4 moteurs);;https://www.hexamed-leasing.fr/31332-home_default/fauteuil-hemodialyse-et-ambulatoire-carina-multika-v2-607.webp
PRODUIT PRINCIPAL;27235ARI;8;Protection plastique pieds transparente universelle pour divan et fauteuil d'examen Carina;actif;Protection plastique pieds transparente universelle pour divan et fauteuil d'examen Carina;63,083;0;0;0;Hexamed;Carina;MEDICAL;Accessoires pour tables d'examen Carina;1,4361891;60;Oui;;Protection plastique pieds transparente universelle pour divan et fauteuil d'examen Carina;;https://www.hexamed-leasing.fr/31402-home_default/protection-plastique-pieds-transparente-universelle-pour-divan-et-fauteuil-d-examen-carina.webp
PRODUIT PRINCIPAL;27256OBE;8;Divan d'examen électrique Mobercas CE-0157-ABR (1 moteur);actif;Divan d'examen électrique Mobercas CE-0157-ABR (1 moteur);1200;0;0;0;Hexamed;Mobercas;MEDICAL;Mobilier d'examen Mobercas;25,142322;60;Oui;;Divan d'examen électrique Mobercas CE-0157-ABR (1 moteur);;https://www.hexamed-leasing.fr/29505-home_default/table-d-examen-mobercas-electrique-avec-roulettes-retractables-ce-0177-r-1-moteur.webp
PRODUIT PRINCIPAL;27257OBE;8;Divan d'examen électrique Mobercas CE-0177-ABRPC (1 moteur);actif;Divan d'examen électrique Mobercas CE-0177-ABRPC (1 moteur);1325;0;0;0;Hexamed;Mobercas;MEDICAL;Mobilier d'examen Mobercas;27,604822;60;Oui;;Divan d'examen électrique Mobercas CE-0177-ABRPC (1 moteur);;https://www.hexamed-leasing.fr/29113-home_default/table-d-examen-mobercas-electrique-polyvalente-mulitposition.webp
PRODUIT PRINCIPAL;27262OBE;8;Divan d'examen mixte électrique Mobercas CE-0330-RG (3 moteurs);actif;Divan d'examen mixte électrique Mobercas CE-0330-RG (3 moteurs);2600;0;0;0;Hexamed;Mobercas;MEDICAL;Mobilier d'examen Mobercas;52,722322;60;Oui;;Divan d'examen mixte électrique Mobercas CE-0330-RG (3 moteurs);;https://www.hexamed-leasing.fr/21446-home_default/table-d-examen-gynecologique-mobercas-electrique-3-plans.webp
PRODUIT PRINCIPAL;27263OBE;8;Divan d'examen pédiatrique électrique Mobercas CE-0120-R.BAR.P;actif;Divan d'examen pédiatrique électrique Mobercas CE-0120-R.BAR.P;1166,667;0;0;0;Hexamed;Mobercas;MEDICAL;Mobilier d'examen Mobercas;24,4856619;60;Oui;;Divan d'examen pédiatrique électrique Mobercas CE-0120-R.BAR.P;;https://www.hexamed-leasing.fr/24619-home_default/table-pediatrique-mobercas-electrique-avec-barrieres.webp
PRODUIT PRINCIPAL;27265OBE;8;Fauteuil de gynécologie électrique Mobercas SE-1230-G (2 moteurs);actif;Fauteuil de gynécologie électrique Mobercas SE-1230-G (2 moteurs);1570,833;0;0;0;Hexamed;Mobercas;MEDICAL;Mobilier d'examen Mobercas;32,0352141;60;Oui;;Fauteuil de gynécologie électrique Mobercas SE-1230-G (2 moteurs);;https://www.hexamed-leasing.fr/29098-home_default/fauteuil-d-examen-gynecologique-mobercas-a-2-moteurs-.webp
PRODUIT PRINCIPAL;27266OBE;8;Fauteuil de gynécologie électrique Mobercas SE-2230-BRG (2 moteurs);actif;Fauteuil de gynécologie électrique Mobercas SE-2230-BRG (2 moteurs);1925;0;0;0;Hexamed;Mobercas;MEDICAL;Mobilier d'examen Mobercas;39,424822;60;Oui;;Fauteuil de gynécologie électrique Mobercas SE-2230-BRG (2 moteurs);;https://www.hexamed-leasing.fr/29574-home_default/fauteuil-d-examen-gynecologique-mobercas-a-2-moteurs-sur-roulettes.webp
PRODUIT PRINCIPAL;27267OBE;8;Fauteuil de gynécologie électrique Mobercas SE-2330-BRG (3 moteurs);actif;Fauteuil de gynécologie électrique Mobercas SE-2330-BRG (3 moteurs);2075;0;0;0;Hexamed;Mobercas;MEDICAL;Mobilier d'examen Mobercas;41,967304;60;Oui;;Fauteuil de gynécologie électrique Mobercas SE-2330-BRG (3 moteurs);;https://www.hexamed-leasing.fr/29104-home_default/fauteuil-d-examen-gynecologique-mobercas-a-3-moteurs-sur-roulettes.webp
PRODUIT PRINCIPAL;27269OBE;8;Fauteuil de podologie électrique Mobercas SE-1130-B-POD (1 moteur);actif;Fauteuil de podologie électrique Mobercas SE-1130-B-POD (1 moteur);1308,333;0;0;0;Hexamed;Mobercas;MEDICAL;Mobilier d'examen Mobercas;26,8639641;60;Oui;;Fauteuil de podologie électrique Mobercas SE-1130-B-POD (1 moteur);;https://www.hexamed-leasing.fr/29247-home_default/fauteuil-electrique-de-podologie-mobercas.webp
PRODUIT PRINCIPAL;27270OBE;8;Fauteuil de podologie électrique Mobercas SE-1230-B-POD (2 moteurs);actif;Fauteuil de podologie électrique Mobercas SE-1230-B-POD (2 moteurs);1816,667;0;0;0;Hexamed;Mobercas;MEDICAL;Mobilier d'examen Mobercas;36,8781439;60;Oui;;Fauteuil de podologie électrique Mobercas SE-1230-B-POD (2 moteurs);;https://www.hexamed-leasing.fr/24432-home_default/fauteuil-podologique-mobercas-avec-2-moteurs.webp
PRODUIT PRINCIPAL;27272OBE;8;Fauteuil de prélèvement électrique Mobercas SE-1130-B-EXT;actif;Fauteuil de prélèvement électrique Mobercas SE-1130-B-EXT;1233,333;0;0;0;Hexamed;Mobercas;MEDICAL;Mobilier d'examen Mobercas;25,7989821;60;Oui;;Fauteuil de prélèvement électrique Mobercas SE-1130-B-EXT;;https://www.hexamed-leasing.fr/29257-home_default/fauteuil-de-prelevement-mobercas-ce-1130-a-hauteur-variable.webp
PRODUIT PRINCIPAL;27273OBE;8;Fauteuil électrique Mobercas SE-2340-BR pour traitements d'hémodialyse et de chimiothérapie;actif;Fauteuil électrique Mobercas SE-2340-BR pour traitements d'hémodialyse et de chimiothérapie;2285;0;0;0;Hexamed;Mobercas;MEDICAL;Mobilier d'examen Mobercas;46,516822;60;Oui;;Fauteuil électrique Mobercas SE-2340-BR pour traitements d'hémodialyse et de chimiothérapie;;https://www.hexamed-leasing.fr/29254-home_default/fauteuil-electrique-mobercas-pour-traitements-d-hemodialyse-et-de-chimiotherapie.webp
PRODUIT PRINCIPAL;27274OBE;8;Fauteuil ORL-Ophtalmo électrique Mobercas SE-1130-B-OFT (1 moteur);actif;Fauteuil ORL-Ophtalmo électrique Mobercas SE-1130-B-OFT (1 moteur);1375;0;0;0;Hexamed;Mobercas;MEDICAL;Mobilier d'examen Mobercas;28,589822;60;Oui;;Fauteuil ORL-Ophtalmo électrique Mobercas SE-1130-B-OFT (1 moteur);;https://www.hexamed-leasing.fr/29041-home_default/fauteuil-electrique-orl-ophtalmo-mobercas-ce-1140.webp
PRODUIT PRINCIPAL;27510VOG;8;Fauteuil de gynécologie fixe Vog Médical + marchepied;actif;Fauteuil de gynécologie fixe Vog Médical + marchepied;1308,333;0;0;0;Hexamed;Vog;MEDICAL;Mobilier médical Carina;26,8639641;60;Oui;;Fauteuil de gynécologie fixe Vog Médical + marchepied;;https://www.hexamed-leasing.fr/31833-home_default/fauteuil-de-gynecologie-fixe-vog-medical-marchepied.webp
PRODUIT PRINCIPAL;27521VOG;8;Ensemble de mobilier Vog Eco;actif;Ensemble de mobilier Vog Eco;812,5;0;0;0;Hexamed;Vog;MEDICAL;Mobilier d'examen Vog;17,508572;60;Oui;;Ensemble de mobilier Vog Eco;;https://www.hexamed-leasing.fr/31874-home_default/ensemble-de-mobilier-promotal-eco.webp
PRODUIT PRINCIPAL;27696MME;8;Sacoche de transport pour ECG Fukuda Cardimax FCP-8100 et FX8200;actif;Sacoche de transport pour ECG Fukuda Cardimax FCP-8100 et FX8200;99,167;0;0;0;Hexamed;Fukuda Denshi;MEDICAL;Sacoches pour ECG;2,1470439;60;Oui;;Sacoche de transport pour ECG Fukuda Cardimax FCP-8100 et FX8200;;https://www.hexamed-leasing.fr/32158-home_default/sacoche-de-transport-pour-ecg-fukuda-cardimax-fcp-8100-et-fx8200.webp
PRODUIT PRINCIPAL;27730IMA;8;Table d'opération vétérinaire électrique à hauteur variable;actif;Table d'opération vétérinaire électrique à hauteur variable;1799,167;0;0;0;Hexamed;Gima;MEDICAL;Mobilier vétérinaire;36,5333939;60;Oui;;Table d'opération vétérinaire électrique à hauteur variable;;https://www.hexamed-leasing.fr/32168-home_default/table-d-operation-veterinaire-electrique-a-hauteur-variable.webp
PRODUIT PRINCIPAL;27802IDM;8;Repose-bras réglable pour fauteuil Promotal Kompact;actif;Repose-bras réglable pour fauteuil Promotal Kompact;155,833;0;0;0;Hexamed;Promotal;MEDICAL;Accessoires pour fauteuils Promotal et Ritter;3,2633641;60;Oui;;Repose-bras réglable pour fauteuil Promotal Kompact;;https://www.hexamed-leasing.fr/32238-home_default/repose-bras-reglable-pour-fauteuils-promotal-kompact.webp
PRODUIT PRINCIPAL;27803IDM;8;Goepples pour fauteuil Promotal Kompact;actif;Goepples pour fauteuil Promotal Kompact;337,5;0;0;0;Hexamed;Promotal;MEDICAL;Accessoires pour tables d'examen Promotal et Ritter;6,842204;60;Oui;;Goepples pour fauteuil Promotal Kompact;;https://www.hexamed-leasing.fr/32239-home_default/goepples-pour-fauteuils-promotal-kompact.webp
PRODUIT PRINCIPAL;27919RAF;8;Appareil de dépistage visuel Welch Allyn Spot VS100;actif;Appareil de dépistage visuel Welch Allyn Spot VS100;9191,667;0;0;0;Hexamed;Welch Allyn;MEDICAL;Matériel de tests de vision;181,2692939;60;Oui;;Appareil de dépistage visuel Welch Allyn Spot VS100;;https://www.hexamed-leasing.fr/32412-home_default/appareil-de-depistage-visuel-welch-allyn-spot-vs100.webp
PRODUIT PRINCIPAL;27944RAF;8;Kit signalétique défibrillateur DAE;actif;Kit signalétique défibrillateur DAE;22,917;0;0;0;Hexamed;Marque générique;MEDICAL;Accessoires divers pour défibrillateurs;0,6449189;60;Oui;;Kit signalétique défibrillateur DAE;;https://www.hexamed-leasing.fr/32514-home_default/kit-signaletique-defibrillateur-dae.webp
PRODUIT PRINCIPAL;28123IDM;17;Galerie supérieure 4 côtés pour guéridon Promotal 60 x 40 cm - 2;actif;Galerie supérieure 4 côtés pour guéridon Promotal 60 x 40 cm - 2;96,667;0;0;0;Hexamed;Promotal;MEDICAL;Accessoires guéridons et chariots d'urgence;2,0977939;60;Oui;;Galerie supérieure 4 côtés pour guéridon Promotal 60 x 40 cm - 2;;https://www.hexamed-leasing.fr/32889-home_default/galerie-superieure-4-cotes-pour-gueridon-promotal-60-x-40-cm.jpg
PRODUIT PRINCIPAL;10098SEP/90020SEP;17;Jeu de 6 poires précordiales (diam.15, 24 et 30 mm) pour ECG - Dimensions-1 : 24 mm;actif;Jeu de 6 poires précordiales (diam.15, 24 et 30 mm) pour ECG - Dimensions-1 : 24 mm;24,75;0;0;0;Hexamed;Aseptinmed;MEDICAL;Accessoires ECG : adaptateurs électrodes, pinces et poires;0,681029;60;Oui;;Jeu de 6 poires précordiales (diam.15, 24 et 30 mm) pour ECG - Dimensions-1 : 24 mm;;https://www.hexamed-leasing.fr/13217-home_default/jeu-de-6-poires-precordiales-diam-15-24-et-30mm-pour-ecg.webp
PRODUIT PRINCIPAL;10099SEP/90020SEP;17;Jeu de 6 poires précordiales (diam.15, 24 et 30 mm) pour ECG - Dimensions-1 : 15 mm;actif;Jeu de 6 poires précordiales (diam.15, 24 et 30 mm) pour ECG - Dimensions-1 : 15 mm;24,75;0;0;0;Hexamed;Aseptinmed;MEDICAL;Accessoires ECG : adaptateurs électrodes, pinces et poires;0,681029;60;Oui;;Jeu de 6 poires précordiales (diam.15, 24 et 30 mm) pour ECG - Dimensions-1 : 15 mm;;https://www.hexamed-leasing.fr/13217-home_default/jeu-de-6-poires-precordiales-diam-15-24-et-30mm-pour-ecg.webp
PRODUIT PRINCIPAL;10100SEP/90020SEP;17;Jeu de 6 poires précordiales (diam.15, 24 et 30 mm) pour ECG - Dimensions-1 : 30 mm;actif;Jeu de 6 poires précordiales (diam.15, 24 et 30 mm) pour ECG - Dimensions-1 : 30 mm;24,75;0;0;0;Hexamed;Aseptinmed;MEDICAL;Accessoires ECG : adaptateurs électrodes, pinces et poires;0,681029;60;Oui;;Jeu de 6 poires précordiales (diam.15, 24 et 30 mm) pour ECG - Dimensions-1 : 30 mm;;https://www.hexamed-leasing.fr/13217-home_default/jeu-de-6-poires-precordiales-diam-15-24-et-30mm-pour-ecg.webp
PRODUIT PRINCIPAL;10130IZC/90027IZC;17;Accessoires pour négatoscope numérique Dgscope A22 - Modèle-6 : Chariot;actif;Accessoires pour négatoscope numérique Dgscope A22 - Modèle-6 : Chariot;2079,167;0;0;0;Hexamed;Dgscope;MEDICAL;Négatoscopes pour cabinet de radiologie;41,7923089;60;Oui;;Accessoires pour négatoscope numérique Dgscope A22 - Modèle-6 : Chariot;;https://www.hexamed-leasing.fr/18117-home_default/accessoires-pour-negatoscope-numerique-dgscope-a22.webp
PRODUIT PRINCIPAL;10131IZC/90027IZC;17;Accessoires pour négatoscope numérique Dgscope A22 - Modèle-6 : Mallette de transport;actif;Accessoires pour négatoscope numérique Dgscope A22 - Modèle-6 : Mallette de transport;485;0;0;0;Hexamed;Dgscope;MEDICAL;Négatoscopes pour cabinet de radiologie;10,070837;60;Oui;;Accessoires pour négatoscope numérique Dgscope A22 - Modèle-6 : Mallette de transport;;https://www.hexamed-leasing.fr/18117-home_default/accessoires-pour-negatoscope-numerique-dgscope-a22.webp
PRODUIT PRINCIPAL;10132IZC/90027IZC;17;Accessoires pour négatoscope numérique Dgscope A22 - Modèle-6 : Kit Wifi;actif;Accessoires pour négatoscope numérique Dgscope A22 - Modèle-6 : Kit Wifi;526,667;0;0;0;Hexamed;Dgscope;MEDICAL;Négatoscopes pour cabinet de radiologie;10,5687939;60;Oui;;Accessoires pour négatoscope numérique Dgscope A22 - Modèle-6 : Kit Wifi;;https://www.hexamed-leasing.fr/18117-home_default/accessoires-pour-negatoscope-numerique-dgscope-a22.webp
PRODUIT PRINCIPAL;10133IZC/90027IZC;17;Accessoires pour négatoscope numérique Dgscope A22 - Modèle-6 : Protection d'écran anti-choc acier;actif;Accessoires pour négatoscope numérique Dgscope A22 - Modèle-6 : Protection d'écran anti-choc acier;520,833;0;0;0;Hexamed;Dgscope;MEDICAL;Négatoscopes pour cabinet de radiologie;10,4538641;60;Oui;;Accessoires pour négatoscope numérique Dgscope A22 - Modèle-6 : Protection d'écran anti-choc acier;;https://www.hexamed-leasing.fr/18117-home_default/accessoires-pour-negatoscope-numerique-dgscope-a22.webp
PRODUIT PRINCIPAL;10136ARI/90028ARI;17;Fauteuil ORL fixe Carina - Modèle-6 : Sans roulettes;actif;Fauteuil ORL fixe Carina - Modèle-6 : Sans roulettes;1958,033;0;0;0;Hexamed;Carina;MEDICAL;Mobilier médical Carina;39,6630541;60;Oui;;Fauteuil ORL fixe Carina - Modèle-6 : Sans roulettes;;https://www.hexamed-leasing.fr/26131-home_default/fauteuil-orl-carina-a-hauteur-fixe.webp
PRODUIT PRINCIPAL;10137ARI/90028ARI;17;Fauteuil ORL fixe Carina - Modèle-6 : Avec roulettes;actif;Fauteuil ORL fixe Carina - Modèle-6 : Avec roulettes;2191,667;0;0;0;Hexamed;Carina;MEDICAL;Mobilier médical Carina;44,2656439;60;Oui;;Fauteuil ORL fixe Carina - Modèle-6 : Avec roulettes;;https://www.hexamed-leasing.fr/26131-home_default/fauteuil-orl-carina-a-hauteur-fixe.webp
PRODUIT PRINCIPAL;17279ARI/90028ARI;17;Fauteuil ORL fixe Carina - Modèle-6 : Socle chromé;actif;Fauteuil ORL fixe Carina - Modèle-6 : Socle chromé;1900;0;0;0;Hexamed;Carina;MEDICAL;Mobilier médical Carina;38,519804;60;Oui;;Fauteuil ORL fixe Carina - Modèle-6 : Socle chromé;;https://www.hexamed-leasing.fr/26131-home_default/fauteuil-orl-carina-a-hauteur-fixe.webp
PRODUIT PRINCIPAL;10142ARI/90030ARI;17;Fauteuil ORL hydraulique Carina - Matière-6 : Laqué;actif;Fauteuil ORL hydraulique Carina - Matière-6 : Laqué;1766,667;0;0;0;Hexamed;Carina;MEDICAL;Mobilier médical Carina;35,8931439;60;Oui;;Fauteuil ORL hydraulique Carina - Matière-6 : Laqué;;https://www.hexamed-leasing.fr/28672-home_default/fauteuil-orl-carina-a-hauteur-variable-hydraulique.webp
PRODUIT PRINCIPAL;10144ARI/90030ARI;17;Fauteuil ORL hydraulique Carina - Matière-6 : Chromé;actif;Fauteuil ORL hydraulique Carina - Matière-6 : Chromé;1841,667;0;0;0;Hexamed;Carina;MEDICAL;Mobilier médical Carina;37,3706439;60;Oui;;Fauteuil ORL hydraulique Carina - Matière-6 : Chromé;;https://www.hexamed-leasing.fr/28672-home_default/fauteuil-orl-carina-a-hauteur-variable-hydraulique.webp
PRODUIT PRINCIPAL;10183ARI/90039ARI;17;Têtière demi-lune pour divan ou fauteuil d'examen Carina - Dimensions-1 : 600 mm;actif;Têtière demi-lune pour divan ou fauteuil d'examen Carina - Dimensions-1 : 600 mm;75,836;0;0;0;Hexamed;Carina;MEDICAL;Accessoires pour tables d'examen Carina;1,6874232;60;Oui;;Têtière demi-lune pour divan ou fauteuil d'examen Carina - Dimensions-1 : 600 mm;;https://www.hexamed-leasing.fr/28143-home_default/tetiere-demi-lune-pour-divan-carina.webp
PRODUIT PRINCIPAL;10185ARI/90039ARI;17;Têtière demi-lune pour divan ou fauteuil d'examen Carina - Dimensions-1 : 700 mm;actif;Têtière demi-lune pour divan ou fauteuil d'examen Carina - Dimensions-1 : 700 mm;92,599;0;0;0;Hexamed;Carina;MEDICAL;Accessoires pour tables d'examen Carina;2,0176543;60;Oui;;Têtière demi-lune pour divan ou fauteuil d'examen Carina - Dimensions-1 : 700 mm;;https://www.hexamed-leasing.fr/28143-home_default/tetiere-demi-lune-pour-divan-carina.webp
PRODUIT PRINCIPAL;10187ARI/90039ARI;17;Têtière demi-lune pour divan ou fauteuil d'examen Carina - Dimensions-1 : 800 mm;actif;Têtière demi-lune pour divan ou fauteuil d'examen Carina - Dimensions-1 : 800 mm;111,758;0;0;0;Hexamed;Carina;MEDICAL;Accessoires pour tables d'examen Carina;2,3950866;60;Oui;;Têtière demi-lune pour divan ou fauteuil d'examen Carina - Dimensions-1 : 800 mm;;https://www.hexamed-leasing.fr/28143-home_default/tetiere-demi-lune-pour-divan-carina.webp
PRODUIT PRINCIPAL;10260ARI/90045ARI;17;Divan d'examen fixe Carina 124 - Dimensions-1 : 600 mm, Largeurs-1 : 80 cm;actif;Divan d'examen fixe Carina 124 - Dimensions-1 : 600 mm, Largeurs-1 : 80 cm;765,833;0;0;0;Hexamed;Carina;MEDICAL;Mobilier médical Carina;15,9196291;60;Oui;;Divan d'examen fixe Carina 124 - Dimensions-1 : 600 mm, Largeurs-1 : 80 cm;;https://www.hexamed-leasing.fr/30016-home_default/divan-d-examen-hauteur-fixe-modele-124.webp
PRODUIT PRINCIPAL;10262ARI/90045ARI;17;Divan d'examen fixe Carina 124 - Dimensions-1 : 600 mm, Largeurs-1 : 65 cm;actif;Divan d'examen fixe Carina 124 - Dimensions-1 : 600 mm, Largeurs-1 : 65 cm;765,833;0;0;0;Hexamed;Carina;MEDICAL;Mobilier médical Carina;15,9196291;60;Oui;;Divan d'examen fixe Carina 124 - Dimensions-1 : 600 mm, Largeurs-1 : 65 cm;;https://www.hexamed-leasing.fr/30016-home_default/divan-d-examen-hauteur-fixe-modele-124.webp
PRODUIT PRINCIPAL;10264ARI/90045ARI;17;Divan d'examen fixe Carina 124 - Dimensions-1 : 700 mm, Largeurs-1 : 80 cm;actif;Divan d'examen fixe Carina 124 - Dimensions-1 : 700 mm, Largeurs-1 : 80 cm;821,667;0;0;0;Hexamed;Carina;MEDICAL;Mobilier médical Carina;17,0195589;60;Oui;;Divan d'examen fixe Carina 124 - Dimensions-1 : 700 mm, Largeurs-1 : 80 cm;;https://www.hexamed-leasing.fr/30016-home_default/divan-d-examen-hauteur-fixe-modele-124.webp
PRODUIT PRINCIPAL;10266ARI/90045ARI;17;Divan d'examen fixe Carina 124 - Dimensions-1 : 700 mm, Largeurs-1 : 65 cm;actif;Divan d'examen fixe Carina 124 - Dimensions-1 : 700 mm, Largeurs-1 : 65 cm;821,667;0;0;0;Hexamed;Carina;MEDICAL;Mobilier médical Carina;17,0195589;60;Oui;;Divan d'examen fixe Carina 124 - Dimensions-1 : 700 mm, Largeurs-1 : 65 cm;;https://www.hexamed-leasing.fr/30016-home_default/divan-d-examen-hauteur-fixe-modele-124.webp
PRODUIT PRINCIPAL;10268ARI/90045ARI;17;Divan d'examen fixe Carina 124 - Dimensions-1 : 800 mm, Largeurs-1 : 80 cm;actif;Divan d'examen fixe Carina 124 - Dimensions-1 : 800 mm, Largeurs-1 : 80 cm;957,5;0;0;0;Hexamed;Carina;MEDICAL;Mobilier médical Carina;19,695469;60;Oui;;Divan d'examen fixe Carina 124 - Dimensions-1 : 800 mm, Largeurs-1 : 80 cm;;https://www.hexamed-leasing.fr/30016-home_default/divan-d-examen-hauteur-fixe-modele-124.webp
PRODUIT PRINCIPAL;10270ARI/90045ARI;17;Divan d'examen fixe Carina 124 - Dimensions-1 : 800 mm, Largeurs-1 : 65 cm;actif;Divan d'examen fixe Carina 124 - Dimensions-1 : 800 mm, Largeurs-1 : 65 cm;957,5;0;0;0;Hexamed;Carina;MEDICAL;Mobilier médical Carina;19,695469;60;Oui;;Divan d'examen fixe Carina 124 - Dimensions-1 : 800 mm, Largeurs-1 : 65 cm;;https://www.hexamed-leasing.fr/30016-home_default/divan-d-examen-hauteur-fixe-modele-124.webp
PRODUIT PRINCIPAL;10300ARI/90048ARI;17;Divan d'examen fixe Carina 326 - Dimensions-1 : 600 mm;actif;Divan d'examen fixe Carina 326 - Dimensions-1 : 600 mm;1161,075;0;0;0;Hexamed;Carina;MEDICAL;Mobilier médical Carina;23,9629815;60;Oui;;Divan d'examen fixe Carina 326 - Dimensions-1 : 600 mm;;https://www.hexamed-leasing.fr/28137-home_default/divan-d-examen-hauteur-fixe-carina-gamme-326.webp
PRODUIT PRINCIPAL;10312ARI/90048ARI;17;Divan d'examen fixe Carina 326 - Dimensions-1 : 700 mm;actif;Divan d'examen fixe Carina 326 - Dimensions-1 : 700 mm;1202,75;0;0;0;Hexamed;Carina;MEDICAL;Mobilier médical Carina;24,783979;60;Oui;;Divan d'examen fixe Carina 326 - Dimensions-1 : 700 mm;;https://www.hexamed-leasing.fr/28137-home_default/divan-d-examen-hauteur-fixe-carina-gamme-326.webp
