1115166;TV SAMSUNG 85Q900R 8K;actif;TV SAMSUNG 85Q900R 8K;11419,83;Fixe;Boulanger Pro;SAMSUNG;MULTIMEDIA;TV;259,8;60;Oui;8801643453619;;PRODUITS PRINCIPAUX
1106394;TV LG OLED77W8;actif;TV LG OLED77W8;11599,54;Fixe;Boulanger Pro;LG;MULTIMEDIA;TV;263,5;60;Oui;8806098142934;;PRODUITS PRINCIPAUX
1068014;Support WEBER Fumoir universel Original;actif;Support WEBER Fumoir universel Original;20,15;Sans objet;Boulanger Pro;WEBER;AUTRE;ACCESSOIRE;1;36;Oui;5707431032420;;PRODUITS ACCESSOIRES
1019581;Kit WEBER Kit 3 accessoires en acier inoxidable;actif;Kit WEBER Kit 3 accessoires en acier inoxidable;33,67;Sans objet;Boulanger Pro;WEBER;AUTRE;ACCESSOIRE;1,5;36;Oui;77924011870;;PRODUITS ACCESSOIRES
1096741;Table Pressing LAURASTAR PLUSBOARD LIPS;actif;Table Pressing LAURASTAR PLUSBOARD LIPS;70,95;Sans objet;Boulanger Pro;LAURASTAR;PETIT ELECTRO MENAGER;Repassage;2,8;36;Oui;790776002123;;PRODUITS ACCESSOIRES
1096743;Table Pressing LAURASTAR Prestige Board;actif;Table Pressing LAURASTAR Prestige Board;87,45;Sans objet;Boulanger Pro;LAURASTAR;PETIT ELECTRO MENAGER;Repassage;3,4;36;Oui;790776002901;;PRODUITS ACCESSOIRES
1083851;Table Pressing WPRO Jeannette de repassage ISB016;actif;Table Pressing WPRO Jeannette de repassage ISB016;8,4;Sans objet;Boulanger Pro;WPRO;PETIT ELECTRO MENAGER;Repassage;0,6;36;Oui;8015250581188;;PRODUITS ACCESSOIRES
1042328;ACC. KITCHENAID 5KSM2FPA TRANCHEUR RAPEUR;actif;ACC. KITCHENAID 5KSM2FPA TRANCHEUR RAPEUR;125,95;Sans objet;Boulanger Pro;KITCHENAID;AUTRE;ACCESSOIRE;4,6;36;Oui;5413184100308;;PRODUITS ACCESSOIRES
553708;ACC. KITCHENAID HACHOIR 5FGA;actif;ACC. KITCHENAID HACHOIR 5FGA;58,325;Sans objet;Boulanger Pro;KITCHENAID;AUTRE;ACCESSOIRE;2,3;36;Oui;5413184400309;;PRODUITS ACCESSOIRES
1042327;ACC. KITCHENAID 5KSM1JA EXTRACTEUR DE JUS;actif;ACC. KITCHENAID 5KSM1JA EXTRACTEUR DE JUS;89,991667;Sans objet;Boulanger Pro;KITCHENAID;AUTRE;ACCESSOIRE;3,4;36;Oui;5413184000745;;PRODUITS ACCESSOIRES
789516;ACC. KITCHENAID BOL SORBETIERE 5KICAOWH;actif;ACC. KITCHENAID BOL SORBETIERE 5KICAOWH;58,325;Sans objet;Boulanger Pro;KITCHENAID;AUTRE;ACCESSOIRE;2,3;36;Oui;5413184410704;Pour préparer vous-même, facilement et rapidement, des glaces, des sorbets, des granités... directement avec votre robot Artisan® de KitchenAid®<br /><br />Mettez le bol sorbetière dans votre congélateur pendant au moins 15 heures. <br />Dès qu'il est réfrigéré, versez votre préparation dans le bol et posez-le sur le socle de votre robot. <br />Mettez en marche pour faire tourner la pale et obtenir un mélange glacé bien homogène.;PRODUITS ACCESSOIRES
1114858;Accessoire KITCHENAID 5KSMMGA Hachoir en métal;actif;Accessoire KITCHENAID 5KSMMGA Hachoir en métal;86,58;Sans objet;Boulanger Pro;KITCHENAID;AUTRE;ACCESSOIRE;3,3;36;Oui;5413184410001;;PRODUITS ACCESSOIRES
1077338;Accessoire KITCHENAID 5KSMPRA Machine à pâtes de luxe;actif;Accessoire KITCHENAID 5KSMPRA Machine à pâtes de luxe;109,45;Sans objet;Boulanger Pro;KITCHENAID;AUTRE;ACCESSOIRE;4,1;36;Oui;5413184400019;;PRODUITS ACCESSOIRES
577065;ACC. KITCHENAID 5KB3SS Bol 3l acier inoxydable;actif;ACC. KITCHENAID 5KB3SS Bol 3l acier inoxydable;37,87;Sans objet;Boulanger Pro;KITCHENAID;AUTRE;ACCESSOIRE;1,6;36;Oui;5413184401801;Ce bol complète le bol standard de 4.83 litres et le bol de 4.28 litres. Il est très utile pour mixer des quantités plus petites, parfaitement hygiénique et résiste aux odeurs. Résistant au lave-vaisselle.CARACTERISTIQUES PRINCIPALESBol de 3 litres;PRODUITS ACCESSOIRES
871866;ACC. KITCHENAID FLEXIBLE 5KFE5T;actif;ACC. KITCHENAID FLEXIBLE 5KFE5T;23,1;Sans objet;Boulanger Pro;KITCHENAID;AUTRE;ACCESSOIRE;1,1;36;Oui;5413184403607;;PRODUITS ACCESSOIRES
1104534;ACC. KENWOOD KAX984ME Filière Spaghettis;actif;ACC. KENWOOD KAX984ME Filière Spaghettis;54,78;Sans objet;Boulanger Pro;KENWOOD;AUTRE;ACCESSOIRE;2,2;36;Oui;5011423197050;"<p>Savourez des pâtes fraiches et authentiques en les réalisant vous-même, à l'aide de la filière à spaghettis KAX984ME KENWOOD. Adaptable sur les robots KENWOOD, cet accessoire vous permet de les fabriquer facilement.</p><h3>Des spaghettis frais en un tour de main<img class=""wy_tableau_gauche"" src=""https://boulanger.scene7.com/is/image/Boulanger/5011423197050_p1?wid=400&amp;hei=135"" width=""200"" height=""135"" alt=""ACC. KENWOOD KAX984ME Filière Spaghettis"" /></h3><p>Les amateurs de pâtes seront ravis d'ajouter cette filière à spaghettis KAX984ME à leur robot KENWOOD. Cet accessoire vous permet de réaliser vous-même de délicieux <b>spaghettis frais</b>, à la manière des appareils italiens. En passant votre pâte au travers de la filière, vous obtenez des <b>spaghettis de 1,5 mm de large</b>, soit la taille idéale pour ce type de pâte.<br /><br />Vous pourrez <b>réaliser autant de spaghettis que vous le souhaitez</b> grâce à cet accessoire KENWOOD. De quoi préparer de nombreux petits plats : spaghettis à la bolognaise, spaghettis carbonara ou encore spaghettis aux fruits de mer. Laissez parler vos talents de cuisinier !<br /><br /></p><h3>Un accessoire de qualité<img class=""wy_tableau_right"" src=""https://boulanger.scene7.com/is/image/Boulanger/5011423197050_p2?wid=400&amp;hei=135"" width=""200"" height=""135"" alt=""ACC. KENWOOD KAX984ME Filière Spaghettis"" /></h3><p>La filière à spaghettis KAX984ME KENWOOD <b>s'adapte aux robots kMix, Chef et Chef XL</b> de la marque, afin de vous offrir une nouvelle fonctionnalité en un seul geste. Vous n'avez donc pas besoin d'acheter un nouveau robot ! Elle se monte sur l'avant de l'appareil en toute simplicité en s'intégrant dans l'encoche prévue à cet effet.<br /><br />En <b>acier inoxydable</b> et <b>fabriqué en Italie</b>, cet accessoire KENWOOD vous assure un matériel de qualité, à la fois fiable et durable, parfait pour des années d'utilisation intensive. Votre famille et vos amis ne manqueront pas de vous réclamer ce grand classique de la cuisine italienne !</p>";PRODUITS ACCESSOIRES
1104532;ACC. KENWOOD KAX981ME Filière fettuccines;actif;ACC. KENWOOD KAX981ME Filière fettuccines;54,99;Sans objet;Boulanger Pro;KENWOOD;AUTRE;ACCESSOIRE;2,2;36;Oui;5011423197043;"<p>Passez maître dans l'art de fabriquer les tagliatelles, en équipant votre robot KENWOOD de cette filière KAX981ME. En un tour de main, vous profitez de pâtes fraiches, authentiques et savoureuses.</p><h3>Des pâtes fraiches italiennes<img class=""wy_tableau_gauche"" src=""https://boulanger.scene7.com/is/image/Boulanger/5011423197043_p1?wid=400&amp;hei=270"" width=""200"" height=""135"" alt=""ACC. KENWOOD KAX981ME Filière fettuccines"" /></h3><p>KENWOOD propose toute une gamme d'accessoires complémentaires pour robots, vous permettant de bénéficier de nouvelles fonctionnalités. Pour la réalisation de <b>tagliatelles maison</b>, aussi appelées Fettuccines, la marque vous propose la filière KAX981ME. Grâce à elle, vous pouvez couper votre pâte en <b>Fettucines de 6,5 mm de large</b> en un seul passage.<br /><br /><b>Fabriqué en Italie</b>, cet accessoire s'inspire des appareils et du savoir-faire national, afin de vous proposer des pâtes authentiques. Vos convives seront ébahis devant vos plats et leurs saveurs. Il ne vous reste plus qu'à décliner vos pâtes fraiches avec différents accompagnements : sauce carbonara, pesto ou bolognaise.<br /><br /></p><h3>Un accessoire durable<img class=""wy_tableau_right"" src=""https://boulanger.scene7.com/is/image/Boulanger/5011423197043_p2?wid=400&amp;hei=270"" width=""200"" height=""135"" alt=""ACC. KENWOOD KAX981ME Filière fettuccines"" /></h3><p>La filière KAX981ME à Fettuccines KENWOOD est un accessoire conçu pour durer dans le temps et vous permettre de réaliser <b>un nombre infini de pâtes fraiches</b>. Pour cela, son corps est composé d'<b>acier inoxydable</b>, un matériau qui ne s'altère pas avec le temps. De plus, il est également très facile à entretenir.<br /><br />Cette filière est adaptable sur les <b>robots KENWOOD kMix, Chef et Chef XL</b>. Elle s'installe en quelques instants à l'avant de l'appareil pour une utilisation aisée. Il ne vous reste plus qu'à préparer votre pâte et à la passer à travers la filière.</p>";PRODUITS ACCESSOIRES
1046722;ACC. KENWOOD KAX910;actif;ACC. KENWOOD KAX910;71,36;Sans objet;Boulanger Pro;KENWOOD;AUTRE;ACCESSOIRE;2,8;36;Oui;5011423176963;;PRODUITS ACCESSOIRES
1051683;Kit WPRO SKS101 universel lave-linge/sèc;actif;Kit WPRO SKS101 universel lave-linge/sèc;35,74;Sans objet;Boulanger Pro;WPRO;AUTRE;ACCESSOIRE;1,1;60;Oui;8015250441444;"<p>Pour installer votre sèche-linge au-dessus de votre lave-linge en toute sécurité, rien de tel que le kit WPRO SKS101 universel lave-linge/sèche-linge. Il offre une sécurité et une stabilité optimales pour vos appareils et dispose, en plus, d'une tablette coulissante additionnelle. </p><h3>Sécuriser l'installation de son sèche-linge<img class=""wy_tableau_gauche"" src=""https://boulanger.scene7.com/is/image/Boulanger/8015250441444_p1?wid=400&amp;hei=270"" width=""200"" height=""135"" alt=""Kit WPRO SKS101 universel lave-linge/sèche-linge"" /></h3><p>Lorsqu'on installe un sèche-linge au-dessus d'un lave-linge, il est important de <b>sécuriser le positionnement du sèche-linge</b> pour éviter tout risque de chute. Ce type d'installation vous permet de gagner nettement en place en empilant l'un au-dessus de l'autre le sèche-linge et le lave-linge. <br /><br />Le principe de ce kit universel est simple : il dispose d'un système de <b>fixation avec sangle</b>, qui est en plus <b>équipée du Safe-In-Lock</b> pour stabiliser parfaitement votre sèche-linge. <b>Son installation est très simple</b> : il suffit d'installer les 8 patins antidérapants et 4 plaquettes rigides, puis de fixer la sangle avec le tendeur à cliquets fourni.  <br /><br /></p><h3>Un gain de place sur toute la ligne<img class=""wy_tableau_right"" src=""https://boulanger.scene7.com/is/image/Boulanger/8015250441444_p2?wid=400&amp;hei=270"" width=""200"" height=""135"" alt=""Kit WPRO SKS101 universel lave-linge/sèche-linge"" /></h3><p>En plus de permettre la superposition du sèche-linge et du lave-linge, le kit WPRO SKS101 universel lave-linge/sèche-linge vous fait gagner davantage de place grâce à sa <b>tablette coulissante intégrée</b>. Celle-ci peut supporter jusqu'à 10kg, et constitue un plan de travail très pratique pour charger votre linge ou le plier sans avoir à vous baisser. <br /><br />Ce modèle signé WPRO convient pour tous les appareils de dimensions 60 x 60cm. Il est en plus <b>doté d'un cache sangle</b> à positionner avant de finaliser l'installation.</p>";PRODUITS ACCESSOIRES
1051684;MWC171 ANTI CALCAIRE MAGNETIQUE LL OU LV;actif;MWC171 ANTI CALCAIRE MAGNETIQUE LL OU LV;16,65;Sans objet;Boulanger Pro;WPRO;AUTRE;ACCESSOIRE;0,6;60;Oui;8015250441000;"<p>Recommandé par de nombreuses grandes marques, le WPRO MWC171 ANTI CALCAIRE MAGNETIQUE LAVE-LINGE OU LAVE-VAISSELLE est un moyen pratique de prolonger la durée de vie de votre machine à laver. Grâce à ses capacités, il permet à votre appareil d'offrir un nettoyage optimal sans perdre en efficacité, et ce pour de longues années.</p><h3>Un anticalcaire qui accroit la durée de vie de votre machine<img class=""wy_tableau_gauche"" src=""https://boulanger.scene7.com/is/image/Boulanger/8015250441000_p1?wid=400&amp;hei=270"" width=""200"" height=""135"" alt=""WPRO MWC171 ANTI CALCAIRE MAGNETIQUE LL OU LV"" /></h3><p>La fonction essentielle de cet accessoire, qui est de <b>prévenir la formation de calcaire</b>, vous séduira bien rapidement. En effet, le dépôt de calcaire étant la principale cause de panne chez les machines, un tel outil vous permet de diminuer grandement les risques qu'une telle situation vous arrive. Grâce à lui, vous n'aurez plus besoin de contacter de plombier.<br /><br />Il protège et <b>prolonge la durée de vie d'un lave-linge ou lave-vaisselle</b>. Une fois installé, c'est un accessoire qui vous offrira ses atouts non négligeables et qui saura vite se rendre indispensable, surtout si vous êtes dans des régions où le calcaire est fortement présent dans l'eau.<br /><br /></p><h3>Simple à installer, il vous permet de faire des économies<img class=""wy_tableau_right"" src=""https://boulanger.scene7.com/is/image/Boulanger/8015250441000_p2?wid=400&amp;hei=270"" width=""200"" height=""135"" alt=""WPRO MWC171 ANTI CALCAIRE MAGNETIQUE LL OU LV"" /></h3><p>Cet accessoire vous permet de réaliser des <b>économies d'énergie</b> et de produits lavants fort appréciables. Ainsi, votre machine ne perdra pas en efficacité et vous offrira ses services durant de longues années sans devoir utiliser plus d'eau, d'électricité ou de lessive.<br /><br />Inutile de faire appel à un professionnel pour l'installer ! Cet accessoire est <b>simple et rapide à mettre en place</b> et ne vous demandera que quelques minutes pour être opérationnel et vous faire profiter de ses capacités. </p>";PRODUITS ACCESSOIRES
1101460;E4WHPED1;actif;E4WHPED1;56,31;Sans objet;Boulanger Pro;ELECTROLUX;AUTRE;ACCESSOIRE;1,6;60;Oui;7321422617588;Socle réhausseur + panier coulissant intégré !;PRODUITS ACCESSOIRES
1109662;PANIER HB1153W;actif;PANIER HB1153W;268,65;Sans objet;Boulanger Pro;ASKO;GROS ELECTRO MENAGER;ACCESSOIRE;6,3;60;Oui;3838782011184;;PRODUITS ACCESSOIRES
1109664;Double Tablette HDB1153W;actif;Double Tablette HDB1153W;323,93;Sans objet;Boulanger Pro;ASKO;GROS ELECTRO MENAGER;ACCESSOIRE;7,6;60;Oui;3838782010910;;PRODUITS ACCESSOIRES
1109663;Tablette HSS1053W;actif;Tablette HSS1053W;190,83;Sans objet;Boulanger Pro;ASKO;GROS ELECTRO MENAGER;ACCESSOIRE;4,5;60;Oui;3838782011160;;PRODUITS ACCESSOIRES
1111000;ELEMENT D EMPILLAGE POUR LAVE LINGE /;actif;ELEMENT D EMPILLAGE POUR LAVE LINGE /;12,61;Sans objet;Boulanger Pro;XAVAX;AUTRE;ACCESSOIRE;0,5;60;Oui;4047443004949;;PRODUITS ACCESSOIRES
1111131;PIEDS AMORTISSEURS TPR LL/SL/LV;actif;PIEDS AMORTISSEURS TPR LL/SL/LV;4,94;Sans objet;Boulanger Pro;XAVAX;AUTRE;ACCESSOIRE;0,3;60;Oui;4047443005588;;PRODUITS ACCESSOIRES
1111134;TAPIS LL/SL/LV 60X60CM;actif;TAPIS LL/SL/LV 60X60CM;9,48;Sans objet;Boulanger Pro;XAVAX;AUTRE;ACCESSOIRE;0,5;60;Oui;4047443199980;;PRODUITS ACCESSOIRES
1111133;TRANSPORTEUR A ROULETTES P. MACHINE;actif;TRANSPORTEUR A ROULETTES P. MACHINE;21,99;Sans objet;Boulanger Pro;XAVAX;AUTRE;ACCESSOIRE;0,8;60;Oui;4047443198730;;PRODUITS ACCESSOIRES
1111132;SOCLE AVEC TIROIR LL/SL 61X 50CM;actif;SOCLE AVEC TIROIR LL/SL 61X 50CM;65,99;Sans objet;Boulanger Pro;XAVAX;AUTRE;ACCESSOIRE;1,8;60;Oui;4047443290847;;PRODUITS ACCESSOIRES
1099578;Accessoire SAMSUNG Cadre VG-SCFM43DW The Frame Dark Wood;actif;Accessoire SAMSUNG Cadre VG-SCFM43DW The Frame Dark Wood;95,94;Sans objet;Boulanger Pro;SAMSUNG;AUTRE;ACCESSOIRE;2,4;60;Oui;8801643026875;;PRODUITS ACCESSOIRES
1099587;Accessoire SAMSUNG Cadre VG-SCFM43WM The Frame White;actif;Accessoire SAMSUNG Cadre VG-SCFM43WM The Frame White;95,94;Sans objet;Boulanger Pro;SAMSUNG;AUTRE;ACCESSOIRE;2,4;60;Oui;8801643026912;Changez de design en un instant avec le cadre interchangeable. Le choix est vôtre quand il s'agit de The Frame. Profitez d'une sélection de cadres élégants : noyer, chêne et blanc. Choisissez le cadre idéal qui correspond à votre intérieur, à vos goûts ou à l'oeuvre choisie. L'accroche magnétique simple et rapide vous permet de changer le cadre dès que vous le souhaitez.;PRODUITS ACCESSOIRES
1099583;Accessoire SAMSUNG Cadre VG-SCFM43LW The Frame Light Wood;actif;Accessoire SAMSUNG Cadre VG-SCFM43LW The Frame Light Wood;96,1;Sans objet;Boulanger Pro;SAMSUNG;AUTRE;ACCESSOIRE;2,4;60;Oui;8801643027612;Changez de design en un instant avec le cadre interchangeable. Le choix est vôtre quand il s'agit de The Frame. Profitez d'une sélection de cadres élégants : noyer, chêne et blanc. Choisissez le cadre idéal qui correspond à votre intérieur, à vos goûts ou à l'oeuvre choisie. L'accroche magnétique simple et rapide vous permet de changer le cadre dès que vous le souhaitez.;PRODUITS ACCESSOIRES
1116487;Accessoire SAMSUNG Cadre VG-SCFN49DW The Frame Dark Wood;actif;Accessoire SAMSUNG Cadre VG-SCFN49DW The Frame Dark Wood;108,14;Sans objet;Boulanger Pro;SAMSUNG;AUTRE;ACCESSOIRE;2,7;60;Oui;8801643477066;;PRODUITS ACCESSOIRES
1116488;Accessoire SAMSUNG Cadre VG-SCFN49LW The Frame Light Wood;actif;Accessoire SAMSUNG Cadre VG-SCFN49LW The Frame Light Wood;108,14;Sans objet;Boulanger Pro;SAMSUNG;AUTRE;ACCESSOIRE;2,7;60;Oui;8801643477073;;PRODUITS ACCESSOIRES
1116489;Accessoire SAMSUNG Cadre VG-SCFN49WM The Frame White;actif;Accessoire SAMSUNG Cadre VG-SCFN49WM The Frame White;108,14;Sans objet;Boulanger Pro;SAMSUNG;AUTRE;ACCESSOIRE;2,7;60;Oui;8801643477080;;PRODUITS ACCESSOIRES
1103463;Accessoire SAMSUNG Cadre VG-SCFM55CM/XC The Frame Cuivre;actif;Accessoire SAMSUNG Cadre VG-SCFM55CM/XC The Frame Cuivre;127,17;Sans objet;Boulanger Pro;SAMSUNG;AUTRE;ACCESSOIRE;3,1;60;Oui;8806088994277;;PRODUITS ACCESSOIRES
1090849;Accessoire SAMSUNG Cadre VG-SCFM55DW The Frame Dark Wood;actif;Accessoire SAMSUNG Cadre VG-SCFM55DW The Frame Dark Wood;127,4;Sans objet;Boulanger Pro;SAMSUNG;AUTRE;ACCESSOIRE;3,1;60;Oui;8806088885384;;PRODUITS ACCESSOIRES
1090851;Accessoire SAMSUNG Cadre VG-SCFM55LW The Frame Light Wood;actif;Accessoire SAMSUNG Cadre VG-SCFM55LW The Frame Light Wood;127,4;Sans objet;Boulanger Pro;SAMSUNG;AUTRE;ACCESSOIRE;3,1;60;Oui;8806088885391;;PRODUITS ACCESSOIRES
1090853;Accessoire SAMSUNG Cadre VG-SCFM55WM The Frame White;actif;Accessoire SAMSUNG Cadre VG-SCFM55WM The Frame White;127,4;Sans objet;Boulanger Pro;SAMSUNG;AUTRE;ACCESSOIRE;3,1;60;Oui;8806088885223;;PRODUITS ACCESSOIRES
1090850;Accessoire SAMSUNG Cadre VG-SCFM65DW The Frame Dark Wood;actif;Accessoire SAMSUNG Cadre VG-SCFM65DW The Frame Dark Wood;158,38;Sans objet;Boulanger Pro;SAMSUNG;AUTRE;ACCESSOIRE;3,8;60;Oui;8806088885407;;PRODUITS ACCESSOIRES
1103464;Accessoire SAMSUNG Cadre VG-SCFM65CM/XC The Frame Cuivre;actif;Accessoire SAMSUNG Cadre VG-SCFM65CM/XC The Frame Cuivre;158,38;Sans objet;Boulanger Pro;SAMSUNG;AUTRE;ACCESSOIRE;3,8;60;Oui;8806088994284;;PRODUITS ACCESSOIRES
1090852;Accessoire SAMSUNG Cadre VG-SCFM65LW The Frame Light Wood;actif;Accessoire SAMSUNG Cadre VG-SCFM65LW The Frame Light Wood;158,7;Sans objet;Boulanger Pro;SAMSUNG;AUTRE;ACCESSOIRE;3,8;60;Oui;8806088885414;;PRODUITS ACCESSOIRES
1090854;Accessoire SAMSUNG Cadre VG-SCFM65WM The Frame White;actif;Accessoire SAMSUNG Cadre VG-SCFM65WM The Frame White;158,7;Sans objet;Boulanger Pro;SAMSUNG;AUTRE;ACCESSOIRE;3,8;60;Oui;8806088885421;;PRODUITS ACCESSOIRES
1086596;Accessoire SAMSUNG Pied TV STUDIO QLED/The Frame;actif;Accessoire SAMSUNG Pied TV STUDIO QLED/The Frame;399,52;Sans objet;Boulanger Pro;SAMSUNG;AUTRE;ACCESSOIRE;9,3;60;Oui;8806088826486;;PRODUITS ACCESSOIRES
1107033;Support mural SAMSUNG 2018 ultra fin QLED 49/65';actif;Support mural SAMSUNG 2018 ultra fin QLED 49/65';98,92;Sans objet;Boulanger Pro;SAMSUNG;MULTIMEDIA;ACCESSOIRE;2,5;60;Oui;8801643258054;;PRODUITS ACCESSOIRES
1107036;Support mural SAMSUNG 2018 ultra fin QLED 75'';actif;Support mural SAMSUNG 2018 ultra fin QLED 75'';116,02;Sans objet;Boulanger Pro;SAMSUNG;MULTIMEDIA;ACCESSOIRE;2,9;60;Oui;8801643258092;;PRODUITS ACCESSOIRES
8001874;Câble HDMI ESSENTIELB 2M CROSS nylon H;actif;Câble HDMI ESSENTIELB 2M CROSS nylon H;16,64;Sans objet;Boulanger Pro;ESSENTIEL B;MULTIMEDIA;ACCESSOIRE;0,6;60;Oui;3497674100964;;PRODUITS ACCESSOIRES
1022160;Câble HDMI MONSTERCABLE 1M50 UHD 27Gbps compatible 8K;actif;Câble HDMI MONSTERCABLE 1M50 UHD 27Gbps compatible 8K;55,98;Sans objet;Boulanger Pro;MONSTERCABLE;MULTIMEDIA;ACCESSOIRE;1,5;60;Oui;50644683633;"<p>Câble HDMI audio et vidéo numérique à <b>performance ultime</b> pouvant supporter un débit minimum certifié de<b> 27 Gigabit</b>/sec. Idéal pour profiter de toute la performance d'un écran <b>TV Ultra HD (4K) en 50 ou 100 images/seconde</b>, d'un écran <b>HDTV 1080p 3D</b>, d'une source vidéo HD ou d'un <b>lecteur Blu-ray 3D (4K upscaller)</b>, d'un amplificateur A/V (<b>Couleur 16-bit</b>), d'un media center HD et des nouvelles consoles de jeux Ultra HD. Profitez d'une qualité ultime d'image en ultra HD, (ce câble est également compatible avec la future génération de matériel <b>Ultra HD 8K</b>), avec une plus large palette de couleurs, plus profondes et éclatantes (<b>Couleur 8-16 bit</b>), et d'un son multicanal DTS HD ou <b>Dolby True HD</b> d'une clarté et d'une précision saisissante. </p><p><b>Les connecteurs HDMI Monster V-Grip</b> brevetés offrent une fiabilité de connexion accrue (quatre fois plus fiable qu'avec des connecteurs ordinaires) et sont <b>plaqués à l'or pur (24 Carats)</b> pour éviter l'oxydation et la corrosion qui réduisent la bande passante du câble (débit du signal) de façon irréversible. </p><p>Un <b>triple blindage haute densité</b> protège le signal HDMI contre les interférences radio et électromagnétiques pour éviter les pertes de signal pouvant dégrader la qualité de l'image et du son. </p><p>Ce câble bénéficie de la garantie exclusive de performance à vie <b>Monster ""CABLE FOR LIFE""</b>. Tout comme les sources numériques et les écrans TV HD continuent d'évoluer, la bande passante et la performance du câble HDMI doivent également continuer d'augmenter. Si, à l'avenir, le matériel que vous achetez vient à dépasser les performances de ce câble, Monster le remplacera gratuitement (par un nouveau câble capable de répondre aux nouveaux besoins en bande passante de votre futur matériel A/V HD). </p><p>La garantie à vie <b>Monster ""LIVE FOREVER""</b> vous protège contre tout défaut de fabrication du câble. </p>";PRODUITS ACCESSOIRES
1107020;Accessoire SAMSUNG Cable Invisible Fibre+Alim 15m 2018 QLED;actif;Accessoire SAMSUNG Cable Invisible Fibre+Alim 15m 2018 QLED;193,17;Sans objet;Boulanger Pro;SAMSUNG;AUTRE;ACCESSOIRE;4,6;60;Oui;8801643276614;;PRODUITS ACCESSOIRES
1086597;Accessoire SAMSUNG Cable Invisible Fibre 15m 2017 QLEDFRAME;actif;Accessoire SAMSUNG Cable Invisible Fibre 15m 2017 QLEDFRAME;198,83;Sans objet;Boulanger Pro;SAMSUNG;AUTRE;ACCESSOIRE;4,7;60;Oui;8806088815602;;PRODUITS ACCESSOIRES
141750;Graveur APPLE SuperDriveUSB;actif;Graveur APPLE SuperDriveUSB;61,74;Sans objet;Boulanger Pro;APPLE;INFORMATIQUE;ACCESSOIRE;2,4;36;Oui;885909575794;"<p>A  emporter partout.<br /><br />A peine plus volumineux qu'un boîtier de CD, le SuperDrive USB Apple se glisse facilement dans votre sacoche lorsque vous prenez la route et occupe un minimum d'espace sur votre table de travail, au bureau ou à la maison.<br /><br />La simplicité même.<br /><br />Vous n'aurez plus à vous soucier de câbles égarés avec le SuperDrive USB Apple. Un unique câble USB intégré vous permet de le connecter à votre MacBook Pro avec écran Retina, MacBook Air, iMac (fin 2012) et modèles ultérieurs, Mac mini (fin 2009) et modèles ultérieurs, Mac Pro (fin 2013). Il ne s'encombre d'aucun bloc secteur séparé et fonctionne sans problème, que votre Mac soit relié à une prise secteur ou qu'il soit sur la batterie.</p>
";PRODUITS ACCESSOIRES
1097121;APPLE TV 4K 64Go;actif;APPLE TV 4K 64Go;182,416667;Sans objet;Boulanger Pro;APPLE;INFORMATIQUE;ACCESSOIRE;6,5;36;Oui;190198463470;"<p>Ingénieuse, connectée et facile à utiliser, l'APPLE TV 4K 64 Go est compatible avec un grand nombre de téléviseurs. Équipée du Wi-Fi et du Bluetooth, elle vous donne accès à une multitude de contenus. Elle vous fera vivre une expérience de divertissement immersive et inoubliable.</p><h3>Une image de qualité pour une TV adaptable<img class=""wy_tableau_gauche"" src=""https://boulanger.scene7.com/is/image/Boulanger/0190198463470_h_f_l_0?wid=400&amp;hei=270"" width=""200"" height=""135"" alt=""APPLE TV 4K 64Go"" /></h3><p><b>Compatible avec tous les téléviseurs HD et UHD équipé d'une prise HDMI</b>, l'APPLE TV 4K 64 Go va bien vite s'imposer comme un indispensable en matière de divertissement chez vous. Offrant une capacité de stockage de 64 Go, elle pourra garder en mémoire une grande variété d'éléments que vous ne souhaitez pas perdre.<br /><br />Elle dévoile <b>des couleurs plus réalistes et éclatantes, ainsi que des images plus nettes</b>. Sa résolution est très haute, car elle est capable de lire vos films et séries en 4K HDR. Avec l'APPLE TV, vous vivez donc une expérience immersive et suivez vos héros dans toutes leurs aventures, sans pour autant quitter votre fauteuil.<br /><br /></p><h3>Un appareil ingénieux et connecté<img class=""wy_tableau_right"" src=""https://boulanger.scene7.com/is/image/Boulanger/0190198463470_h_f_l_1?wid=400&amp;hei=270"" width=""200"" height=""135"" alt=""APPLE TV 4K 64Go"" /></h3><p>L'APPLE TV 4K 64 Go vous permet de <b>partager et de diffuser vos photos depuis la bibliothèque iCloud</b>. En plus de garder en mémoire certains de vos éléments, elle vous offre un accès supplémentaire à un espace de stockage infini. Vous pourrez par exemple montrer tous vos clichés capturés durant vos dernières vacances avec cet appareil.<br /><br />Fournie <b>avec une télécommande</b>, l'APPLE TV est facile à utiliser. Elle est également dotée des <b>technologies de Bluetooth et du Wi-Fi</b> pour vous se connecter à tous vos appareils sans fil.</p>";PRODUITS ACCESSOIRES
