1053588,Hotte décorative ROSIERES RBVSI985IN,actif,Hotte décorative ROSIERES RBVSI985IN,"347,65",Fixe,Boulanger Pro,ROSIERES,GROS ELECTRO MENAGER,Hotte,"12,2",60,Oui,8016361906020,Hotte décorative ROSIERES RBVSI985IN,Produit principal
1025365,Hotte décorative SIEMENS LC67BB532,actif,Hotte décorative SIEMENS LC67BB532,"243,84",Fixe,Boulanger Pro,SIEMENS,GROS ELECTRO MENAGER,Hotte,"10,5",60,Oui,4242003650295,Hotte décorative SIEMENS LC67BB532,Produit principal
1089710,Hotte décorative SIEMENS LC87KHM60,actif,Hotte décorative SIEMENS LC87KHM60,"438,23",Fixe,Boulanger Pro,SIEMENS,GROS ELECTRO MENAGER,Hotte,"14,1",60,Oui,4242003760994,Hotte décorative SIEMENS LC87KHM60,Produit principal
1025366,Hotte décorative SIEMENS LC97BD532,actif,Hotte décorative SIEMENS LC97BD532,"284,77",Fixe,Boulanger Pro,SIEMENS,GROS ELECTRO MENAGER,Hotte,"11,7",60,Oui,4242003650004,Hotte décorative SIEMENS LC97BD532,Produit principal
1085761,Hotte décorative TURBOAIR THUNDER BL/A/60/LX,actif,Hotte décorative TURBOAIR THUNDER BL/A/60/LX,"204,37",Fixe,Boulanger Pro,TURBOAIR,GROS ELECTRO MENAGER,Hotte,"9,5",60,Oui,8020283039650,Hotte décorative TURBOAIR THUNDER BL/A/60/LX,Produit principal
1072511,Hotte décorative WHIRLPOOL AKR037GBL,actif,Hotte décorative WHIRLPOOL AKR037GBL,"238,42",Fixe,Boulanger Pro,WHIRLPOOL,GROS ELECTRO MENAGER,Hotte,"10,3",60,Oui,8003437219368,Hotte décorative WHIRLPOOL AKR037GBL,Produit principal
1101512,Hotte LEISURE H112K,actif,Hotte LEISURE H112K,"221,41",Fixe,Boulanger Pro,LEISURE,GROS ELECTRO MENAGER,Hotte,"9,9",60,Oui,8690842157882,Hotte LEISURE H112K,Produit principal
1076875,Hotte MIELE DA1260IN,actif,Hotte MIELE DA1260IN,"235,89",Fixe,Boulanger Pro,MIELE,GROS ELECTRO MENAGER,Hotte,"10,3",60,Oui,4002515785669,Hotte MIELE DA1260IN,Produit principal
1011980,Lave linge compact CANDY AQUA1042D1,actif,Lave linge compact CANDY AQUA1042D1,"340,13",Fixe,Boulanger Pro,CANDY,GROS ELECTRO MENAGER,Lave Linge,"13,4",60,Oui,8016361860339,Lave linge compact CANDY AQUA1042D1,Produit principal
1021834,Lave linge compact DAEWOO DWD-CV701PC,actif,Lave linge compact DAEWOO DWD-CV701PC,"304,22",Fixe,Boulanger Pro,DAEWOO,GROS ELECTRO MENAGER,Lave Linge,"12,2",60,Oui,8806323309897,Lave linge compact DAEWOO DWD-CV701PC,Produit principal
1111082,Lave linge compact LG TWINWash Mini FM37E1WH,actif,Lave linge compact LG TWINWash Mini FM37E1WH,"223,99",Fixe,Boulanger Pro,LG,GROS ELECTRO MENAGER,Lave Linge,"11,8",60,Oui,8806084940865,Lave linge compact LG TWINWash Mini FM37E1WH,Produit principal
1075333,Lave linge compact SAMSUNG WW80K5210VW,actif,Lave linge compact SAMSUNG WW80K5210VW,"410,48",Fixe,Boulanger Pro,SAMSUNG,GROS ELECTRO MENAGER,Lave Linge,"15,3",60,Oui,8806088479293,Lave linge compact SAMSUNG WW80K5210VW,Produit principal
1106188,Lave linge hublot BEKO EX WTE7733XC0M,actif,Lave linge hublot BEKO EX WTE7733XC0M,"236,63",Fixe,Boulanger Pro,BEKO,GROS ELECTRO MENAGER,Lave Linge,"11,6",60,Oui,8690842201745,Lave linge hublot BEKO EX WTE7733XC0M,Produit principal
1099776,Lave linge hublot BEKO WTV8734XC0M GREY,actif,Lave linge hublot BEKO WTV8734XC0M GREY,"287,5",Fixe,Boulanger Pro,BEKO,GROS ELECTRO MENAGER,Lave Linge,"12,8",60,Oui,8690842121036,Lave linge hublot BEKO WTV8734XC0M GREY,Produit principal
1019579,Lave linge hublot BOSCH WAB24211FF,actif,Lave linge hublot BOSCH WAB24211FF,"271,35",Fixe,Boulanger Pro,BOSCH,GROS ELECTRO MENAGER,Lave Linge,"12,5",60,Oui,4242002805535,Lave linge hublot BOSCH WAB24211FF,Produit principal
1106719,Lave linge hublot BOSCH WAT28619FF,actif,Lave linge hublot BOSCH WAT28619FF,"497,28",Fixe,Boulanger Pro,BOSCH,GROS ELECTRO MENAGER,Lave Linge,"17,3",60,Oui,4242005026838,Lave linge hublot BOSCH WAT28619FF,Produit principal
1070111,Lave linge hublot BOSCH WAW 28750FF ACTIVE OXYGENE,actif,Lave linge hublot BOSCH WAW 28750FF ACTIVE OXYGENE,"611,12",Fixe,Boulanger Pro,BOSCH,GROS ELECTRO MENAGER,Lave Linge,20,60,Oui,4242002899596,Lave linge hublot BOSCH WAW 28750FF ACTIVE OXYGENE,Produit principal
1107533,Lave linge hublot CANDY CSS 1410TR3/1-47,actif,Lave linge hublot CANDY CSS 1410TR3/1-47,"258,9",Fixe,Boulanger Pro,CANDY,GROS ELECTRO MENAGER,Lave Linge,"12,2",60,Oui,8016361962705,Lave linge hublot CANDY CSS 1410TR3/1-47,Produit principal
1107535,Lave linge hublot CANDY CSS1410TC3B/1-47,actif,Lave linge hublot CANDY CSS1410TC3B/1-47,"286,35",Fixe,Boulanger Pro,CANDY,GROS ELECTRO MENAGER,Lave Linge,"12,6",60,Oui,8016361962712,Lave linge hublot CANDY CSS1410TC3B/1-47,Produit principal
1107627,Lave linge hublot CANDY GVS 1413TH3/1-47,actif,Lave linge hublot CANDY GVS 1413TH3/1-47,"356,85",Fixe,Boulanger Pro,CANDY,GROS ELECTRO MENAGER,Lave Linge,"14,5",60,Oui,8016361962835,Lave linge hublot CANDY GVS 1413TH3/1-47,Produit principal
1096685,Lave linge hublot ELECTROLUX EW6F3910RA Perfect Care,actif,Lave linge hublot ELECTROLUX EW6F3910RA Perfect Care,"386,5",Fixe,Boulanger Pro,ELECTROLUX,GROS ELECTRO MENAGER,Lave Linge,"14,9",60,Oui,7332543584178,Lave linge hublot ELECTROLUX EW6F3910RA Perfect Care,Produit principal
1096684,Lave linge hublot ELECTROLUX EW6F4810RA,actif,Lave linge hublot ELECTROLUX EW6F4810RA,"295,56",Fixe,Boulanger Pro,ELECTROLUX,GROS ELECTRO MENAGER,Lave Linge,13,60,Oui,7332543578252,Lave linge hublot ELECTROLUX EW6F4810RA,Produit principal
1107609,Lave linge hublot ELECTROLUX EW7F2912SP PerfectCare,actif,Lave linge hublot ELECTROLUX EW7F2912SP PerfectCare,"420,28",Fixe,Boulanger Pro,ELECTROLUX,GROS ELECTRO MENAGER,Lave Linge,"15,7",60,Oui,7332543588237,Lave linge hublot ELECTROLUX EW7F2912SP PerfectCare,Produit principal
1070349,Lave linge hublot ELECTROLUX EX EWF1484 SSW,actif,Lave linge hublot ELECTROLUX EX EWF1484 SSW,"269,81",Fixe,Boulanger Pro,ELECTROLUX,GROS ELECTRO MENAGER,Lave Linge,"12,3",60,Oui,7332543486823,Lave linge hublot ELECTROLUX EX EWF1484 SSW,Produit principal
1049945,Lave linge hublot HOTPOINT RPG 945 JS FR,actif,Lave linge hublot HOTPOINT RPG 945 JS FR,"292,47",Fixe,Boulanger Pro,HOTPOINT,GROS ELECTRO MENAGER,Lave Linge,"12,9",60,Oui,8007842891652,Lave linge hublot HOTPOINT RPG 945 JS FR,Produit principal
1107678,Lave linge hublot INDESIT XWE 71452 WSG FR,actif,Lave linge hublot INDESIT XWE 71452 WSG FR,"230,6",Fixe,Boulanger Pro,INDESIT,GROS ELECTRO MENAGER,Lave Linge,"11,4",60,Oui,8007842855753,Lave linge hublot INDESIT XWE 71452 WSG FR,Produit principal
1101210,Lave linge hublot intégrable BEKO WITC7612B0W,actif,Lave linge hublot intégrable BEKO WITC7612B0W,"368,64",Fixe,Boulanger Pro,BEKO,GROS ELECTRO MENAGER,Lave Linge,"14,6",60,Oui,8690842121111,Lave linge hublot intégrable BEKO WITC7612B0W,Produit principal
1101222,Lave linge hublot intégrable BEKO WITV8714B0W,actif,Lave linge hublot intégrable BEKO WITV8714B0W,"389,91",Fixe,Boulanger Pro,BEKO,GROS ELECTRO MENAGER,Lave Linge,15,60,Oui,8690842109911,Lave linge hublot intégrable BEKO WITV8714B0W,Produit principal
1087678,Lave linge hublot LG EX-F74J60SWH,actif,Lave linge hublot LG EX-F74J60SWH,"304,05",Fixe,Boulanger Pro,LG,GROS ELECTRO MENAGER,Lave Linge,13,60,Oui,8806087857597,Lave linge hublot LG EX-F74J60SWH,Produit principal
1108683,Lave linge hublot LG F14J82WHST,actif,Lave linge hublot LG F14J82WHST,"481,73",Fixe,Boulanger Pro,LG,GROS ELECTRO MENAGER,Lave Linge,"17,4",60,Oui,8806098231027,Lave linge hublot LG F14J82WHST,Produit principal
1109302,Lave linge hublot LG F94J72STST,actif,Lave linge hublot LG F94J72STST,"397,66",Fixe,Boulanger Pro,LG,GROS ELECTRO MENAGER,Lave Linge,"15,2",60,Oui,8806098241927,Lave linge hublot LG F94J72STST,Produit principal
1091607,Lave linge hublot LG TurboWash F24G1GWHS,actif,Lave linge hublot LG TurboWash F24G1GWHS,"737,16",Fixe,Boulanger Pro,LG,GROS ELECTRO MENAGER,Lave Linge,"22,3",60,Oui,8806084546401,Lave linge hublot LG TurboWash F24G1GWHS,Produit principal
1085965,Lave linge hublot MIELE WDB 020,actif,Lave linge hublot MIELE WDB 020,"601,04",Fixe,Boulanger Pro,MIELE,GROS ELECTRO MENAGER,Lave Linge,20,60,Oui,4002515812631,Lave linge hublot MIELE WDB 020,Produit principal
1087135,Lave linge hublot SAMSUNG WF16J6500EW Blanc,actif,Lave linge hublot SAMSUNG WF16J6500EW Blanc,"755,99",Fixe,Boulanger Pro,SAMSUNG,GROS ELECTRO MENAGER,Lave Linge,"23,8",60,Oui,8806088662442,Lave linge hublot SAMSUNG WF16J6500EW Blanc,Produit principal
1106007,Lave linge hublot SAMSUNG WW70J5355FX,actif,Lave linge hublot SAMSUNG WW70J5355FX,"343,3",Fixe,Boulanger Pro,SAMSUNG,GROS ELECTRO MENAGER,Lave Linge,14,60,Oui,8806088732480,Lave linge hublot SAMSUNG WW70J5355FX,Produit principal
1086581,Lave linge hublot SAMSUNG WW80J5555FW,actif,Lave linge hublot SAMSUNG WW80J5555FW,"310,92",Fixe,Boulanger Pro,SAMSUNG,GROS ELECTRO MENAGER,Lave Linge,"13,2",60,Oui,8806088732831,Lave linge hublot SAMSUNG WW80J5555FW,Produit principal
1067076,Lave linge hublot SAMSUNG WW80K6414QW,actif,Lave linge hublot SAMSUNG WW80K6414QW,"415,08",Fixe,Boulanger Pro,SAMSUNG,GROS ELECTRO MENAGER,Lave Linge,"15,4",60,Oui,8806088193649,Lave linge hublot SAMSUNG WW80K6414QW,Produit principal
1105314,Lave linge hublot SAMSUNG WW80M645OQM/EF,actif,Lave linge hublot SAMSUNG WW80M645OQM/EF,"540,33",Fixe,Boulanger Pro,SAMSUNG,GROS ELECTRO MENAGER,Lave Linge,"18,2",60,Oui,8801643135805,Lave linge hublot SAMSUNG WW80M645OQM/EF,Produit principal
1086010,Lave linge hublot SAMSUNG WW8BK5210UW,actif,Lave linge hublot SAMSUNG WW8BK5210UW,"335,08",Fixe,Boulanger Pro,SAMSUNG,GROS ELECTRO MENAGER,Lave Linge,"13,7",60,Oui,8806088845678,Lave linge hublot SAMSUNG WW8BK5210UW,Produit principal
1067079,Lave linge hublot SAMSUNG WW90K5413WW,actif,Lave linge hublot SAMSUNG WW90K5413WW,"417,72",Fixe,Boulanger Pro,SAMSUNG,GROS ELECTRO MENAGER,Lave Linge,"15,4",60,Oui,8806088194059,Lave linge hublot SAMSUNG WW90K5413WW,Produit principal
1037799,Lave linge hublot SIEMENS WM12B211F,actif,Lave linge hublot SIEMENS WM12B211F,"271,7",Fixe,Boulanger Pro,SIEMENS,GROS ELECTRO MENAGER,Lave Linge,"12,5",60,Oui,4242003678749,Lave linge hublot SIEMENS WM12B211F,Produit principal
1088675,Lave linge hublot WHIRLPOOL FRESHCARE FWG91484WSFR,actif,Lave linge hublot WHIRLPOOL FRESHCARE FWG91484WSFR,"296,85",Fixe,Boulanger Pro,WHIRLPOOL,GROS ELECTRO MENAGER,Lave Linge,13,60,Oui,8003437208454,Lave linge hublot WHIRLPOOL FRESHCARE FWG91484WSFR,Produit principal
1104093,Lave linge hublot WHIRLPOOL FWF81283W2FR,actif,Lave linge hublot WHIRLPOOL FWF81283W2FR,"252,63",Fixe,Boulanger Pro,WHIRLPOOL,GROS ELECTRO MENAGER,Lave Linge,"12,1",60,Oui,8003437208393,Lave linge hublot WHIRLPOOL FWF81283W2FR,Produit principal
1107679,Lave linge hublot WHIRLPOOL ZEN 8,actif,Lave linge hublot WHIRLPOOL ZEN 8,"357,63",Fixe,Boulanger Pro,WHIRLPOOL,GROS ELECTRO MENAGER,Lave Linge,"14,6",60,Oui,8003437263293,Lave linge hublot WHIRLPOOL ZEN 8,Produit principal
1049815,Lave linge top BOSCH WOR 24156FF,actif,Lave linge top BOSCH WOR 24156FF,"332,496667",Fixe,Boulanger Pro,BOSCH,GROS ELECTRO MENAGER,Lave Linge,"13,6",60,Oui,4242002861951,Lave linge top BOSCH WOR 24156FF,Produit principal
1108236,Lave linge top BRANDT BT8652M,actif,Lave linge top BRANDT BT8652M,"255,17",Fixe,Boulanger Pro,BRANDT,GROS ELECTRO MENAGER,Lave Linge,"11,8",60,Oui,6133826004328,Lave linge top BRANDT BT8652M,Produit principal
1108195,Lave linge top CANDY EX CST G384D-47,actif,Lave linge top CANDY EX CST G384D-47,"273,24",Fixe,Boulanger Pro,CANDY,GROS ELECTRO MENAGER,Lave Linge,"12,2",60,Oui,8016361935839,Lave linge top CANDY EX CST G384D-47,Produit principal
1078511,Lave linge top ELECTROLUX EWT1376 HL1,actif,Lave linge top ELECTROLUX EWT1376 HL1,"324,77",Fixe,Boulanger Pro,ELECTROLUX,GROS ELECTRO MENAGER,Lave Linge,"13,5",60,Oui,7332543469284,Lave linge top ELECTROLUX EWT1376 HL1,Produit principal
1092417,Lave linge top ELECTROLUX EX EWT 1365EL2,actif,Lave linge top ELECTROLUX EX EWT 1365EL2,"284,55",Fixe,Boulanger Pro,ELECTROLUX,GROS ELECTRO MENAGER,Lave Linge,"12,6",60,Oui,7332543573950,Lave linge top ELECTROLUX EX EWT 1365EL2,Produit principal
1103691,Lave linge top FAURE FWQ6328C,actif,Lave linge top FAURE FWQ6328C,"226,81",Fixe,Boulanger Pro,FAURE,GROS ELECTRO MENAGER,Lave Linge,"11,4",60,Oui,7332543615780,Lave linge top FAURE FWQ6328C,Produit principal
1008917,Lave linge top VEDETTE VLT8384,actif,Lave linge top VEDETTE VLT8384,"414,78",Fixe,Boulanger Pro,VEDETTE,GROS ELECTRO MENAGER,Lave Linge,"15,8",60,Oui,3660767205550,Lave linge top VEDETTE VLT8384,Produit principal
1070241,Lave linge top VEDETTE VT 653MQ,actif,Lave linge top VEDETTE VT 653MQ,"280,35",Fixe,Boulanger Pro,VEDETTE,GROS ELECTRO MENAGER,Lave Linge,"12,3",60,Oui,6133826002225,Lave linge top VEDETTE VT 653MQ,Produit principal
1067634,Lave linge top VEDETTE VT602B,actif,Lave linge top VEDETTE VT602B,"238,38",Fixe,Boulanger Pro,VEDETTE,GROS ELECTRO MENAGER,Lave Linge,"11,4",60,Oui,6133826002157,Lave linge top VEDETTE VT602B,Produit principal
1072495,Lave linge top WHIRLPOOL AWE 6215,actif,Lave linge top WHIRLPOOL AWE 6215,"250,84",Fixe,Boulanger Pro,WHIRLPOOL,GROS ELECTRO MENAGER,Lave Linge,"11,7",60,Oui,8003437724619,Lave linge top WHIRLPOOL AWE 6215,Produit principal
1017110,Lave linge top WHIRLPOOL AWE6235,actif,Lave linge top WHIRLPOOL AWE6235,"258,51",Fixe,Boulanger Pro,WHIRLPOOL,GROS ELECTRO MENAGER,Lave Linge,"11,9",60,Oui,8003437722394,Lave linge top WHIRLPOOL AWE6235,Produit principal
1057152,Lave linge top WHIRLPOOL TDLR 60230,actif,Lave linge top WHIRLPOOL TDLR 60230,"338,57",Fixe,Boulanger Pro,WHIRLPOOL,GROS ELECTRO MENAGER,Lave Linge,"13,6",60,Oui,8003437726859,Lave linge top WHIRLPOOL TDLR 60230,Produit principal
1057154,Lave linge top WHIRLPOOL TDLR 70210,actif,Lave linge top WHIRLPOOL TDLR 70210,"311,18",Fixe,Boulanger Pro,WHIRLPOOL,GROS ELECTRO MENAGER,Lave Linge,"13,3",60,Oui,8003437727078,Lave linge top WHIRLPOOL TDLR 70210,Produit principal
1057155,Lave linge top WHIRLPOOL TDLR 70230,actif,Lave linge top WHIRLPOOL TDLR 70230,"358,95",Fixe,Boulanger Pro,WHIRLPOOL,GROS ELECTRO MENAGER,Lave Linge,"14,4",60,Oui,8003437726767,Lave linge top WHIRLPOOL TDLR 70230,Produit principal
1090532,Lave linge séchant hublot BEKO WTLD81487P,actif,Lave linge séchant hublot BEKO WTLD81487P,"331,72",Fixe,Boulanger Pro,BEKO,GROS ELECTRO MENAGER,Lave Linge,"13,8",60,Oui,8690842152436,Lave linge séchant hublot BEKO WTLD81487P,Produit principal
1107955,Lave linge séchant hublot CANDY CSWS 485T-47,actif,Lave linge séchant hublot CANDY CSWS 485T-47,"326,05",Fixe,Boulanger Pro,CANDY,GROS ELECTRO MENAGER,Lave Linge,"13,5",60,Oui,8016361962620,Lave linge séchant hublot CANDY CSWS 485T-47,Produit principal
1109568,Lave linge séchant hublot LG F174J82WRHT,actif,Lave linge séchant hublot LG F174J82WRHT,"588,63",Fixe,Boulanger Pro,LG,GROS ELECTRO MENAGER,Lave Linge,"19,5",60,Oui,8806098087150,Lave linge séchant hublot LG F174J82WRHT,Produit principal
1087696,Lave linge séchant hublot LG F286G1GWRH,actif,Lave linge séchant hublot LG F286G1GWRH,"823,5",Fixe,Boulanger Pro,LG,GROS ELECTRO MENAGER,Lave Linge,"24,1",60,Oui,8806084546814,Lave linge séchant hublot LG F286G1GWRH,Produit principal
1084677,Lave linge séchant hublot LG F854G63WR,actif,Lave linge séchant hublot LG F854G63WR,"414,78",Fixe,Boulanger Pro,LG,GROS ELECTRO MENAGER,Lave Linge,"15,6",60,Oui,8806087916812,Lave linge séchant hublot LG F854G63WR,Produit principal
1104058,Lave linge séchant hublot SAMSUNG WD70J5A10AW,actif,Lave linge séchant hublot SAMSUNG WD70J5A10AW,"460,4",Fixe,Boulanger Pro,SAMSUNG,GROS ELECTRO MENAGER,Lave Linge,"16,4",60,Oui,8801643114275,Lave linge séchant hublot SAMSUNG WD70J5A10AW,Produit principal
1104040,Lave linge séchant hublot SAMSUNG WD80J6A10AW,actif,Lave linge séchant hublot SAMSUNG WD80J6A10AW,"492,39",Fixe,Boulanger Pro,SAMSUNG,GROS ELECTRO MENAGER,Lave Linge,"17,2",60,Oui,8801643114473,Lave linge séchant hublot SAMSUNG WD80J6A10AW,Produit principal
1104034,Lave linge séchant hublot SAMSUNG WD80K5B10OX,actif,Lave linge séchant hublot SAMSUNG WD80K5B10OX,"534,24",Fixe,Boulanger Pro,SAMSUNG,GROS ELECTRO MENAGER,Lave Linge,"18,1",60,Oui,8801643114619,Lave linge séchant hublot SAMSUNG WD80K5B10OX,Produit principal
1111772,Lave linge séchant hublot SAMSUNG WD80N645OAM,actif,Lave linge séchant hublot SAMSUNG WD80N645OAM,"599,61",Fixe,Boulanger Pro,SAMSUNG,GROS ELECTRO MENAGER,Lave Linge,"19,7",60,Oui,8801643157685,Lave linge séchant hublot SAMSUNG WD80N645OAM,Produit principal
1106406,Lave linge séchant hublot SAMSUNG WD90N645OOM/EF,actif,Lave linge séchant hublot SAMSUNG WD90N645OOM/EF,"623,57",Fixe,Boulanger Pro,SAMSUNG,GROS ELECTRO MENAGER,Lave Linge,"20,2",60,Oui,8801643135706,Lave linge séchant hublot SAMSUNG WD90N645OOM/EF,Produit principal
1078598,Lave linge séchant intégrable BEKO WDI 85143,actif,Lave linge séchant intégrable BEKO WDI 85143,"414,78",Fixe,Boulanger Pro,BEKO,GROS ELECTRO MENAGER,Lave Linge,"15,4",60,Oui,8690842031717,Lave linge séchant intégrable BEKO WDI 85143,Produit principal
1087188,Lave linge séchant intégrable CANDY CBWD 8514D-S,actif,Lave linge séchant intégrable CANDY CBWD 8514D-S,"477,97",Fixe,Boulanger Pro,CANDY,GROS ELECTRO MENAGER,Lave Linge,"16,7",60,Oui,8016361933484,Lave linge séchant intégrable CANDY CBWD 8514D-S,Produit principal
1009012,Lave linge séchant Top BRANDT WTD 8284,actif,Lave linge séchant Top BRANDT WTD 8284,"558,63",Fixe,Boulanger Pro,BRANDT,GROS ELECTRO MENAGER,Lave Linge,"18,6",60,Oui,3660767201750,Lave linge séchant Top BRANDT WTD 8284,Produit principal
1108689,Lave vaisselle 45cm BEKO DFS28120S,actif,Lave vaisselle 45cm BEKO DFS28120S,"259,38",Fixe,Boulanger Pro,BEKO,GROS ELECTRO MENAGER,Lave Linge,"11,6",60,Oui,8690842191107,Lave vaisselle 45cm BEKO DFS28120S,Produit principal
1105676,Lave vaisselle 45cm BOSCH SPS25CW04E,actif,Lave vaisselle 45cm BOSCH SPS25CW04E,"302,08",Fixe,Boulanger Pro,BOSCH,GROS ELECTRO MENAGER,Lave Linge,"12,6",60,Oui,4242005068333,Lave vaisselle 45cm BOSCH SPS25CW04E,Produit principal
1105985,Lave vaisselle 45cm SIEMENS SR236I00ME,actif,Lave vaisselle 45cm SIEMENS SR236I00ME,"373,54",Fixe,Boulanger Pro,SIEMENS,GROS ELECTRO MENAGER,Lave Linge,"14,1",60,Oui,4242003822036,Lave vaisselle 45cm SIEMENS SR236I00ME,Produit principal
1085592,Lave vaisselle 45cm WHIRLPOOL ADP 522WH,actif,Lave vaisselle 45cm WHIRLPOOL ADP 522WH,"369,54",Fixe,Boulanger Pro,WHIRLPOOL,GROS ELECTRO MENAGER,Lave Linge,"13,9",60,Oui,8003437220852,Lave vaisselle 45cm WHIRLPOOL ADP 522WH,Produit principal
1086300,Lave vaisselle 60cm BOSCH SMS25AW00F,actif,Lave vaisselle 60cm BOSCH SMS25AW00F,"281,97",Fixe,Boulanger Pro,BOSCH,GROS ELECTRO MENAGER,Lave Linge,"12,1",60,Oui,4242005036301,Lave vaisselle 60cm BOSCH SMS25AW00F,Produit principal
1078921,Lave vaisselle 60cm BOSCH SMS25GW02E,actif,Lave vaisselle 60cm BOSCH SMS25GW02E,"301,61",Fixe,Boulanger Pro,BOSCH,GROS ELECTRO MENAGER,Lave Linge,"12,8",60,Oui,4242002976716,Lave vaisselle 60cm BOSCH SMS25GW02E,Produit principal
1021547,Lave vaisselle 60cm BOSCH SMS40D18EU,actif,Lave vaisselle 60cm BOSCH SMS40D18EU,"316,23",Fixe,Boulanger Pro,BOSCH,GROS ELECTRO MENAGER,Lave Linge,"13,1",60,Oui,4242002708690,Lave vaisselle 60cm BOSCH SMS40D18EU,Produit principal
1105918,Lave vaisselle 60cm BOSCH SMS46II19E,actif,Lave vaisselle 60cm BOSCH SMS46II19E,"402,84",Fixe,Boulanger Pro,BOSCH,GROS ELECTRO MENAGER,Lave Linge,"14,7",60,Oui,4242005084265,Lave vaisselle 60cm BOSCH SMS46II19E,Produit principal
1086332,Lave vaisselle 60cm BOSCH SMS46IW03E,actif,Lave vaisselle 60cm BOSCH SMS46IW03E,"387,28",Fixe,Boulanger Pro,BOSCH,GROS ELECTRO MENAGER,Lave Linge,"14,6",60,Oui,4242002995946,Lave vaisselle 60cm BOSCH SMS46IW03E,Produit principal
1105953,Lave vaisselle 60cm BOSCH SMS46IW20E,actif,Lave vaisselle 60cm BOSCH SMS46IW20E,"387,28",Fixe,Boulanger Pro,BOSCH,GROS ELECTRO MENAGER,Lave Linge,"14,6",60,Oui,4242005086160,Lave vaisselle 60cm BOSCH SMS46IW20E,Produit principal
1086333,Lave vaisselle 60cm BOSCH SMS68TI00E,actif,Lave vaisselle 60cm BOSCH SMS68TI00E,"610,89",Fixe,Boulanger Pro,BOSCH,GROS ELECTRO MENAGER,Lave Linge,"19,4",60,Oui,4242002974811,Lave vaisselle 60cm BOSCH SMS68TI00E,Produit principal
1112312,Lave vaisselle 60cm ELECTROLUX AirDry ESF5545LOW,actif,Lave vaisselle 60cm ELECTROLUX AirDry ESF5545LOW,"315,39",Fixe,Boulanger Pro,ELECTROLUX,GROS ELECTRO MENAGER,Lave Linge,"12,9",60,Oui,7332543472895,Lave vaisselle 60cm ELECTROLUX AirDry ESF5545LOW,Produit principal
1090200,Lave vaisselle 60cm HOTPOINT HRFC 3C24,actif,Lave vaisselle 60cm HOTPOINT HRFC 3C24,"331,65",Fixe,Boulanger Pro,HOTPOINT,GROS ELECTRO MENAGER,Lave Linge,"13,4",60,Oui,8050147053348,Lave vaisselle 60cm HOTPOINT HRFC 3C24,Produit principal
1060495,Lave vaisselle 60cm INDESIT DFP58T94AEU,actif,Lave vaisselle 60cm INDESIT DFP58T94AEU,"251,51",Fixe,Boulanger Pro,INDESIT,GROS ELECTRO MENAGER,Lave Linge,"11,7",60,Oui,8007842845297,Lave vaisselle 60cm INDESIT DFP58T94AEU,Produit principal
1046383,Lave vaisselle 60cm MIELE G 4922 Extra Clean,actif,Lave vaisselle 60cm MIELE G 4922 Extra Clean,"474,2",Fixe,Boulanger Pro,MIELE,GROS ELECTRO MENAGER,Lave Linge,"16,7",60,Oui,4002515619001,Lave vaisselle 60cm MIELE G 4922 Extra Clean,Produit principal
1104687,Lave vaisselle 60cm SAMSUNG WaterWall DW60M9550FS,actif,Lave vaisselle 60cm SAMSUNG WaterWall DW60M9550FS,"511,59",Fixe,Boulanger Pro,SAMSUNG,GROS ELECTRO MENAGER,Lave Linge,"17,3",60,Oui,8801643225551,Lave vaisselle 60cm SAMSUNG WaterWall DW60M9550FS,Produit principal
1098636,Lave vaisselle 60cm SCHNEIDER SDW1444VB Vintage Noir,actif,Lave vaisselle 60cm SCHNEIDER SDW1444VB Vintage Noir,"394,1",Fixe,Boulanger Pro,SCHNEIDER,GROS ELECTRO MENAGER,Lave Linge,"14,8",60,Oui,3527570054983,Lave vaisselle 60cm SCHNEIDER SDW1444VB Vintage Noir,Produit principal
1077310,Lave vaisselle 60cm SHARP QW-GT43F393I,actif,Lave vaisselle 60cm SHARP QW-GT43F393I,"385,94",Fixe,Boulanger Pro,SHARP,GROS ELECTRO MENAGER,Lave Linge,"14,8",60,Oui,4974019896212,Lave vaisselle 60cm SHARP QW-GT43F393I,Produit principal
1086334,Lave vaisselle 60cm SIEMENS SN236W03ME,actif,Lave vaisselle 60cm SIEMENS SN236W03ME,"403,92",Fixe,Boulanger Pro,SIEMENS,GROS ELECTRO MENAGER,Lave Linge,"15,2",60,Oui,4242003762554,Lave vaisselle 60cm SIEMENS SN236W03ME,Produit principal
1089141,Lave vaisselle 60cm SIEMENS SN258B00ME,actif,Lave vaisselle 60cm SIEMENS SN258B00ME,"482,92",Fixe,Boulanger Pro,SIEMENS,GROS ELECTRO MENAGER,Lave Linge,"16,7",60,Oui,4242003798508,Lave vaisselle 60cm SIEMENS SN258B00ME,Produit principal
1073568,Lave vaisselle 60cm WHIRLPOOL WFC 3C26P Blanc,actif,Lave vaisselle 60cm WHIRLPOOL WFC 3C26P Blanc,"291,3",Fixe,Boulanger Pro,WHIRLPOOL,GROS ELECTRO MENAGER,Lave Linge,"12,3",60,Oui,8003437205033,Lave vaisselle 60cm WHIRLPOOL WFC 3C26P Blanc,Produit principal
1073648,Lave vaisselle 60cm WHIRLPOOL WFC 3C26PX Inox,actif,Lave vaisselle 60cm WHIRLPOOL WFC 3C26PX Inox,"324,46",Fixe,Boulanger Pro,WHIRLPOOL,GROS ELECTRO MENAGER,Lave Linge,13,60,Oui,8003437203169,Lave vaisselle 60cm WHIRLPOOL WFC 3C26PX Inox,Produit principal
1092009,Lave vaisselle 60cm WHIRLPOOL WFO3T222,actif,Lave vaisselle 60cm WHIRLPOOL WFO3T222,"334,41",Fixe,Boulanger Pro,WHIRLPOOL,GROS ELECTRO MENAGER,Lave Linge,"13,3",60,Oui,8003437205064,Lave vaisselle 60cm WHIRLPOOL WFO3T222,Produit principal
1048544,Lave vaisselle compact SIEMENS SKS26E821EU,actif,Lave vaisselle compact SIEMENS SKS26E821EU,"264,25",Fixe,Boulanger Pro,SIEMENS,GROS ELECTRO MENAGER,Lave Linge,"11,5",60,Oui,4242003706367,Lave vaisselle compact SIEMENS SKS26E821EU,Produit principal
1087168,Lave vaisselle intégrable 60cm BOSCH EX SMI46MB03E,actif,Lave vaisselle intégrable 60cm BOSCH EX SMI46MB03E,"387,28",Fixe,Boulanger Pro,BOSCH,GROS ELECTRO MENAGER,Lave Linge,"14,3",60,Oui,4242002994758,Lave vaisselle intégrable 60cm BOSCH EX SMI46MB03E,Produit principal
1087166,Lave vaisselle intégrable 60cm BOSCH EX SMI46MS03E,actif,Lave vaisselle intégrable 60cm BOSCH EX SMI46MS03E,"402,42",Fixe,Boulanger Pro,BOSCH,GROS ELECTRO MENAGER,Lave Linge,15,60,Oui,4242002950303,Lave vaisselle intégrable 60cm BOSCH EX SMI46MS03E,Produit principal
1086791,Lave vaisselle intégrable 60cm BOSCH SMI46AB04E,actif,Lave vaisselle intégrable 60cm BOSCH SMI46AB04E,"372,88",Fixe,Boulanger Pro,BOSCH,GROS ELECTRO MENAGER,Lave Linge,"14,3",60,Oui,4242005028474,Lave vaisselle intégrable 60cm BOSCH SMI46AB04E,Produit principal
1109465,Lave vaisselle intégrable 60cm BOSCH SMI68MS02E,actif,Lave vaisselle intégrable 60cm BOSCH SMI68MS02E,"508,53",Fixe,Boulanger Pro,BOSCH,GROS ELECTRO MENAGER,Lave Linge,"17,2",60,Oui,4242002953533,Lave vaisselle intégrable 60cm BOSCH SMI68MS02E,Produit principal
1087169,Lave vaisselle intégrable 60cm BOSCH SMV68TX06E,actif,Lave vaisselle intégrable 60cm BOSCH SMV68TX06E,"554,76",Fixe,Boulanger Pro,BOSCH,GROS ELECTRO MENAGER,Lave Linge,18,60,Oui,4242002957609,Lave vaisselle intégrable 60cm BOSCH SMV68TX06E,Produit principal
1073483,Lave vaisselle intégrable 60cm CANDY CDS2D35B,actif,Lave vaisselle intégrable 60cm CANDY CDS2D35B,"265,2",Fixe,Boulanger Pro,CANDY,GROS ELECTRO MENAGER,Lave Linge,"11,8",60,Oui,8016361912762,Lave vaisselle intégrable 60cm CANDY CDS2D35B,Produit principal
1073482,Lave vaisselle intégrable 60cm CANDY CDS2D35W,actif,Lave vaisselle intégrable 60cm CANDY CDS2D35W,"270,24",Fixe,Boulanger Pro,CANDY,GROS ELECTRO MENAGER,Lave Linge,"11,9",60,Oui,8016361912755,Lave vaisselle intégrable 60cm CANDY CDS2D35W,Produit principal
1073485,Lave vaisselle intégrable 60cm CANDY CDS2D35X,actif,Lave vaisselle intégrable 60cm CANDY CDS2D35X,"266,44",Fixe,Boulanger Pro,CANDY,GROS ELECTRO MENAGER,Lave Linge,"11,8",60,Oui,8016361912779,Lave vaisselle intégrable 60cm CANDY CDS2D35X,Produit principal
1091741,Lave vaisselle intégrable 60cm CANDY CDS2LS54X,actif,Lave vaisselle intégrable 60cm CANDY CDS2LS54X,"271,79",Fixe,Boulanger Pro,CANDY,GROS ELECTRO MENAGER,Lave Linge,"11,9",60,Oui,8016361947702,Lave vaisselle intégrable 60cm CANDY CDS2LS54X,Produit principal
