Référence;Désignation;Etat;Commentaire;Prix d'achat;Type;Fournisseur;Fabriquant;Catégorie;Sous Catégorie;Loyer;Durée;Visible sur le site;EAN;Description;TYPE
1069347;Lave linge hublot BOSCH EX WAN28150FF;actif;Lave linge hublot BOSCH EX WAN28150FF;307,47;Fixe;Boulanger Pro;BOSCH;GROS ELECTRO MENAGER;Lave Linge;13,3;60;Oui;4242002899473;;PRODUITS PRINCIPAUX
1087191;Lave linge hublot SIEMENS WM 14T419FF;actif;Lave linge hublot SIEMENS WM 14T419FF;396,93;Fixe;Boulanger Pro;SIEMENS;GROS ELECTRO MENAGER;Lave Linge;15,2;60;Oui;4242003805602;;PRODUITS PRINCIPAUX
1094285;Lave linge hublot BOSCH WUQ28418FF;actif;Lave linge hublot BOSCH WUQ28418FF;394,64;Fixe;Boulanger Pro;BOSCH;GROS ELECTRO MENAGER;Lave Linge;15,1;60;Oui;4242005059676;;PRODUITS PRINCIPAUX
1094336;Sèche Linge Electrolux EW8H4830SP Perfect Care;actif;Sèche Linge Electrolux EW8H4830SP Perfect Care;415,1;Fixe;Boulanger Pro;ELECTROLUX;GROS ELECTRO MENAGER;Sèche Linge;15,2;60;Oui;7332543560653;;PRODUITS PRINCIPAUX
1053443;Sèche Linge Whirlpool HSCX 90422;actif;Sèche Linge Whirlpool HSCX 90422;449,23;Fixe;Boulanger Pro;WHIRLPOOL;GROS ELECTRO MENAGER;Sèche Linge;15,9;60;Oui;8003437472701;;PRODUITS PRINCIPAUX
1049547;Lave linge hublot WHIRLPOOL FSCR 10432 Supreme Care;actif;Lave linge hublot WHIRLPOOL FSCR 10432 Supreme Care;441,04;Fixe;Boulanger Pro;WHIRLPOOL;GROS ELECTRO MENAGER;Lave Linge;16,3;60;Oui;8003437261367;;PRODUITS PRINCIPAUX
1076026;Cave à vin Le Chai LB590X;actif;Cave à vin Le Chai LB590X;459,48;Fixe;Boulanger Pro;LE CHAI;GROS ELECTRO MENAGER;Cave à vin;16;60;Oui;3260449040174;;PRODUITS PRINCIPAUX
1066364;Lave linge hublot SAMSUNG ADD WASH WW90K6414QW/EF;actif;Lave linge hublot SAMSUNG ADD WASH WW90K6414QW/EF;401,3;Fixe;Boulanger Pro;SAMSUNG;GROS ELECTRO MENAGER;Lave Linge;15,1;60;Oui;8806088193571;;PRODUITS PRINCIPAUX
1104639;Lave linge hublot SAMSUNG QuickDrive WW90M645OPW;actif;Lave linge hublot SAMSUNG QuickDrive WW90M645OPW;528,63;Fixe;Boulanger Pro;SAMSUNG;GROS ELECTRO MENAGER;Lave Linge;18;60;Oui;8801643158361;;PRODUITS PRINCIPAUX
1032731;Sèche Linge Miele TDA 140C;actif;Sèche Linge Miele TDA 140C;490,18;Fixe;Boulanger Pro;MIELE;GROS ELECTRO MENAGER;Sèche Linge;16,8;60;Oui;4002515517031;;PRODUITS PRINCIPAUX
1088545;Combiné WHIRLPOOL EX BTNF5322OX;actif;Combiné WHIRLPOOL EX BTNF5322OX;497,76;Fixe;Boulanger Pro;WHIRLPOOL;GROS ELECTRO MENAGER;Réfrigérateur;17,8;60;Oui;8003437204012;;PRODUITS PRINCIPAUX
1093733;Sèche Linge Samsung DV80M52103W/EF;actif;Sèche Linge Samsung DV80M52103W/EF;475,43;Fixe;Boulanger Pro;SAMSUNG;GROS ELECTRO MENAGER;Sèche Linge;16,5;60;Oui;8806088770499;;PRODUITS PRINCIPAUX
1050568;Combiné SAMSUNG RB41J7035SR/EF;actif;Combiné SAMSUNG RB41J7035SR/EF;564,01;Fixe;Boulanger Pro;SAMSUNG;GROS ELECTRO MENAGER;Réfrigérateur;19;60;Oui;8806086521239;;PRODUITS PRINCIPAUX
1067414;Lave linge hublot WHIRLPOOL FSCR 12420;actif;Lave linge hublot WHIRLPOOL FSCR 12420;496,35;Fixe;Boulanger Pro;WHIRLPOOL;GROS ELECTRO MENAGER;Lave Linge;17,5;60;Oui;8003437261756;;PRODUITS PRINCIPAUX
1069885;Cave à vin Liebheer WK 201;actif;Cave à vin Liebheer WK 201;561,41;Fixe;Boulanger Pro;LIEBHERR;GROS ELECTRO MENAGER;Cave à vin;18,5;60;Oui;9005382189795;;PRODUITS PRINCIPAUX
1107072;Table induction Electrolux EIV854;actif;Table induction Electrolux EIV854;493,08;Fixe;Boulanger Pro;ELECTROLUX;GROS ELECTRO MENAGER;Cuisson;15,6;60;Oui;7332543590322;;PRODUITS PRINCIPAUX
1096011;Sèche Linge Electrolux EW9H3825RA Perfect Care;actif;Sèche Linge Electrolux EW9H3825RA Perfect Care;499,19;Fixe;Boulanger Pro;ELECTROLUX;GROS ELECTRO MENAGER;Sèche Linge;17;60;Oui;7332543561193;;PRODUITS PRINCIPAUX
1083000;Cave à vin Liebheer WK137;actif;Cave à vin Liebheer WK137;542,84;Fixe;Boulanger Pro;LIEBHERR;GROS ELECTRO MENAGER;Cave à vin;17,7;60;Oui;9005382192276;;PRODUITS PRINCIPAUX
1101012;Micro-ondes SAMSUNG CM1529A-1;actif;Micro-ondes SAMSUNG CM1529A-1;424,31;Fixe;Boulanger Pro;SAMSUNG;GROS ELECTRO MENAGER;Four Micro-ondes;14;60;Oui;8806071596518;;PRODUITS PRINCIPAUX
1094969;Table induction De Dietrich DPI7698DG;actif;Table induction De Dietrich DPI7698DG;546,7;Fixe;Boulanger Pro;DE DIETRICH;GROS ELECTRO MENAGER;Cuisson;16,8;60;Oui;3660767965966;;PRODUITS PRINCIPAUX
1084691;Table induction Whirlpool SMP658CNE IXL;actif;Table induction Whirlpool SMP658CNE IXL;564,23;Fixe;Boulanger Pro;WHIRLPOOL;GROS ELECTRO MENAGER;Cuisson;17,1;60;Oui;8003437206122;;PRODUITS PRINCIPAUX
1096875;Sèche Linge Miele TDB 220 WP;actif;Sèche Linge Miele TDB 220 WP;532,28;Fixe;Boulanger Pro;MIELE;GROS ELECTRO MENAGER;Sèche Linge;17,9;60;Oui;4002515939482;;PRODUITS PRINCIPAUX
155051;Cave à vin Liebheer WKB 3212;actif;Cave à vin Liebheer WKB 3212;645,5;Fixe;Boulanger Pro;LIEBHERR;GROS ELECTRO MENAGER;Cave à vin;20,3;60;Oui;9005382146811;;PRODUITS PRINCIPAUX
1107956;LL Front ASKO W4096P.W;actif;LL Front ASKO W4096P.W;671,07;Fixe;Boulanger Pro;ASKO;GROS ELECTRO MENAGER;Lave Linge;21;60;Oui;3838782008986;;PRODUITS PRINCIPAUX
1097862;Four pyrolyse Miele H2265BP;actif;Four pyrolyse Miele H2265BP;506,15;Fixe;Boulanger Pro;MIELE;GROS ELECTRO MENAGER;Four;17,3;60;Oui;4002515798447;;PRODUITS PRINCIPAUX
1105983;Lave-vaisselle PL Siemens SN256I05MF;actif;Lave-vaisselle PL Siemens SN256I05MF;543,95;Fixe;Boulanger Pro;SIEMENS;GROS ELECTRO MENAGER;Lave Vaisselle;18,1;60;Oui;4242003815595;;PRODUITS PRINCIPAUX
1071732;Table induction Neff T66TT60N0;actif;Table induction Neff T66TT60N0;616,41;Fixe;Boulanger Pro;NEFF;GROS ELECTRO MENAGER;Cuisson;18,3;60;Oui;4242004191728;;PRODUITS PRINCIPAUX
1085964;Lave linge hublot MIELE WDB 004;actif;Lave linge hublot MIELE WDB 004;561,34;Fixe;Boulanger Pro;MIELE;GROS ELECTRO MENAGER;Lave Linge;19,1;60;Oui;4002515835517;;PRODUITS PRINCIPAUX
1087691;Lave linge hublot LG TurboWash F71K22WHS;actif;Lave linge hublot LG TurboWash F71K22WHS;653,41;Fixe;Boulanger Pro;LG;GROS ELECTRO MENAGER;Lave Linge;21,6;60;Oui;8806087455366;;PRODUITS PRINCIPAUX
1106878;Lave-vaisselle Samsung WATERWALL DW60M9550BB;actif;Lave-vaisselle Samsung WATERWALL DW60M9550BB;543,95;Fixe;Boulanger Pro;SAMSUNG;GROS ELECTRO MENAGER;Lave Vaisselle;17,7;60;Oui;8801643225544;;PRODUITS PRINCIPAUX
1026803;Four Email SMEG SF9310XR;actif;Four Email SMEG SF9310XR;646,88;Fixe;Boulanger Pro;SMEG;GROS ELECTRO MENAGER;Four;19,5;60;Oui;8017709191450;;PRODUITS PRINCIPAUX
1104051;Défroisseur STEAMONE DUALYS Plus;actif;Défroisseur STEAMONE DUALYS Plus;190,67;Portable;Boulanger Pro;STEAMONE;PETIT ELECTRO MENAGER;Repassage;9;36;Oui;3707346022884;;PRODUITS PRINCIPAUX
1105925;Centrale vapeur CALOR GV9581CO PRO EXPRESS Ultimate Gold;actif;Centrale vapeur CALOR GV9581CO PRO EXPRESS Ultimate Gold;202,94;Portable;Boulanger Pro;CALOR;PETIT ELECTRO MENAGER;Repassage;9,7;36;Oui;3121040068830;;PRODUITS PRINCIPAUX
1084432;Réf Multi Hisense EX RQ689N4AT1;actif;Réf Multi Hisense EX RQ689N4AT1;717,7;Fixe;Boulanger Pro;HISENSE;GROS ELECTRO MENAGER;Réfrigérateur;23,2;60;Oui;6921727009050;;PRODUITS PRINCIPAUX
1072012;Lave-vaisselle PL Miele G 6630 SC;actif;Lave-vaisselle PL Miele G 6630 SC;647,33;Fixe;Boulanger Pro;MIELE;GROS ELECTRO MENAGER;Lave Vaisselle;20,3;60;Oui;4002515693940;;PRODUITS PRINCIPAUX
1094554;Aspirateur traineau MIELE Complete C3 Parquet XL Ecoline;actif;Aspirateur traineau MIELE Complete C3 Parquet XL Ecoline;197,44;Portable;Boulanger Pro;MIELE;PETIT ELECTRO MENAGER;Aspirateur;9,2;36;Oui;4002515824801;;PRODUITS PRINCIPAUX
1070208;Lave-vaisselle  Miele G6630SCI IN;actif;Lave-vaisselle  Miele G6630SCI IN;721,39;Fixe;Boulanger Pro;MIELE;GROS ELECTRO MENAGER;Lave Vaisselle;21,8;60;Oui;4002515693964;;PRODUITS PRINCIPAUX
1109241;Sèche Linge Asko T409HS.W;actif;Sèche Linge Asko T409HS.W;865,72;Fixe;Boulanger Pro;ASKO;GROS ELECTRO MENAGER;Sèche Linge;25,2;60;Oui;3838782011252;;PRODUITS PRINCIPAUX
1076010;Lave-vaisselle Electrolux ESL7740RA Comfortlift;actif;Lave-vaisselle Electrolux ESL7740RA Comfortlift;657,36;Fixe;Boulanger Pro;ELECTROLUX;GROS ELECTRO MENAGER;Lave Vaisselle;20,2;60;Oui;7332543526727;;PRODUITS PRINCIPAUX
1101679;LL Front ASKO W4114C.W;actif;LL Front ASKO W4114C.W;970,02;Fixe;Boulanger Pro;ASKO;GROS ELECTRO MENAGER;Lave Linge;27,4;60;Oui;3838782009037;;PRODUITS PRINCIPAUX
1087801;Réf Multi Haier HB18FGSAAA;actif;Réf Multi Haier HB18FGSAAA;921,8;Fixe;Boulanger Pro;HAIER;GROS ELECTRO MENAGER;Réfrigérateur;27,5;60;Oui;6901018064777;;PRODUITS PRINCIPAUX
1022485;Four Electrolux EOB8946AOX;actif;Four Electrolux EOB8946AOX;763,95;Fixe;Boulanger Pro;ELECTROLUX;GROS ELECTRO MENAGER;Four;21,8;60;Oui;7332543286454;;PRODUITS PRINCIPAUX
1048347;Four combi Siemens IQ700 HM676G0S1F VARIOSPEED;actif;Four combi Siemens IQ700 HM676G0S1F VARIOSPEED;781,62;Fixe;Boulanger Pro;SIEMENS;GROS ELECTRO MENAGER;Four;22,2;60;Oui;4242003671993;;PRODUITS PRINCIPAUX
1047998;Four Double SMEG DOSP6390X;actif;Four Double SMEG DOSP6390X;860,28;Fixe;Boulanger Pro;SMEG;GROS ELECTRO MENAGER;Four;24,3;60;Oui;8017709210656;;PRODUITS PRINCIPAUX
1049386;Four pyrolyse Bosch Série 8 HBG6769S1F;actif;Four pyrolyse Bosch Série 8 HBG6769S1F;753,33;Fixe;Boulanger Pro;BOSCH;GROS ELECTRO MENAGER;Four;21,6;60;Oui;4242002808109;;PRODUITS PRINCIPAUX
1076889;Lave linge hublot MIELE WKH 122 WPS;actif;Lave linge hublot MIELE WKH 122 WPS;1002,21;Fixe;Boulanger Pro;MIELE;GROS ELECTRO MENAGER;Lave Linge;29;60;Oui;4002515772508;;PRODUITS PRINCIPAUX
1106236;LL Front MIELE WCI 320;actif;LL Front MIELE WCI 320;904,57;Fixe;Boulanger Pro;MIELE;GROS ELECTRO MENAGER;Lave Linge;26,5;60;Oui;4002515980187;;PRODUITS PRINCIPAUX
1093899;SL Front ASKO T411HD.W;actif;SL Front ASKO T411HD.W;1036,99;Fixe;Boulanger Pro;ASKO;GROS ELECTRO MENAGER;Sèche Linge;28,5;60;Oui;3838782011429;;PRODUITS PRINCIPAUX
1117541;Table induction Siemens EX875KYW1E;actif;Table induction Siemens EX875KYW1E;978,09;Fixe;Boulanger Pro;SIEMENS;GROS ELECTRO MENAGER;Cuisson;26;60;Oui;4242003765296;;PRODUITS PRINCIPAUX
1071268;Réfrigérateur américain LG GSS6676SC;actif;Réfrigérateur américain LG GSS6676SC;1089,32;Fixe;Boulanger Pro;LG;GROS ELECTRO MENAGER;Réfrigérateur;31,3;60;Oui;6934585683140;;PRODUITS PRINCIPAUX
1047955;Réf Multi Samsung RFG23RESL1;actif;Réf Multi Samsung RFG23RESL1;1121,04;Fixe;Boulanger Pro;SAMSUNG;GROS ELECTRO MENAGER;Réfrigérateur;31,8;60;Oui;8806086220910;;PRODUITS PRINCIPAUX
1084246;Tablette graphique WACOM Intuos Pro PTH-660-S;actif;Tablette graphique WACOM Intuos Pro PTH-660-S;265,79;Portable;Boulanger Pro;WACOM;INFORMATIQUE;TABLETTE;12,5;36;Oui;4949268620024;;PRODUITS PRINCIPAUX
1093788;Robot KENWOOD KVL6305S Chef XL Elite;actif;Robot KENWOOD KVL6305S Chef XL Elite;274,83;Portable;Boulanger Pro;KENWOOD;PETIT ELECTRO MENAGER;Robot;12,2;36;Oui;5011423197036;;PRODUITS PRINCIPAUX
1096927;Four SMEG SF4390VCX1;actif;Four SMEG SF4390VCX1;899,85;Fixe;Boulanger Pro;SMEG;GROS ELECTRO MENAGER;Four;24,7;60;Oui;8017709235888;;PRODUITS PRINCIPAUX
1097767;Aspi NILFISK Elite BMSU14P10A1 Superio;actif;Aspi NILFISK Elite BMSU14P10A1 Superio;257,83;Portable;Boulanger Pro;NILFISK;PETIT ELECTRO MENAGER;Aspirateur;11,6;36;Oui;5715492189571;;PRODUITS PRINCIPAUX
1072839;Pianos SMEG C9CIMX9;actif;Pianos SMEG C9CIMX9;1078,42;Fixe;Boulanger Pro;SMEG;GROS ELECTRO MENAGER;Cuisson;29,3;60;Oui;8017709222918;;PRODUITS PRINCIPAUX
1112149;Sèche Linge Siemens Avantgarde WT47X940EU;actif;Sèche Linge Siemens Avantgarde WT47X940EU;1127,1;Fixe;Boulanger Pro;SIEMENS;GROS ELECTRO MENAGER;Sèche Linge;30,6;60;Oui;4242003831694;;PRODUITS PRINCIPAUX
1066121;Four Combi SIEMENS IQ700 HM676G0S6 HOME;actif;Four Combi SIEMENS IQ700 HM676G0S6 HOME;928,95;Fixe;Boulanger Pro;SIEMENS;GROS ELECTRO MENAGER;Four;25,3;60;Oui;4242003739952;;PRODUITS PRINCIPAUX
1093842;Robot KENWOOD KVC7305S Chef Titanium;actif;Robot KENWOOD KVC7305S Chef Titanium;301,78;Portable;Boulanger Pro;KENWOOD;PETIT ELECTRO MENAGER;Robot;13,5;36;Oui;5011423197012;;PRODUITS PRINCIPAUX
1015964;Scanner CUBE 3D Sense;actif;Scanner CUBE 3D Sense;322,98;Fixe;Boulanger Pro;CUBE;BUREAUTIQUE;SCANNER;15,1;36;Oui;840846133537;;PRODUITS PRINCIPAUX
1093322;Four éco clean NEFF B48FT78N1;actif;Four éco clean NEFF B48FT78N1;1101,83;Fixe;Boulanger Pro;NEFF;GROS ELECTRO MENAGER;Four;28,9;60;Oui;4242004214106;;PRODUITS PRINCIPAUX
146777;Centrale vapeur LAURASTAR LIFT Plus Utlimate Black;actif;Centrale vapeur LAURASTAR LIFT Plus Utlimate Black;290,41;Portable;Boulanger Pro;LAURASTAR;PETIT ELECTRO MENAGER;Repassage;12,7;36;Oui;790776004691;;PRODUITS PRINCIPAUX
1115895;S-cheveux Pro DYSON Supersonic Black/Nic;actif;S-cheveux Pro DYSON Supersonic Black/Nic;297,09;Portable;Boulanger Pro;DYSON;PETIT ELECTRO MENAGER;Sèche-cheveux;12,9;36;Oui;5025155036709;;PRODUITS PRINCIPAUX
1080526;Robot KITCHENAID 5KSM125EER Rouge Empire;actif;Robot KITCHENAID 5KSM125EER Rouge Empire;308,075;Portable;Boulanger Pro;KITCHENAID;PETIT ELECTRO MENAGER;Robot;13,7;36;Oui;5413184200787;;PRODUITS PRINCIPAUX
1054984;Humidificateur DYSON AM10 WHITE/SILVER;actif;Humidificateur DYSON AM10 WHITE/SILVER;346,54;Portable;Boulanger Pro;DYSON;PETIT ELECTRO MENAGER;Qualité de l'air;14,9;36;Oui;5025155018651;;PRODUITS PRINCIPAUX
1095122;Aspi DYSON Cinetic Big Ball Parquet 2;actif;Aspi DYSON Cinetic Big Ball Parquet 2;348,06;Portable;Boulanger Pro;DYSON;PETIT ELECTRO MENAGER;Aspirateur;15;36;Oui;5025155027547;;PRODUITS PRINCIPAUX
1022923;Pianos  Leisure CK110F324X;actif;Pianos  Leisure CK110F324X;1166,07;Fixe;Boulanger Pro;LEISURE;GROS ELECTRO MENAGER;Cuisson;31,9;60;Oui;8690842870552;;PRODUITS PRINCIPAUX
1051852;Ventilateur DYSON AM09 HOT+COOL Black Nickel;actif;Ventilateur DYSON AM09 HOT+COOL Black Nickel;349,87;Portable;Boulanger Pro;DYSON;PETIT ELECTRO MENAGER;Qualité de l'air;15;36;Oui;5025155018644;;PRODUITS PRINCIPAUX
1072489;Sèche Linge Miele TKR 850 WP;actif;Sèche Linge Miele TKR 850 WP;1226,29;Fixe;Boulanger Pro;MIELE;GROS ELECTRO MENAGER;Sèche Linge;32,3;60;Oui;4002515677742;;PRODUITS PRINCIPAUX
1087879;Réfrigérateur américain LG GSK6676SC instaview;actif;Réfrigérateur américain LG GSK6676SC instaview;1375,32;Fixe;Boulanger Pro;LG;GROS ELECTRO MENAGER;Réfrigérateur;37;60;Oui;6934585685373;;PRODUITS PRINCIPAUX
1080530;Robot KITCHENAID 5KSM175PSECA Pomme d'Amour;actif;Robot KITCHENAID 5KSM175PSECA Pomme d'Amour;400,49;Portable;Boulanger Pro;KITCHENAID;PETIT ELECTRO MENAGER;Robot;17,6;36;Oui;5413184200480;;PRODUITS PRINCIPAUX
1110616;Aspirateur traineau MIELE Blizzard CX1 Electro EcoLine;actif;Aspirateur traineau MIELE Blizzard CX1 Electro EcoLine;394,43;Portable;Boulanger Pro;MIELE;PETIT ELECTRO MENAGER;Aspirateur;16,6;36;Oui;4002515824535;;PRODUITS PRINCIPAUX
1095126;Aspi DYSON Cinetic Big Ball Absolute 2;actif;Aspi DYSON Cinetic Big Ball Absolute 2;393,77;Portable;Boulanger Pro;DYSON;PETIT ELECTRO MENAGER;Aspirateur;16,6;36;Oui;5025155027882;;PRODUITS PRINCIPAUX
1046457;Réf Multi SMEG FQ 75 XPED;actif;Réf Multi SMEG FQ 75 XPED;1571,9;Fixe;Boulanger Pro;SMEG;GROS ELECTRO MENAGER;Réfrigérateur;40,9;60;Oui;8017709193362;;PRODUITS PRINCIPAUX
1096024;Sèche Linge Miele TMV843WP;actif;Sèche Linge Miele TMV843WP;1457,66;Fixe;Boulanger Pro;MIELE;GROS ELECTRO MENAGER;Sèche Linge;37,2;60;Oui;4002515872345;;PRODUITS PRINCIPAUX
1047180;Réfrigérateur multi-portes SAMSUNG RF56J9040SR;actif;Réfrigérateur multi-portes SAMSUNG RF56J9040SR;1661,84;Fixe;Boulanger Pro;SAMSUNG;GROS ELECTRO MENAGER;Réfrigérateur;43,4;60;Oui;8806086664561;;PRODUITS PRINCIPAUX
1109218;Table Induc BOSCH PVS851F21E;actif;Table Induc BOSCH PVS851F21E;1385,79;Fixe;Boulanger Pro;BOSCH;GROS ELECTRO MENAGER;Cuisson;34,6;60;Oui;4242005049424;;PRODUITS PRINCIPAUX
1093318;Pianos  Falcon CLASSIC110 ROUGE AIRELLE CHRM;actif;Pianos  Falcon CLASSIC110 ROUGE AIRELLE CHRM;1738,91;Fixe;Boulanger Pro;Falcon;GROS ELECTRO MENAGER;Cuisson;42,7;60;Oui;5028683116837;;PRODUITS PRINCIPAUX
1105916;Réf Multi SAMSUNG RF56M9380SG;actif;Réf Multi SAMSUNG RF56M9380SG;1976,73;Fixe;Boulanger Pro;SAMSUNG;GROS ELECTRO MENAGER;Réfrigérateur;50,1;60;Oui;8806088935461;;PRODUITS PRINCIPAUX
1047691;Pianos SMEG TR4110P1;actif;Pianos SMEG TR4110P1;1886,83;Fixe;Boulanger Pro;SMEG;GROS ELECTRO MENAGER;Cuisson;47,2;60;Oui;8017709176655;;PRODUITS PRINCIPAUX
1110533;TV SONY KD55XF7096;actif;TV SONY KD55XF7096;558,66;Fixe;Boulanger Pro;SONY;MULTIMEDIA;TV;16,3;60;Oui;4548736077492;;PRODUITS PRINCIPAUX
1118176;Pianos  Falcon CLASSIC DELUXE INDUCTION 100 CREME/;actif;Pianos  Falcon CLASSIC DELUXE INDUCTION 100 CREME/;2212,24;Fixe;Boulanger Pro;Falcon;GROS ELECTRO MENAGER;Cuisson;52,1;60;Oui;5028683095989;;PRODUITS PRINCIPAUX
1087875;Table Induc SIEMENS EX875LX34E Inducti;actif;Table Induc SIEMENS EX875LX34E Inducti;1902,01;Fixe;Boulanger Pro;SIEMENS;GROS ELECTRO MENAGER;Cuisson;45,5;60;Oui;4242003763988;;PRODUITS PRINCIPAUX
1077616;Purificateur d'air DYSON Pure Hot+Cool Link White;actif;Purificateur d'air DYSON Pure Hot+Cool Link White;415;Portable;Boulanger Pro;DYSON;PETIT ELECTRO MENAGER;Qualité de l'air;17,4;36;Oui;5025155023631;;PRODUITS PRINCIPAUX
1071941;Trancheuse BERKEL NRL 220 Rouge;actif;Trancheuse BERKEL NRL 220 Rouge;530,78;Fixe;Boulanger Pro;BERKEL;PETIT ELECTRO MENAGER;Trancheuse;23,7;36;Oui;8050040420001;;PRODUITS PRINCIPAUX
1066933;Imprimante jet d'encre multifonction CANON PIXMA PRO-10S;actif;Imprimante jet d'encre multifonction CANON PIXMA PRO-10S;464,08;Fixe;Boulanger Pro;CANON;BUREAUTIQUE;IMPRIMANTE;20,3;36;Oui;4549292022070;;PRODUITS PRINCIPAUX
1105892;TV SAMSUNG QE49Q6F 2018;actif;TV SAMSUNG QE49Q6F 2018;758,52;Fixe;Boulanger Pro;SAMSUNG;MULTIMEDIA;TV;21,1;60;Oui;8801643204617;;PRODUITS PRINCIPAUX
1105913;TV SAMSUNG UE55NU7655 INCURVE;actif;TV SAMSUNG UE55NU7655 INCURVE;691,22;Fixe;Boulanger Pro;SAMSUNG;MULTIMEDIA;TV;19,1;60;Oui;8801643210014;;PRODUITS PRINCIPAUX
1111904;TV SAMSUNG THE FRAME UE43LS03 2018;actif;TV SAMSUNG THE FRAME UE43LS03 2018;783;Fixe;Boulanger Pro;SAMSUNG;MULTIMEDIA;TV;21,7;60;Oui;8801643356897;;PRODUITS PRINCIPAUX
1091262;Blender KITCHENAID 5KSB8270EMS Gris Et;actif;Blender KITCHENAID 5KSB8270EMS Gris Et;500,51;Portable;Boulanger Pro;KITCHENAID;PETIT ELECTRO MENAGER;Robot;20,9;36;Oui;5413184201777;;PRODUITS PRINCIPAUX
1091565;Tablette IPAD Pro 10.5 64Go Gris Sidéral;actif;Tablette IPAD Pro 10.5 64Go Gris Sidéral;594;Portable;Boulanger Pro;APPLE;INFORMATIQUE;TABLETTE;24,8;36;Oui;190198470836;;PRODUITS PRINCIPAUX
1107244;TV SONY KD65XF7596;actif;TV SONY KD65XF7596;887,53;Fixe;Boulanger Pro;SONY;MULTIMEDIA;TV;23,9;60;Oui;4548736076815;;PRODUITS PRINCIPAUX
1101532;Trancheuse WISMER WEG 300 Inox;actif;Trancheuse WISMER WEG 300 Inox;589,85;Fixe;Boulanger Pro;WISMER;PETIT ELECTRO MENAGER;Trancheuse;24;36;Oui;3700378101633;;PRODUITS PRINCIPAUX
1110718;Portable HP Envy 17-bw0007nf;actif;Portable HP Envy 17-bw0007nf;692,95;Portable;Boulanger Pro;HP;INFORMATIQUE;PC;28,7;36;Oui;193015166523;;PRODUITS PRINCIPAUX
1111965;TV SAMSUNG THE FRAME UE49LS03 2018;actif;TV SAMSUNG THE FRAME UE49LS03 2018;986;Fixe;Boulanger Pro;SAMSUNG;MULTIMEDIA;TV;25,9;60;Oui;8801643356910;;PRODUITS PRINCIPAUX
1091348;Tablette IPAD Pro 10.5 256Go Gris Sidéral;actif;Tablette IPAD Pro 10.5 256Go Gris Sidéral;730,16;Portable;Boulanger Pro;APPLE;INFORMATIQUE;TABLETTE;30,5;36;Oui;190198313287;;PRODUITS PRINCIPAUX
1114001;Pack KITCHENAID Pro 5KSM7990XEWH Blanc;actif;Pack KITCHENAID Pro 5KSM7990XEWH Blanc;618,66;Portable;Boulanger Pro;KITCHENAID;PETIT ELECTRO MENAGER;Robot;25,1;36;Oui;5413184160128;;PRODUITS PRINCIPAUX
1106757;Portable ACER Swift SF514-52T-80TF;actif;Portable ACER Swift SF514-52T-80TF;745,82;Portable;Boulanger Pro;ACER;INFORMATIQUE;PC;31;36;Oui;4713883756112;;PRODUITS PRINCIPAUX
1110861;TV SAMSUNG QE55Q6F 2018;actif;TV SAMSUNG QE55Q6F 2018;995,48;Fixe;Boulanger Pro;SAMSUNG;MULTIMEDIA;TV;26,2;60;Oui;8801643201999;;PRODUITS PRINCIPAUX
1102882;Portable HP Pavilion 14-bf106nf;actif;Portable HP Pavilion 14-bf106nf;744,46;Portable;Boulanger Pro;HP;INFORMATIQUE;PC;31;36;Oui;192018853058;;PRODUITS PRINCIPAUX
1110654;Portable HP OMEN 17-an106nf;actif;Portable HP OMEN 17-an106nf;849,99;Portable;Boulanger Pro;HP;INFORMATIQUE;PC;35,3;36;Oui;193015180499;;PRODUITS PRINCIPAUX
1093268;Réf Multi LG LSR100;actif;Réf Multi LG LSR100;4386,8;Fixe;Boulanger Pro;LG;GROS ELECTRO MENAGER;Réfrigérateur;99,2;60;Oui;8801031692996;;PRODUITS PRINCIPAUX
1105911;TV SAMSUNG QE55Q7F 2018;actif;TV SAMSUNG QE55Q7F 2018;1104;Fixe;Boulanger Pro;SAMSUNG;MULTIMEDIA;TV;29,1;60;Oui;8801643158835;;PRODUITS PRINCIPAUX
1091523;Tablette IPAD Pro 12.9 256Go Gris Sidéral 2017;actif;Tablette IPAD Pro 12.9 256Go Gris Sidéral 2017;866,35;Portable;Boulanger Pro;APPLE;INFORMATIQUE;TABLETTE;35,7;36;Oui;190198282538;;PRODUITS PRINCIPAUX
1106728;Portable HP Spectre x360 13-ae019nf;actif;Portable HP Spectre x360 13-ae019nf;952,9;Portable;Boulanger Pro;HP;INFORMATIQUE;PC;39,3;36;Oui;192545419802;;PRODUITS PRINCIPAUX
1111967;TV SAMSUNG THE FRAME UE55LS03 2018;actif;TV SAMSUNG THE FRAME UE55LS03 2018;1182;Fixe;Boulanger Pro;SAMSUNG;MULTIMEDIA;TV;30,7;60;Oui;8801643356934;;PRODUITS PRINCIPAUX
1091526;Tablette IPAD Pro 12.9 256Go Cell Gris Sidéral 2017;actif;Tablette IPAD Pro 12.9 256Go Cell Gris Sidéral 2017;994,51;Portable;Boulanger Pro;APPLE;INFORMATIQUE;TABLETTE;40,6;36;Oui;190198299987;;PRODUITS PRINCIPAUX
1091419;Ordinateur IMAC 21.5'' Retina 4K 3Ghz 1To;actif;Ordinateur IMAC 21.5'' Retina 4K 3Ghz 1To;1140,04;Fixe;Boulanger Pro;APPLE;INFORMATIQUE;PC;46,8;36;Oui;190198085702;;PRODUITS PRINCIPAUX
1111964;TV SONY KD70XF8305;actif;TV SONY KD70XF8305;1149,26;Fixe;Boulanger Pro;SONY;MULTIMEDIA;TV;30,3;60;Oui;4548736077652;;PRODUITS PRINCIPAUX
1084364;Centre repassage MIELE FASHION MASTER B3847;actif;Centre repassage MIELE FASHION MASTER B3847;1186,66;Portable;Boulanger Pro;MIELE;PETIT ELECTRO MENAGER;Repassage;48,4;36;Oui;4002515781258;;PRODUITS PRINCIPAUX
1090519;Portable MICROSOFT Surface Pro i5 8Go 256Go;actif;Portable MICROSOFT Surface Pro i5 8Go 256Go;1153,83;Portable;Boulanger Pro;MICROSOFT;INFORMATIQUE;PC;47,1;36;Oui;889842193213;;PRODUITS PRINCIPAUX
1091469;Portable MACBOOK Pro 13p i5 128Go Argent 2017;actif;Portable MACBOOK Pro 13p i5 128Go Argent 2017;1128,7;Portable;Boulanger Pro;APPLE;INFORMATIQUE;PC;46,3;36;Oui;190198393319;;PRODUITS PRINCIPAUX
1077370;Vidéoprojecteur BENQ W2000W;actif;Vidéoprojecteur BENQ W2000W;943,59;Portable;Boulanger Pro;BENQ;MULTIMEDIA;VIDEOPROJECTEUR;24,1;60;Oui;4718755063046;;PRODUITS PRINCIPAUX
1110877;TV LG OLED55B8V;actif;TV LG OLED55B8V;1298,64;Fixe;Boulanger Pro;LG;MULTIMEDIA;TV;32,9;60;Oui;8806098144136;;PRODUITS PRINCIPAUX
1084759;Barbecue BIG GREEN EGG XLarge;actif;Barbecue BIG GREEN EGG XLarge;1647,69;Portable;Boulanger Pro;BIG GREEN;PETIT ELECTRO MENAGER;Barbecue;68,5;36;Oui;665719117649;;PRODUITS PRINCIPAUX
1106400;TV LG OLED55C8;actif;TV LG OLED55C8;1421;Fixe;Boulanger Pro;LG;MULTIMEDIA;TV;35,9;60;Oui;8806098144280;;PRODUITS PRINCIPAUX
1091461;Ordinateur IMAC 27 Retina 5K 3.4Ghz 1To fusion;actif;Ordinateur IMAC 27 Retina 5K 3.4Ghz 1To fusion;1595,39;Fixe;Boulanger Pro;APPLE;INFORMATIQUE;PC;64,9;36;Oui;190198087461;;PRODUITS PRINCIPAUX
1112453;Portable MACBOOK Pro New 13p Touch Bar i5 256Go Gris S;actif;Portable MACBOOK Pro New 13p Touch Bar i5 256Go Gris S;1549,67;Portable;Boulanger Pro;APPLE;INFORMATIQUE;PC;63,3;36;Oui;190198714435;;PRODUITS PRINCIPAUX
1087280;Barbecue WEBER Genesis II LX S-640 GBS i;actif;Barbecue WEBER Genesis II LX S-640 GBS i;1855,59;Portable;Boulanger Pro;WEBER;PETIT ELECTRO MENAGER;Barbecue;75,2;36;Oui;77924046230;;PRODUITS PRINCIPAUX
1111968;TV SAMSUNG THE FRAME UE65LS03 2018;actif;TV SAMSUNG THE FRAME UE65LS03 2018;1628,61;Fixe;Boulanger Pro;SAMSUNG;MULTIMEDIA;TV;40,7;60;Oui;8801643357023;;PRODUITS PRINCIPAUX
1106703;Robot KEECKER Vidéoprojecteur 32Go;actif;Robot KEECKER Vidéoprojecteur 32Go;1416,22;Portable;Boulanger Pro;KEECKER;PETIT ELECTRO MENAGER;Robot;34,8;60;Oui;3770009318013;;PRODUITS PRINCIPAUX
1110879;TV LG OLED65B8V;actif;TV LG OLED65B8V;1957,82;Fixe;Boulanger Pro;LG;MULTIMEDIA;TV;47,6;60;Oui;8806098144730;;PRODUITS PRINCIPAUX
1105333;TV PHILIPS 65OLED873;actif;TV PHILIPS 65OLED873;1879,88;Fixe;Boulanger Pro;PHILIPS;MULTIMEDIA;TV;46,2;60;Oui;8718863014431;;PRODUITS PRINCIPAUX
1074090;Vidéoprojecteur SONY HW45ES NOIR;actif;Vidéoprojecteur SONY HW45ES NOIR;1585,51;Portable;Boulanger Pro;SONY;MULTIMEDIA;VIDEOPROJECTEUR;38,7;60;Oui;4548736031968;;PRODUITS PRINCIPAUX
1106398;TV LG OLED65C8;actif;TV LG OLED65C8;2289,57;Fixe;Boulanger Pro;LG;MULTIMEDIA;TV;55,1;60;Oui;8806098144877;;PRODUITS PRINCIPAUX
1113323;TV SONY 65ZF9BAEP;actif;TV SONY 65ZF9BAEP;1972,02;Fixe;Boulanger Pro;SONY;MULTIMEDIA;TV;48,1;60;Oui;4548736078079;;PRODUITS PRINCIPAUX
1106004;TV SAMSUNG QE65Q9F 2018;actif;TV SAMSUNG QE65Q9F 2018;2201,54;Fixe;Boulanger Pro;SAMSUNG;MULTIMEDIA;TV;53,5;60;Oui;8801643151546;;PRODUITS PRINCIPAUX
1105863;TV SAMSUNG QE75Q7F 2018;actif;TV SAMSUNG QE75Q7F 2018;2560,72;Fixe;Boulanger Pro;SAMSUNG;MULTIMEDIA;TV;62,4;60;Oui;8801643154257;;PRODUITS PRINCIPAUX
1115138;TV SAMSUNG 65Q900R 8K;actif;TV SAMSUNG 65Q900R 8K;3109,38;Fixe;Boulanger Pro;SAMSUNG;MULTIMEDIA;TV;73,4;60;Oui;8801643494469;;PRODUITS PRINCIPAUX
1107947;TV SONY KD85XF8596;actif;TV SONY KD85XF8596;3279,69;Fixe;Boulanger Pro;SONY;MULTIMEDIA;TV;77,4;60;Oui;4548736076938;;PRODUITS PRINCIPAUX
1107192;TV LG OLED65G8;actif;TV LG OLED65G8;3635,32;Fixe;Boulanger Pro;LG;MULTIMEDIA;TV;85,7;60;Oui;8806098145195;;PRODUITS PRINCIPAUX
1106397;TV LG OLED65E8;actif;TV LG OLED65E8;2915;Fixe;Boulanger Pro;LG;MULTIMEDIA;TV;67,9;60;Oui;8806098145065;;PRODUITS PRINCIPAUX
1106396;TV LG OLED65W8;actif;TV LG OLED65W8;4611,42;Fixe;Boulanger Pro;LG;MULTIMEDIA;TV;105,8;60;Oui;8806098145294;;PRODUITS PRINCIPAUX
1115144;TV SAMSUNG 75Q900R 8K;actif;TV SAMSUNG 75Q900R 8K;4359,38;Fixe;Boulanger Pro;SAMSUNG;MULTIMEDIA;TV;100,8;60;Oui;8801643494476;;PRODUITS PRINCIPAUX
1106395;TV LG OLED77C8;actif;TV LG OLED77C8;7509,21;Fixe;Boulanger Pro;LG;MULTIMEDIA;TV;175,8;60;Oui;8806098204687;;PRODUITS PRINCIPAUX
