1103742,Lave vaisselle intégrable 60cm ELECTROLUX ESL5361LB,actif,Lave vaisselle intégrable 60cm ELECTROLUX ESL5361LB,"359,78",Fixe,Boulanger Pro,ELECTROLUX,GROS ELECTRO MENAGER,Lave Linge,"13,8",60,Oui,7332543620449,Lave vaisselle intégrable 60cm ELECTROLUX ESL5361LB,Produit principal
1070209,Lave vaisselle intégrable 60cm MIELE G6630SCi BB,actif,Lave vaisselle intégrable 60cm MIELE G6630SCi BB,"676,55",Fixe,Boulanger Pro,MIELE,GROS ELECTRO MENAGER,Lave Linge,"20,8",60,Oui,4002515693957,Lave vaisselle intégrable 60cm MIELE G6630SCi BB,Produit principal
1092462,Lave vaisselle intégrable 60cm SIEMENS SN536B03ME,actif,Lave vaisselle intégrable 60cm SIEMENS SN536B03ME,"409,15",Fixe,Boulanger Pro,SIEMENS,GROS ELECTRO MENAGER,Lave Linge,"14,9",60,Oui,4242003793534,Lave vaisselle intégrable 60cm SIEMENS SN536B03ME,Produit principal
1086813,Lave vaisselle intégrable 60cm SIEMENS SN536S02GE,actif,Lave vaisselle intégrable 60cm SIEMENS SN536S02GE,"397,78",Fixe,Boulanger Pro,SIEMENS,GROS ELECTRO MENAGER,Lave Linge,"14,9",60,Oui,4242003784631,Lave vaisselle intégrable 60cm SIEMENS SN536S02GE,Produit principal
1092463,Lave vaisselle intégrable 60cm SIEMENS SN536S03ME,actif,Lave vaisselle intégrable 60cm SIEMENS SN536S03ME,"437,72",Fixe,Boulanger Pro,SIEMENS,GROS ELECTRO MENAGER,Lave Linge,"15,7",60,Oui,4242003774687,Lave vaisselle intégrable 60cm SIEMENS SN536S03ME,Produit principal
1087164,Lave vaisselle intégrable 60cm SIEMENS SN558S16TE HOME CONNECT,actif,Lave vaisselle intégrable 60cm SIEMENS SN558S16TE HOME CONNECT,"551,96",Fixe,Boulanger Pro,SIEMENS,GROS ELECTRO MENAGER,Lave Linge,"18,5",60,Oui,4242003800881,Lave vaisselle intégrable 60cm SIEMENS SN558S16TE HOME CONNECT,Produit principal
1072606,Lave vaisselle intégrable 60cm WHIRLPOOL WBC3C26X,actif,Lave vaisselle intégrable 60cm WHIRLPOOL WBC3C26X,"340,9",Fixe,Boulanger Pro,WHIRLPOOL,GROS ELECTRO MENAGER,Lave Linge,"13,4",60,Oui,8003437203176,Lave vaisselle intégrable 60cm WHIRLPOOL WBC3C26X,Produit principal
1072633,Lave vaisselle intégrable 60cm WHIRLPOOL WBO3T123PFX,actif,Lave vaisselle intégrable 60cm WHIRLPOOL WBO3T123PFX,"349,79",Fixe,Boulanger Pro,WHIRLPOOL,GROS ELECTRO MENAGER,Lave Linge,"13,6",60,Oui,8003437204869,Lave vaisselle intégrable 60cm WHIRLPOOL WBO3T123PFX,Produit principal
1072635,Lave vaisselle intégrable 60cm WHIRLPOOL WKBO3T123PFB,actif,Lave vaisselle intégrable 60cm WHIRLPOOL WKBO3T123PFB,"340,95",Fixe,Boulanger Pro,WHIRLPOOL,GROS ELECTRO MENAGER,Lave Linge,"13,4",60,Oui,8003437204845,Lave vaisselle intégrable 60cm WHIRLPOOL WKBO3T123PFB,Produit principal
1086102,Lave vaisselle tout-intégrable 60cm BEKO LVI62F,actif,Lave vaisselle tout-intégrable 60cm BEKO LVI62F,"236,56",Fixe,Boulanger Pro,BEKO,GROS ELECTRO MENAGER,Lave Linge,"11,2",60,Oui,8690842073410,Lave vaisselle tout-intégrable 60cm BEKO LVI62F,Produit principal
1109461,Lave vaisselle tout-intégrable 60cm BOSCH SMV41D00EU,actif,Lave vaisselle tout-intégrable 60cm BOSCH SMV41D00EU,"304,78",Fixe,Boulanger Pro,BOSCH,GROS ELECTRO MENAGER,Lave Linge,"12,9",60,Oui,4242002772677,Lave vaisselle tout-intégrable 60cm BOSCH SMV41D00EU,Produit principal
1106418,Lave vaisselle tout-intégrable 60cm BOSCH SMV45GX02E,actif,Lave vaisselle tout-intégrable 60cm BOSCH SMV45GX02E,"343,25",Fixe,Boulanger Pro,BOSCH,GROS ELECTRO MENAGER,Lave Linge,"13,4",60,Oui,4242002965253,Lave vaisselle tout-intégrable 60cm BOSCH SMV45GX02E,Produit principal
1109462,Lave vaisselle tout-intégrable 60cm BOSCH SMV46AX01E,actif,Lave vaisselle tout-intégrable 60cm BOSCH SMV46AX01E,"348,78",Fixe,Boulanger Pro,BOSCH,GROS ELECTRO MENAGER,Lave Linge,"13,6",60,Oui,4242002969411,Lave vaisselle tout-intégrable 60cm BOSCH SMV46AX01E,Produit principal
1089240,Lave vaisselle tout-intégrable 60cm BOSCH SMV46AX04E,actif,Lave vaisselle tout-intégrable 60cm BOSCH SMV46AX04E,"384,27",Fixe,Boulanger Pro,BOSCH,GROS ELECTRO MENAGER,Lave Linge,"14,6",60,Oui,4242002995045,Lave vaisselle tout-intégrable 60cm BOSCH SMV46AX04E,Produit principal
1079353,Lave vaisselle tout-intégrable 60cm BOSCH SMV46MX03E,actif,Lave vaisselle tout-intégrable 60cm BOSCH SMV46MX03E,"395,64",Fixe,Boulanger Pro,BOSCH,GROS ELECTRO MENAGER,Lave Linge,"14,8",60,Oui,4242002953526,Lave vaisselle tout-intégrable 60cm BOSCH SMV46MX03E,Produit principal
1110369,Lave vaisselle tout-intégrable 60cm BOSCH SMV68MX07E,actif,Lave vaisselle tout-intégrable 60cm BOSCH SMV68MX07E,"475,28",Fixe,Boulanger Pro,BOSCH,GROS ELECTRO MENAGER,Lave Linge,"16,3",60,Oui,4242002983073,Lave vaisselle tout-intégrable 60cm BOSCH SMV68MX07E,Produit principal
1088854,Lave vaisselle tout-intégrable 60cm DE DIETRICH DVH1538J,actif,Lave vaisselle tout-intégrable 60cm DE DIETRICH DVH1538J,"372,78",Fixe,Boulanger Pro,DE DIETRICH,GROS ELECTRO MENAGER,Lave Linge,14,60,Oui,3660767959798,Lave vaisselle tout-intégrable 60cm DE DIETRICH DVH1538J,Produit principal
1103741,Lave vaisselle tout-intégrable 60cm ELECTROLUX ESL5362LB,actif,Lave vaisselle tout-intégrable 60cm ELECTROLUX ESL5362LB,"300,09",Fixe,Boulanger Pro,ELECTROLUX,GROS ELECTRO MENAGER,Lave Linge,"12,5",60,Oui,7332543620326,Lave vaisselle tout-intégrable 60cm ELECTROLUX ESL5362LB,Produit principal
1073394,Lave vaisselle tout-intégrable 60cm INDESIT DIFP66B+9 EU,actif,Lave vaisselle tout-intégrable 60cm INDESIT DIFP66B+9 EU,"269,6",Fixe,Boulanger Pro,INDESIT,GROS ELECTRO MENAGER,Lave Linge,"11,9",60,Oui,8050147004203,Lave vaisselle tout-intégrable 60cm INDESIT DIFP66B+9 EU,Produit principal
1070222,Lave vaisselle tout-intégrable 60cm MIELE G6670SCVi,actif,Lave vaisselle tout-intégrable 60cm MIELE G6670SCVi,"759,28",Fixe,Boulanger Pro,MIELE,GROS ELECTRO MENAGER,Lave Linge,"22,7",60,Oui,4002515693995,Lave vaisselle tout-intégrable 60cm MIELE G6670SCVi,Produit principal
1070251,Lave vaisselle tout-intégrable 60cm MIELE G6890SCVi K2O,actif,Lave vaisselle tout-intégrable 60cm MIELE G6890SCVi K2O,"1184,22",Fixe,Boulanger Pro,MIELE,GROS ELECTRO MENAGER,Lave Linge,"31,6",60,Oui,4002515694121,Lave vaisselle tout-intégrable 60cm MIELE G6890SCVi K2O,Produit principal
1083059,Lave vaisselle tout-intégrable 60cm ROSIERES RLF99,actif,Lave vaisselle tout-intégrable 60cm ROSIERES RLF99,"268,81",Fixe,Boulanger Pro,ROSIERES,GROS ELECTRO MENAGER,Lave Linge,"11,8",60,Oui,8016361916166,Lave vaisselle tout-intégrable 60cm ROSIERES RLF99,Produit principal
1087163,Lave vaisselle tout-intégrable 60cm SIEMENS SN636X03ME,actif,Lave vaisselle tout-intégrable 60cm SIEMENS SN636X03ME,"442,28",Fixe,Boulanger Pro,SIEMENS,GROS ELECTRO MENAGER,Lave Linge,"15,6",60,Oui,4242003762431,Lave vaisselle tout-intégrable 60cm SIEMENS SN636X03ME,Produit principal
1079354,Lave vaisselle tout-intégrable 60cm SIEMENS SN658X00ME,actif,Lave vaisselle tout-intégrable 60cm SIEMENS SN658X00ME,512,Fixe,Boulanger Pro,SIEMENS,GROS ELECTRO MENAGER,Lave Linge,"17,5",60,Oui,4242003776896,Lave vaisselle tout-intégrable 60cm SIEMENS SN658X00ME,Produit principal
1090314,Lave vaisselle tout-intégrable 60cm SIEMENS SN658X26TE HOME CONNECT,actif,Lave vaisselle tout-intégrable 60cm SIEMENS SN658X26TE HOME CONNECT,"637,68",Fixe,Boulanger Pro,SIEMENS,GROS ELECTRO MENAGER,Lave Linge,20,60,Oui,4242003800904,Lave vaisselle tout-intégrable 60cm SIEMENS SN658X26TE HOME CONNECT,Produit principal
1088187,Lave vaisselle tout-intégrable 60cm SIEMENS SX636X03ME,actif,Lave vaisselle tout-intégrable 60cm SIEMENS SX636X03ME,"506,3",Fixe,Boulanger Pro,SIEMENS,GROS ELECTRO MENAGER,Lave Linge,"17,2",60,Oui,4242003762547,Lave vaisselle tout-intégrable 60cm SIEMENS SX636X03ME,Produit principal
1090977,Lave vaisselle tout-intégrable 60cm WHIRLPOOL WIO3T122PS,actif,Lave vaisselle tout-intégrable 60cm WHIRLPOOL WIO3T122PS,"382,94",Fixe,Boulanger Pro,WHIRLPOOL,GROS ELECTRO MENAGER,Lave Linge,"14,5",60,Oui,8003437207969,Lave vaisselle tout-intégrable 60cm WHIRLPOOL WIO3T122PS,Produit principal
1072516,Lave vaisselle tout-intégrable 60cm WHIRLPOOL WIO3T123PEF,actif,Lave vaisselle tout-intégrable 60cm WHIRLPOOL WIO3T123PEF,"349,78",Fixe,Boulanger Pro,WHIRLPOOL,GROS ELECTRO MENAGER,Lave Linge,"13,5",60,Oui,8003437204036,Lave vaisselle tout-intégrable 60cm WHIRLPOOL WIO3T123PEF,Produit principal
1093352,Four combiné NEFF C17UR02N0,actif,Four combiné NEFF C17UR02N0,"463,4",Fixe,Boulanger Pro,NEFF,GROS ELECTRO MENAGER,Four Micro-ondes,"15,1",60,Oui,4242004207016,Four combiné NEFF C17UR02N0,Produit principal
1109493,Micro-ondes encastrable BOSCH BEL524MS0,actif,Micro-ondes encastrable BOSCH BEL524MS0,"232,79",Fixe,Boulanger Pro,BOSCH,GROS ELECTRO MENAGER,Four Micro-ondes,"10,3",60,Oui,4242005038879,Micro-ondes encastrable BOSCH BEL524MS0,Produit principal
1109522,Micro-ondes encastrable BOSCH CMA583MS0,actif,Micro-ondes encastrable BOSCH CMA583MS0,"394,17",Fixe,Boulanger Pro,BOSCH,GROS ELECTRO MENAGER,Four Micro-ondes,"13,4",60,Oui,4242005036653,Micro-ondes encastrable BOSCH CMA583MS0,Produit principal
1049683,Micro-ondes encastrable BOSCH Série 8 BFL634GB1,actif,Micro-ondes encastrable BOSCH Série 8 BFL634GB1,"401,44",Fixe,Boulanger Pro,BOSCH,GROS ELECTRO MENAGER,Four Micro-ondes,"13,3",60,Oui,4242002813752,Micro-ondes encastrable BOSCH Série 8 BFL634GB1,Produit principal
1050038,Micro-ondes encastrable BOSCH Série 8 BFL634GS1,actif,Micro-ondes encastrable BOSCH Série 8 BFL634GS1,"401,44",Fixe,Boulanger Pro,BOSCH,GROS ELECTRO MENAGER,Four Micro-ondes,"13,2",60,Oui,4242002813769,Micro-ondes encastrable BOSCH Série 8 BFL634GS1,Produit principal
1074607,Micro-ondes encastrable BRANDT BMS6115X,actif,Micro-ondes encastrable BRANDT BMS6115X,"248,76",Fixe,Boulanger Pro,BRANDT,GROS ELECTRO MENAGER,Four Micro-ondes,"10,6",60,Oui,3660767955226,Micro-ondes encastrable BRANDT BMS6115X,Produit principal
1037190,Micro-ondes encastrable ELECTROLUX EMT25207OX,actif,Micro-ondes encastrable ELECTROLUX EMT25207OX,"258,22",Fixe,Boulanger Pro,ELECTROLUX,GROS ELECTRO MENAGER,Four Micro-ondes,"10,8",60,Oui,7332543309375,Micro-ondes encastrable ELECTROLUX EMT25207OX,Produit principal
1090316,Micro-ondes encastrable INDESIT MWI5213IX,actif,Micro-ondes encastrable INDESIT MWI5213IX,"209,3",Fixe,Boulanger Pro,INDESIT,GROS ELECTRO MENAGER,Four Micro-ondes,"9,7",60,Oui,8050147026960,Micro-ondes encastrable INDESIT MWI5213IX,Produit principal
1036591,Micro-ondes encastrable NEFF C17WR00N0,actif,Micro-ondes encastrable NEFF C17WR00N0,"420,52",Fixe,Boulanger Pro,NEFF,GROS ELECTRO MENAGER,Four Micro-ondes,"13,7",60,Oui,4242004184546,Micro-ondes encastrable NEFF C17WR00N0,Produit principal
1069928,Micro-ondes encastrable SAMSUNG NQ50K3130BS,actif,Micro-ondes encastrable SAMSUNG NQ50K3130BS,"341,47",Fixe,Boulanger Pro,SAMSUNG,GROS ELECTRO MENAGER,Four Micro-ondes,"12,3",60,Oui,8806088321745,Micro-ondes encastrable SAMSUNG NQ50K3130BS,Produit principal
1105400,Micro-ondes encastrable SIEMENS BF555LMS0,actif,Micro-ondes encastrable SIEMENS BF555LMS0,"281,53",Fixe,Boulanger Pro,SIEMENS,GROS ELECTRO MENAGER,Four Micro-ondes,"11,4",60,Oui,4242003805718,Micro-ondes encastrable SIEMENS BF555LMS0,Produit principal
1048441,Micro-ondes encastrable SIEMENS BF634LGS1,actif,Micro-ondes encastrable SIEMENS BF634LGS1,"401,4",Fixe,Boulanger Pro,SIEMENS,GROS ELECTRO MENAGER,Four Micro-ondes,"13,2",60,Oui,4242003676400,Micro-ondes encastrable SIEMENS BF634LGS1,Produit principal
1110815,Micro-ondes encastrable SIEMENS CM585AMS0,actif,Micro-ondes encastrable SIEMENS CM585AMS0,"497,28",Fixe,Boulanger Pro,SIEMENS,GROS ELECTRO MENAGER,Four Micro-ondes,"15,9",60,Oui,4242003805336,Micro-ondes encastrable SIEMENS CM585AMS0,Produit principal
1048494,Micro-ondes encastrable WHIRLPOOL AMW439IX,actif,Micro-ondes encastrable WHIRLPOOL AMW439IX,"275,3",Fixe,Boulanger Pro,WHIRLPOOL,GROS ELECTRO MENAGER,Four Micro-ondes,"11,2",60,Oui,8003437394751,Micro-ondes encastrable WHIRLPOOL AMW439IX,Produit principal
1048536,Micro-ondes encastrable WHIRLPOOL AMW730IX,actif,Micro-ondes encastrable WHIRLPOOL AMW730IX,"337,72",Fixe,Boulanger Pro,WHIRLPOOL,GROS ELECTRO MENAGER,Four Micro-ondes,12,60,Oui,8003437394768,Micro-ondes encastrable WHIRLPOOL AMW730IX,Produit principal
1092731,Domino gaz DE DIETRICH DPG7340B,actif,Domino gaz DE DIETRICH DPG7340B,"206,97",Fixe,Boulanger Pro,DE DIETRICH,GROS ELECTRO MENAGER,Cuisson,"10,1",60,Oui,3660767964747,Domino gaz DE DIETRICH DPG7340B,Produit principal
1034261,Domino induction SMEG SI5322B,actif,Domino induction SMEG SI5322B,"220,87",Fixe,Boulanger Pro,SMEG,GROS ELECTRO MENAGER,Cuisson,"10,4",60,Oui,8017709193386,Domino induction SMEG SI5322B,Produit principal
1088987,Table cuisson gaz BOSCH PCC6A5B90,actif,Table cuisson gaz BOSCH PCC6A5B90,"189,8",Fixe,Boulanger Pro,BOSCH,GROS ELECTRO MENAGER,Cuisson,"9,7",60,Oui,4242002802688,Table cuisson gaz BOSCH PCC6A5B90,Produit principal
1088988,Table cuisson gaz BOSCH PCQ7A5B80,actif,Table cuisson gaz BOSCH PCQ7A5B80,"253,87",Fixe,Boulanger Pro,BOSCH,GROS ELECTRO MENAGER,Cuisson,"11,1",60,Oui,4242002914428,Table cuisson gaz BOSCH PCQ7A5B80,Produit principal
1071339,Table cuisson gaz ELECTROLUX EGH6349GOX,actif,Table cuisson gaz ELECTROLUX EGH6349GOX,"285,12",Fixe,Boulanger Pro,ELECTROLUX,GROS ELECTRO MENAGER,Cuisson,"11,2",60,Oui,7332543457427,Table cuisson gaz ELECTROLUX EGH6349GOX,Produit principal
1091724,Table cuisson gaz ROSIERES RGV75WFM PN,actif,Table cuisson gaz ROSIERES RGV75WFM PN,"281,93",Fixe,Boulanger Pro,ROSIERES,GROS ELECTRO MENAGER,Cuisson,"11,7",60,Oui,8016361921245,Table cuisson gaz ROSIERES RGV75WFM PN,Produit principal
1086490,Table cuisson gaz ROSIERES RTV750FPN,actif,Table cuisson gaz ROSIERES RTV750FPN,"239,17",Fixe,Boulanger Pro,ROSIERES,GROS ELECTRO MENAGER,Cuisson,"10,8",60,Oui,8016361712850,Table cuisson gaz ROSIERES RTV750FPN,Produit principal
1088989,Table cuisson gaz SIEMENS EC6A5HB90,actif,Table cuisson gaz SIEMENS EC6A5HB90,"239,35",Fixe,Boulanger Pro,SIEMENS,GROS ELECTRO MENAGER,Cuisson,"10,8",60,Oui,4242003741962,Table cuisson gaz SIEMENS EC6A5HB90,Produit principal
1090164,Table cuisson gaz SIEMENS EP6A6CB20,actif,Table cuisson gaz SIEMENS EP6A6CB20,"240,05",Fixe,Boulanger Pro,SIEMENS,GROS ELECTRO MENAGER,Cuisson,"10,8",60,Oui,4242003742372,Table cuisson gaz SIEMENS EP6A6CB20,Produit principal
1088998,Table cuisson gaz SIEMENS EP6A6PB20,actif,Table cuisson gaz SIEMENS EP6A6PB20,"250,99",Fixe,Boulanger Pro,SIEMENS,GROS ELECTRO MENAGER,Cuisson,11,60,Oui,4242003742440,Table cuisson gaz SIEMENS EP6A6PB20,Produit principal
1084323,Table cuisson gaz SMEG SRV876AOGH,actif,Table cuisson gaz SMEG SRV876AOGH,"330,87",Fixe,Boulanger Pro,SMEG,GROS ELECTRO MENAGER,Cuisson,"12,2",60,Oui,8017709233273,Table cuisson gaz SMEG SRV876AOGH,Produit principal
1109595,Table cuisson gaz WHIRLPOOL GOW7553WH,actif,Table cuisson gaz WHIRLPOOL GOW7553WH,"275,87",Fixe,Boulanger Pro,WHIRLPOOL,GROS ELECTRO MENAGER,Cuisson,"11,6",60,Oui,8003437232206,Table cuisson gaz WHIRLPOOL GOW7553WH,Produit principal
1109594,Table cuisson gaz WHIRLPOOL W COLLECTION GOW7553NB,actif,Table cuisson gaz WHIRLPOOL W COLLECTION GOW7553NB,"275,87",Fixe,Boulanger Pro,WHIRLPOOL,GROS ELECTRO MENAGER,Cuisson,"11,6",60,Oui,8003437232329,Table cuisson gaz WHIRLPOOL W COLLECTION GOW7553NB,Produit principal
1101214,Table cuisson induction BEKO HII61SA,actif,Table cuisson induction BEKO HII61SA,"193,37",Fixe,Boulanger Pro,BEKO,GROS ELECTRO MENAGER,Cuisson,"9,7",60,Oui,8690842086564,Table cuisson induction BEKO HII61SA,Produit principal
1074220,Table cuisson induction BOSCH PIJ631FB1E,actif,Table cuisson induction BOSCH PIJ631FB1E,"321,24",Fixe,Boulanger Pro,BOSCH,GROS ELECTRO MENAGER,Cuisson,12,60,Oui,4242002945675,Table cuisson induction BOSCH PIJ631FB1E,Produit principal
1087850,Table cuisson induction BOSCH PUC651BB1E,actif,Table cuisson induction BOSCH PUC651BB1E,"251,43",Fixe,Boulanger Pro,BOSCH,GROS ELECTRO MENAGER,Cuisson,"11,1",60,Oui,4242002982977,Table cuisson induction BOSCH PUC651BB1E,Produit principal
1109212,Table cuisson induction BOSCH PXE651FC1E,actif,Table cuisson induction BOSCH PXE651FC1E,"374,41",Fixe,Boulanger Pro,BOSCH,GROS ELECTRO MENAGER,Cuisson,"13,1",60,Oui,4242002848822,Table cuisson induction BOSCH PXE651FC1E,Produit principal
1074582,Table cuisson induction BRANDT BPI6413BM,actif,Table cuisson induction BRANDT BPI6413BM,"274,91",Fixe,Boulanger Pro,BRANDT,GROS ELECTRO MENAGER,Cuisson,"11,6",60,Oui,3660767954243,Table cuisson induction BRANDT BPI6413BM,Produit principal
1088523,Table cuisson induction DE DIETRICH DPI7572X,actif,Table cuisson induction DE DIETRICH DPI7572X,"363,86",Fixe,Boulanger Pro,DE DIETRICH,GROS ELECTRO MENAGER,Cuisson,"12,9",60,Oui,3660767962163,Table cuisson induction DE DIETRICH DPI7572X,Produit principal
1088525,Table cuisson induction DE DIETRICH DPI7686GP,actif,Table cuisson induction DE DIETRICH DPI7686GP,"468,37",Fixe,Boulanger Pro,DE DIETRICH,GROS ELECTRO MENAGER,Cuisson,"15,1",60,Oui,3660767962323,Table cuisson induction DE DIETRICH DPI7686GP,Produit principal
1088776,Table cuisson induction DE DIETRICH DPI7688XS,actif,Table cuisson induction DE DIETRICH DPI7688XS,"525,29",Fixe,Boulanger Pro,DE DIETRICH,GROS ELECTRO MENAGER,Cuisson,"16,3",60,Oui,3660767962361,Table cuisson induction DE DIETRICH DPI7688XS,Produit principal
1090509,Table cuisson induction DE DIETRICH DPI7698G,actif,Table cuisson induction DE DIETRICH DPI7698G,"576,54",Fixe,Boulanger Pro,DE DIETRICH,GROS ELECTRO MENAGER,Cuisson,"17,4",60,Oui,3660767962392,Table cuisson induction DE DIETRICH DPI7698G,Produit principal
1088777,Table cuisson induction DE DIETRICH DPI7698GS,actif,Table cuisson induction DE DIETRICH DPI7698GS,"659,24",Fixe,Boulanger Pro,DE DIETRICH,GROS ELECTRO MENAGER,Cuisson,"19,2",60,Oui,3660767962408,Table cuisson induction DE DIETRICH DPI7698GS,Produit principal
1088780,Table cuisson induction DE DIETRICH DPI7966XS,actif,Table cuisson induction DE DIETRICH DPI7966XS,"874,72",Fixe,Boulanger Pro,DE DIETRICH,GROS ELECTRO MENAGER,Cuisson,"23,9",60,Oui,3660767962460,Table cuisson induction DE DIETRICH DPI7966XS,Produit principal
1088851,Table cuisson induction DE DIETRICH DPI7969XS,actif,Table cuisson induction DE DIETRICH DPI7969XS,"877,72",Fixe,Boulanger Pro,DE DIETRICH,GROS ELECTRO MENAGER,Cuisson,"23,9",60,Oui,3660767962477,Table cuisson induction DE DIETRICH DPI7969XS,Produit principal
1107063,Table cuisson induction ELECTROLUX BIT60336BK,actif,Table cuisson induction ELECTROLUX BIT60336BK,"216,69",Fixe,Boulanger Pro,ELECTROLUX,GROS ELECTRO MENAGER,Cuisson,"10,3",60,Oui,7332543620456,Table cuisson induction ELECTROLUX BIT60336BK,Produit principal
1107068,Table cuisson induction ELECTROLUX BIV63340BK,actif,Table cuisson induction ELECTROLUX BIV63340BK,"254,9",Fixe,Boulanger Pro,ELECTROLUX,GROS ELECTRO MENAGER,Cuisson,"11,1",60,Oui,7332543621026,Table cuisson induction ELECTROLUX BIV63340BK,Produit principal
1107070,Table cuisson induction ELECTROLUX CIV65440BK,actif,Table cuisson induction ELECTROLUX CIV65440BK,"311,52",Fixe,Boulanger Pro,ELECTROLUX,GROS ELECTRO MENAGER,Cuisson,"11,7",60,Oui,7332543620463,Table cuisson induction ELECTROLUX CIV65440BK,Produit principal
1107113,Table cuisson induction ELECTROLUX EIT61443B,actif,Table cuisson induction ELECTROLUX EIT61443B,"255,4",Fixe,Boulanger Pro,ELECTROLUX,GROS ELECTRO MENAGER,Cuisson,"11,1",60,Oui,7332543606306,Table cuisson induction ELECTROLUX EIT61443B,Produit principal
1111583,Table cuisson induction ELECTROLUX EIV73342,actif,Table cuisson induction ELECTROLUX EIV73342,"356,55",Fixe,Boulanger Pro,ELECTROLUX,GROS ELECTRO MENAGER,Cuisson,"12,7",60,Oui,7332543644087,Table cuisson induction ELECTROLUX EIV73342,Produit principal
1109598,Table cuisson induction ELECTROLUX EIV955,actif,Table cuisson induction ELECTROLUX EIV955,"550,87",Fixe,Boulanger Pro,ELECTROLUX,GROS ELECTRO MENAGER,Cuisson,"16,9",60,Oui,7332543587278,Table cuisson induction ELECTROLUX EIV955,Produit principal
1079600,Table cuisson induction ELICA NIKOLATESLA BL/F/83,actif,Table cuisson induction ELICA NIKOLATESLA BL/F/83,"1547,8",Fixe,Boulanger Pro,ELICA,GROS ELECTRO MENAGER,Cuisson,38,60,Oui,8020283042094,Table cuisson induction ELICA NIKOLATESLA BL/F/83,Produit principal
1073319,Table cuisson induction HOTPOINT HKID641B C,actif,Table cuisson induction HOTPOINT HKID641B C,"258,65",Fixe,Boulanger Pro,HOTPOINT,GROS ELECTRO MENAGER,Cuisson,"11,2",60,Oui,8050147041338,Table cuisson induction HOTPOINT HKID641B C,Produit principal
1073502,Table cuisson induction NEFF T48FD13X0,actif,Table cuisson induction NEFF T48FD13X0,"495,87",Fixe,Boulanger Pro,NEFF,GROS ELECTRO MENAGER,Cuisson,"15,8",60,Oui,4242004191407,Table cuisson induction NEFF T48FD13X0,Produit principal
1093360,Table cuisson induction NEFF T57TT60N0,actif,Table cuisson induction NEFF T57TT60N0,"748,86",Fixe,Boulanger Pro,NEFF,GROS ELECTRO MENAGER,Cuisson,"21,1",60,Oui,4242004191926,Table cuisson induction NEFF T57TT60N0,Produit principal
1069829,Table cuisson induction SAMSUNG NZ64K7757BK,actif,Table cuisson induction SAMSUNG NZ64K7757BK,"347,28",Fixe,Boulanger Pro,SAMSUNG,GROS ELECTRO MENAGER,Cuisson,"12,5",60,Oui,8806088112930,Table cuisson induction SAMSUNG NZ64K7757BK,Produit principal
1091649,Table cuisson induction SAMSUNG NZ64M3NM1BB,actif,Table cuisson induction SAMSUNG NZ64M3NM1BB,"232,503333",Fixe,Boulanger Pro,SAMSUNG,GROS ELECTRO MENAGER,Cuisson,"10,6",60,Oui,8806088757261,Table cuisson induction SAMSUNG NZ64M3NM1BB,Produit principal
1051603,Table cuisson induction SAUTER EX SPI4366B,actif,Table cuisson induction SAUTER EX SPI4366B,"303,37",Fixe,Boulanger Pro,SAUTER,GROS ELECTRO MENAGER,Cuisson,"11,6",60,Oui,3660767208100,Table cuisson induction SAUTER EX SPI4366B,Produit principal
1046254,Table cuisson induction SAUTER EX SPI4666B,actif,Table cuisson induction SAUTER EX SPI4666B,"358,37",Fixe,Boulanger Pro,SAUTER,GROS ELECTRO MENAGER,Cuisson,"12,7",60,Oui,3660767208247,Table cuisson induction SAUTER EX SPI4666B,Produit principal
1051604,Table cuisson induction SAUTER SPI4368B,actif,Table cuisson induction SAUTER SPI4368B,"358,76",Fixe,Boulanger Pro,SAUTER,GROS ELECTRO MENAGER,Cuisson,"12,8",60,Oui,3660767208124,Table cuisson induction SAUTER SPI4368B,Produit principal
1076125,Table cuisson induction SAUTER SPI6467B,actif,Table cuisson induction SAUTER SPI6467B,"322,92",Fixe,Boulanger Pro,SAUTER,GROS ELECTRO MENAGER,Cuisson,12,60,Oui,3660767957732,Table cuisson induction SAUTER SPI6467B,Produit principal
1074602,Table cuisson induction SAUTER SPIN4361B,actif,Table cuisson induction SAUTER SPIN4361B,"249,93",Fixe,Boulanger Pro,SAUTER,GROS ELECTRO MENAGER,Cuisson,11,60,Oui,3660767957701,Table cuisson induction SAUTER SPIN4361B,Produit principal
1072388,Table cuisson induction SIEMENS ED851FSB1E,actif,Table cuisson induction SIEMENS ED851FSB1E,"440,87",Fixe,Boulanger Pro,SIEMENS,GROS ELECTRO MENAGER,Cuisson,"14,5",60,Oui,4242003691724,Table cuisson induction SIEMENS ED851FSB1E,Produit principal
1087872,Table cuisson induction SIEMENS EU631BCB1E,actif,Table cuisson induction SIEMENS EU631BCB1E,"255,43",Fixe,Boulanger Pro,SIEMENS,GROS ELECTRO MENAGER,Cuisson,"11,2",60,Oui,4242003716526,Table cuisson induction SIEMENS EU631BCB1E,Produit principal
1087873,Table cuisson induction SIEMENS EU651BEB1E,actif,Table cuisson induction SIEMENS EU651BEB1E,"235,86",Fixe,Boulanger Pro,SIEMENS,GROS ELECTRO MENAGER,Cuisson,"10,7",60,Oui,4242003787199,Table cuisson induction SIEMENS EU651BEB1E,Produit principal
1087874,Table cuisson induction SIEMENS EX652FEB1F,actif,Table cuisson induction SIEMENS EX652FEB1F,"450,21",Fixe,Boulanger Pro,SIEMENS,GROS ELECTRO MENAGER,Cuisson,"14,7",60,Oui,4242003757468,Table cuisson induction SIEMENS EX652FEB1F,Produit principal
1071418,Table cuisson induction SIEMENS EX679FEC1F,actif,Table cuisson induction SIEMENS EX679FEC1F,"508,53",Fixe,Boulanger Pro,SIEMENS,GROS ELECTRO MENAGER,Cuisson,16,60,Oui,4242003694305,Table cuisson induction SIEMENS EX679FEC1F,Produit principal
1112804,Table cuisson induction SIEMENS EX731FEC1F,actif,Table cuisson induction SIEMENS EX731FEC1F,"450,05",Fixe,Boulanger Pro,SIEMENS,GROS ELECTRO MENAGER,Cuisson,"14,7",60,Oui,4242003834428,Table cuisson induction SIEMENS EX731FEC1F,Produit principal
1071420,Table cuisson induction SIEMENS EX851FEC1F,actif,Table cuisson induction SIEMENS EX851FEC1F,"547,1",Fixe,Boulanger Pro,SIEMENS,GROS ELECTRO MENAGER,Cuisson,"16,8",60,Oui,4242003757994,Table cuisson induction SIEMENS EX851FEC1F,Produit principal
1100525,Table cuisson induction SIEMENS EX875LYV1E HOME CONNECT,actif,Table cuisson induction SIEMENS EX875LYV1E HOME CONNECT,"880,87",Fixe,Boulanger Pro,SIEMENS,GROS ELECTRO MENAGER,Cuisson,24,60,Oui,4242003786338,Table cuisson induction SIEMENS EX875LYV1E HOME CONNECT,Produit principal
1072384,Table cuisson induction WHIRLPOOL ACM334BF,actif,Table cuisson induction WHIRLPOOL ACM334BF,"244,81",Fixe,Boulanger Pro,WHIRLPOOL,GROS ELECTRO MENAGER,Cuisson,"10,9",60,Oui,8003437832710,Table cuisson induction WHIRLPOOL ACM334BF,Produit principal
1080554,Table cuisson induction WHIRLPOOL ACM680NEWH,actif,Table cuisson induction WHIRLPOOL ACM680NEWH,"265,47",Fixe,Boulanger Pro,WHIRLPOOL,GROS ELECTRO MENAGER,Cuisson,"11,4",60,Oui,8003437832574,Table cuisson induction WHIRLPOOL ACM680NEWH,Produit principal
1067570,Table cuisson induction WHIRLPOOL ACM932BF,actif,Table cuisson induction WHIRLPOOL ACM932BF,"253,99",Fixe,Boulanger Pro,WHIRLPOOL,GROS ELECTRO MENAGER,Cuisson,"11,1",60,Oui,8003437832086,Table cuisson induction WHIRLPOOL ACM932BF,Produit principal
1089587,Table cuisson induction WHIRLPOOL SMC604FNE,actif,Table cuisson induction WHIRLPOOL SMC604FNE,"340,13",Fixe,Boulanger Pro,WHIRLPOOL,GROS ELECTRO MENAGER,Cuisson,"12,4",60,Oui,8003437207471,Table cuisson induction WHIRLPOOL SMC604FNE,Produit principal
