TYPE;Référence;Désignation;Etat;Commentaire;Prix d'achat dont ecotaxe;EcoTaxe;Eco Mobilier;Type;Fournisseur;Fabriquant;Catégorie;Sous Catégorie;Loyer;Durée;Visible sur le site;EAN;Description;id_document_contrat :;url image
PRODUIT PRINCIPAL;1120298;TV GRUNDIG 49VLX7850WP;actif;TV GRUNDIG 49VLX7850WP;311,35;8,33;0;Fixe;Boulanger Pro;GRUNDIG;MULTIMEDIA;TV;8,1;60;Oui;4013833032779;TV GRUNDIG 49VLX7850WP;;https://boulanger.scene7.com/is/image/Boulanger/4013833032779_h_f_l_0
PRODUIT PRINCIPAL;1129289;Micro chaîne YAMAHA TSX-B 235D noir;actif;Micro chaîne YAMAHA TSX-B 235D noir;323,66;1,67;0;Portable;Boulanger Pro;YAMAHA;MULTIMEDIA;Son Hifi;11;36;Oui;4957812588935;Micro chaîne YAMAHA TSX-B 235D noir;;https://boulanger.scene7.com/is/image/Boulanger/4957812588935_h_f_l_0
PRODUIT PRINCIPAL;1129287;Amplificateur hifi YAMAHA MusicCast R-N 303D silver;actif;Amplificateur hifi YAMAHA MusicCast R-N 303D silver;358,09;1,67;0;Portable;Boulanger Pro;YAMAHA;MULTIMEDIA;Son Hifi;12,1;36;Oui;4957812620390;Amplificateur hifi YAMAHA MusicCast R-N 303D silver;;https://boulanger.scene7.com/is/image/Boulanger/4957812620390_h_f_l_0
PRODUIT PRINCIPAL;1128380;Amplificateur hifi A/V DENON AVRX1600H black;actif;Amplificateur hifi A/V DENON AVRX1600H black;441,16;1,67;0;Portable;Boulanger Pro;DENON;MULTIMEDIA;Son Hifi;14,9;36;Oui;4951035069707;Amplificateur hifi A/V DENON AVRX1600H black;;https://boulanger.scene7.com/is/image/Boulanger/4951035069707_h_f_l_0
PRODUIT PRINCIPAL;1094200;Pack 5 DAVIS Cinestyle;actif;Pack 5 DAVIS Cinestyle;549,37;2,1;0;Portable;Boulanger Pro;DAVIS;MULTIMEDIA;Son Hifi;18;36;Oui;3700053296944;Pack 5 DAVIS Cinestyle;;https://boulanger.scene7.com/is/image/Boulanger/3700053296944_h_f_l_0
PRODUIT PRINCIPAL;1131243;Congélateur armoire LG GF5237PZJZ1;actif;Congélateur armoire LG GF5237PZJZ1;797,19;15;0;Fixe;Boulanger Pro;LG;GROS ELECTRO MENAGER;Congélateur;18,9;60;Oui;8806098424320;Congélateur armoire LG GF5237PZJZ1;;https://boulanger.scene7.com/is/image/Boulanger/8806098424320_h_f_l_0
PRODUIT PRINCIPAL;1129938;Amplificateur hifi A/V MARANTZ SR6014 noir;actif;Amplificateur hifi A/V MARANTZ SR6014 noir;1121,56;1,67;0;Portable;Boulanger Pro;MARANTZ;MULTIMEDIA;Son Hifi;36,1;36;Oui;4951035069981;Amplificateur hifi A/V MARANTZ SR6014 noir;;https://boulanger.scene7.com/is/image/Boulanger/4951035069981_h_f_l_0
PRODUIT PRINCIPAL;1036836;Platine TD PIONEER PL30K;actif;Platine TD PIONEER PL30K;308,57;0,42;0;Portable;Boulanger Pro;PIONEER;MULTIMEDIA;Son Hifi;10,5;36;Oui;4988028275487;Platine TD PIONEER PL30K;;https://boulanger.scene7.com/is/image/Boulanger/4988028275487_h_f_l_0
PRODUIT PRINCIPAL;1074175;Coffre ELECTROLUX EC2830AOW2;actif;Coffre ELECTROLUX EC2830AOW2;323,24;15;0;Fixe;Boulanger Pro;ELECTROLUX;GROS ELECTRO MENAGER;Congélateur;8,7;60;Oui;7332543326983;Coffre ELECTROLUX EC2830AOW2;;https://boulanger.scene7.com/is/image/Boulanger/7332543326983_h_f_l_0
PRODUIT PRINCIPAL;1133881;Disque WESTERN DIGITAL SSD My Passport Go 2To Black / Cobalt;actif;Disque WESTERN DIGITAL SSD My Passport Go 2To Black / Cobalt;312,5;0,01;0;Portable;Boulanger Pro;WESTERN DIGITAL;INFORMATIQUE;DISQUE DUR;10,5;36;Oui;619659174804;Disque WESTERN DIGITAL SSD My Passport Go 2To Black / Cobalt;;https://boulanger.scene7.com/is/image/Boulanger/0619659174804_h_f_l_0
PRODUIT PRINCIPAL;1037531;Amplificateur hifi YAMAHA AS301 NOIR;actif;Amplificateur hifi YAMAHA AS301 NOIR;320,55;1,67;0;Portable;Boulanger Pro;YAMAHA;MULTIMEDIA;Son Hifi;10,9;36;Oui;4957812573580;Amplificateur hifi YAMAHA AS301 NOIR;;https://boulanger.scene7.com/is/image/Boulanger/4957812573580_h_f_l_0
PRODUIT PRINCIPAL;1128970;Lave linge hublot BEKO WTV1744XWAQDOS;actif;Lave linge hublot BEKO WTV1744XWAQDOS;350,66;6,67;0;Fixe;Boulanger Pro;BEKO;GROS ELECTRO MENAGER;Lave Linge;9,9;60;Oui;8690842257957;Lave linge hublot BEKO WTV1744XWAQDOS;;https://boulanger.scene7.com/is/image/Boulanger/8690842257957_h_f_l_0
PRODUIT PRINCIPAL;1128964;Lave linge séchant hublot BEKO WTLD81467P;actif;Lave linge séchant hublot BEKO WTLD81467P;359,24;6,67;0;Fixe;Boulanger Pro;BEKO;GROS ELECTRO MENAGER;Lave Linge;9,9;60;Oui;8690842258251;Lave linge séchant hublot BEKO WTLD81467P;;https://boulanger.scene7.com/is/image/Boulanger/8690842258251_h_f_l_0
PRODUIT PRINCIPAL;1133644;Aspirateur traineau Balai ROWENTA RH9571WO Air Force Flex 760;actif;Aspirateur traineau Balai ROWENTA RH9571WO Air Force Flex 760;367,76;0,83;0;Portable;Boulanger Pro;ROWENTA;PETIT ELECTRO MENAGER;Aspirateur;12,4;36;Oui;3221614006289;Aspirateur traineau Balai ROWENTA RH9571WO Air Force Flex 760;;https://boulanger.scene7.com/is/image/Boulanger/3221614006289_h_f_l_0
PRODUIT PRINCIPAL;1131981;Console SONY PS4 Pro 1To Fifa 20 + Abo PS+ 14 jours;actif;Console SONY PS4 Pro 1To Fifa 20 + Abo PS+ 14 jours;373,53;0,2;0;Portable;Boulanger Pro;SONY;MULTIMEDIA;Console de jeux;12,6;36;Oui;711719979609;Console SONY PS4 Pro 1To Fifa 20 + Abo PS+ 14 jours;;https://boulanger.scene7.com/is/image/Boulanger/0711719979609_h_f_l_0
PRODUIT PRINCIPAL;1131323;Montre connectée sport GARMIN Fenix 6;actif;Montre connectée sport GARMIN Fenix 6;437,38;0,06;0;Portable;Boulanger Pro;GARMIN;AUTRE;MONTRE INTELLIGENTE;14,7;36;Oui;753759232702;Montre connectée sport GARMIN Fenix 6;;https://boulanger.scene7.com/is/image/Boulanger/0753759232702_h_f_l_0
PRODUIT PRINCIPAL;1037537;Amplificateur hifi YAMAHA AS701 SILVER;actif;Amplificateur hifi YAMAHA AS701 SILVER;560,91;1,67;0;Portable;Boulanger Pro;YAMAHA;MULTIMEDIA;Son Hifi;18,2;36;Oui;4957812573795;Amplificateur hifi YAMAHA AS701 SILVER;;https://boulanger.scene7.com/is/image/Boulanger/4957812573795_h_f_l_0
PRODUIT PRINCIPAL;1128719;Réfrigérateur américain BEKO GN163120PT;actif;Réfrigérateur américain BEKO GN163120PT;595,81;19,17;0;Fixe;Boulanger Pro;BEKO;GROS ELECTRO MENAGER;Réfrigérateur;15,4;60;Oui;8690842173172;Réfrigérateur américain BEKO GN163120PT;;https://boulanger.scene7.com/is/image/Boulanger/8690842173172_h_f_l_0
PRODUIT PRINCIPAL;1130389;Lave linge hublot MIELE WDD 035;actif;Lave linge hublot MIELE WDD 035;598,38;6,67;0;Fixe;Boulanger Pro;MIELE;GROS ELECTRO MENAGER;Lave Linge;15;60;Oui;4002516178835;Lave linge hublot MIELE WDD 035;;https://boulanger.scene7.com/is/image/Boulanger/4002516178835_h_f_l_0
PRODUIT PRINCIPAL;1096915;Four pyrolyse SMEG SFP6925PPZE1;actif;Four pyrolyse SMEG SFP6925PPZE1;689,97;8,33;0;Fixe;Boulanger Pro;SMEG;GROS ELECTRO MENAGER;Four;15,9;60;Oui;8017709241759;Four pyrolyse SMEG SFP6925PPZE1;;https://boulanger.scene7.com/is/image/Boulanger/8017709241759_h_f_l_0
PRODUIT PRINCIPAL;1107657;Four émail SMEG SF4920MCN1;actif;Four émail SMEG SF4920MCN1;743,75;2,5;0;Fixe;Boulanger Pro;SMEG;GROS ELECTRO MENAGER;Four;17;60;Oui;8017709241629;Four émail SMEG SF4920MCN1;;https://boulanger.scene7.com/is/image/Boulanger/8017709241629_h_f_l_0
PRODUIT PRINCIPAL;1130488;Sèche-linge hublot MIELE TDD 430 WP;actif;Sèche-linge hublot MIELE TDD 430 WP;751,63;8,33;0;Fixe;Boulanger Pro;MIELE;GROS ELECTRO MENAGER;Sèche Linge;17,4;60;Oui;4002516229803;Sèche-linge hublot MIELE TDD 430 WP;;https://boulanger.scene7.com/is/image/Boulanger/4002516229803_h_f_l_0
PRODUIT PRINCIPAL;1127004;Cave à vin ARTEVINO OXM1T182NPD;actif;Cave à vin ARTEVINO OXM1T182NPD;785,93;15;0;Fixe;Boulanger Pro;ARTEVINO;GROS ELECTRO MENAGER;Cave à vin;17,9;60;Oui;3543290003612;Cave à vin ARTEVINO OXM1T182NPD;;https://boulanger.scene7.com/is/image/Boulanger/3543290003612_h_f_l_0
PRODUIT PRINCIPAL;1120857;Lave vaisselle tout-intégrable 60cm SIEMENS SN778D86TE;actif;Lave vaisselle tout-intégrable 60cm SIEMENS SN778D86TE;813,49;8,33;0;Fixe;Boulanger Pro;SIEMENS;GROS ELECTRO MENAGER;Lave Vaisselle;18,7;60;Oui;4242003844083;Lave vaisselle tout-intégrable 60cm SIEMENS SN778D86TE;;https://boulanger.scene7.com/is/image/Boulanger/4242003844083_h_f_l_0
PRODUIT PRINCIPAL;1112368;Lave vaisselle tout-intégrable 60cm ASKO DFI646G;actif;Lave vaisselle tout-intégrable 60cm ASKO DFI646G;856,36;6,67;0;Fixe;Boulanger Pro;ASKO;GROS ELECTRO MENAGER;Lave Vaisselle;19,8;60;Oui;3838782043338;Lave vaisselle tout-intégrable 60cm ASKO DFI646G;;https://boulanger.scene7.com/is/image/Boulanger/3838782043338_h_f_l_0
PRODUIT PRINCIPAL;1133762;Reflex CANON EOS 90D Nu;actif;Reflex CANON EOS 90D Nu;1021,39;0,21;0;Portable;Boulanger Pro;CANON;MULTIMEDIA;APPAREIL PHOTO NUMERIQUE;32,7;36;Oui;4549292138627;Reflex CANON EOS 90D Nu;;https://boulanger.scene7.com/is/image/Boulanger/4549292138627_h_f_l_0
PRODUIT PRINCIPAL;1133763;Reflex CANON EOS 90D + EF-S 18-55mm IS STM;actif;Reflex CANON EOS 90D + EF-S 18-55mm IS STM;1099,96;0,21;0;Portable;Boulanger Pro;CANON;MULTIMEDIA;APPAREIL PHOTO NUMERIQUE;35,2;36;Oui;4549292138634;Reflex CANON EOS 90D + EF-S 18-55mm IS STM;;https://boulanger.scene7.com/is/image/Boulanger/4549292138634_h_f_l_0
PRODUIT PRINCIPAL;1129939;Amplificateur hifi A/V MARANTZ SR6014 silver;actif;Amplificateur hifi A/V MARANTZ SR6014 silver;1121,56;1,67;0;Portable;Boulanger Pro;MARANTZ;MULTIMEDIA;Son Hifi;36;36;Oui;4951035069974;Amplificateur hifi A/V MARANTZ SR6014 silver;;https://boulanger.scene7.com/is/image/Boulanger/4951035069974_h_f_l_0
PRODUIT PRINCIPAL;1130388;Lave linge séchant hublot MIELE WTF 105 WCS;actif;Lave linge séchant hublot MIELE WTF 105 WCS;1193,65;6,67;0;Fixe;Boulanger Pro;MIELE;GROS ELECTRO MENAGER;Lave Linge;27,4;60;Oui;4002516268406;Lave linge séchant hublot MIELE WTF 105 WCS;;https://boulanger.scene7.com/is/image/Boulanger/4002516268406_h_f_l_0
PRODUIT PRINCIPAL;1036021;Cave à vin ARTEVINO Oxygen OXG3T199NVD;actif;Cave à vin ARTEVINO Oxygen OXG3T199NVD;1230,46;16,67;0;Fixe;Boulanger Pro;ARTEVINO;GROS ELECTRO MENAGER;Cave à vin;27,6;60;Oui;3543290003667;Cave à vin ARTEVINO Oxygen OXG3T199NVD;;https://boulanger.scene7.com/is/image/Boulanger/3543290003667_h_f_l_0
PRODUIT PRINCIPAL;1127987;Portable ACER Predator Triton 500 PT515-51-75RXNoir;actif;Portable ACER Predator Triton 500 PT515-51-75RXNoir;1491,45;0,3;0;Portable;Boulanger Pro;ACER;INFORMATIQUE;PORTABLE;47,4;36;Oui;4710180342277;Portable ACER Predator Triton 500 PT515-51-75RXNoir;;https://boulanger.scene7.com/is/image/Boulanger/4710180342277_h_f_l_0
PRODUIT PRINCIPAL;140331;Cuisinière ROSIERES RCP12PN BOCUSE;actif;Cuisinière ROSIERES RCP12PN BOCUSE;2008,63;8,33;0;Fixe;Boulanger Pro;ROSIERES;GROS ELECTRO MENAGER;Cuisson;44,9;60;Oui;8016361837614;Cuisinière ROSIERES RCP12PN BOCUSE;;https://boulanger.scene7.com/is/image/Boulanger/8016361837614_h_f_l_0
PRODUIT PRINCIPAL;1126131;Piano cuisson SMEG C92IPBL9-1;actif;Piano cuisson SMEG C92IPBL9-1;2069,18;8,33;0;Fixe;Boulanger Pro;SMEG;GROS ELECTRO MENAGER;Cuisson;45,1;60;Oui;8017709268398;Piano cuisson SMEG C92IPBL9-1;;https://boulanger.scene7.com/is/image/Boulanger/8017709268398_h_f_l_0
PRODUIT PRINCIPAL;669143;Cuisinière ROSIERES RBC 127 RIN/1;actif;Cuisinière ROSIERES RBC 127 RIN/1;2188,26;7,5;0;Fixe;Boulanger Pro;ROSIERES;GROS ELECTRO MENAGER;Cuisson;48,6;60;Oui;8016361783843;Cuisinière ROSIERES RBC 127 RIN/1;;https://boulanger.scene7.com/is/image/Boulanger/8016361783843_h_f_l_0
PRODUIT PRINCIPAL;1133809;TV SAMSUNG QE55Q950R 8K;actif;TV SAMSUNG QE55Q950R 8K;2249,63;12,5;0;Fixe;Boulanger Pro;SAMSUNG;MULTIMEDIA;TV;47,6;60;Oui;8801643980962;TV SAMSUNG QE55Q950R 8K;;https://boulanger.scene7.com/is/image/Boulanger/8801643980962_h_f_l_0
PRODUIT PRINCIPAL;1133858;Portable MACBOOK CTO Pro 15 Touch Bar I7 2.6 32 512 Gris;actif;Portable MACBOOK CTO Pro 15 Touch Bar I7 2.6 32 512 Gris;2530,72;0,3;0;Portable;Boulanger Pro;APPLE;INFORMATIQUE;PORTABLE;80,1;36;Oui;3497670103822;Portable MACBOOK CTO Pro 15 Touch Bar I7 2.6 32 512 Gris;;https://boulanger.scene7.com/is/image/Boulanger/3497670103822_h_f_l_0
PRODUIT PRINCIPAL;1133782;Ordinateur IMAC CTO 27'' Retina 5K i9 16Go 512SSD pavé n;actif;Ordinateur IMAC CTO 27'' Retina 5K i9 16Go 512SSD pavé n;2685,93;1,25;0;Fixe;Boulanger Pro;APPLE;INFORMATIQUE;PC;85,1;36;Oui;3497670103815;Ordinateur IMAC CTO 27'' Retina 5K i9 16Go 512SSD pavé n;;https://boulanger.scene7.com/is/image/Boulanger/3497670103815_h_f_l_0
PRODUIT PRINCIPAL;1125521;Piano cuisson SMEG TR90DGC9 Dolce Gabbana;actif;Piano cuisson SMEG TR90DGC9 Dolce Gabbana;4170,68;8,33;0;Fixe;Boulanger Pro;SMEG;GROS ELECTRO MENAGER;Cuisson;85,9;60;Oui;8017709268428;Piano cuisson SMEG TR90DGC9 Dolce Gabbana;;https://boulanger.scene7.com/is/image/Boulanger/8017709268428_h_f_l_0
