Référence,Désignation,Etat,Commentaire,Prix d'achat dont ecotaxe,Type,Fournisseur,Fabriquant,Catégorie,Sous Catégorie,Loyer,Durée,Visible sur le site,EAN,Description,Type de produit
1069347,Lave linge hublot BOSCH EX WAN28150FF,actif,Lave linge hublot BOSCH EX WAN28150FF,"315,8",Fixe,Boulanger Pro,BOSCH,GROS ELECTRO MENAGER,Lave Linge,"13,4",60,Oui,4242002899473,Lave linge hublot BOSCH EX WAN28150FF,Produit principal
1087191,Lave linge hublot SIEMENS WM 14T419FF,actif,Lave linge hublot SIEMENS WM 14T419FF,"405,26",Fixe,Boulanger Pro,SIEMENS,GROS ELECTRO MENAGER,Lave Linge,"15,3",60,Oui,4242003805602,Lave linge hublot SIEMENS WM 14T419FF,Produit principal
1094285,Lave linge hublot BOSCH WUQ28418FF,actif,Lave linge hublot BOSCH WUQ28418FF,"402,97",Fixe,Boulanger Pro,BOSCH,GROS ELECTRO MENAGER,Lave Linge,"15,3",60,Oui,4242005059676,Lave linge hublot BOSCH WUQ28418FF,Produit principal
1094336,Sèche Linge Electrolux EW8H4830SP Perfect Care,actif,Sèche Linge Electrolux EW8H4830SP Perfect Care,"427,1",Fixe,Boulanger Pro,ELECTROLUX,GROS ELECTRO MENAGER,Sèche Linge,"15,5",60,Oui,7332543560653,Sèche Linge Electrolux EW8H4830SP Perfect Care,Produit principal
1053443,Sèche Linge Whirlpool HSCX 90422,actif,Sèche Linge Whirlpool HSCX 90422,"457,72",Fixe,Boulanger Pro,WHIRLPOOL,GROS ELECTRO MENAGER,Sèche Linge,"16,1",60,Oui,8003437472701,Sèche Linge Whirlpool HSCX 90422,Produit principal
1049547,Lave linge hublot WHIRLPOOL FSCR 10432 Supreme Care,actif,Lave linge hublot WHIRLPOOL FSCR 10432 Supreme Care,"449,37",Fixe,Boulanger Pro,WHIRLPOOL,GROS ELECTRO MENAGER,Lave Linge,"16,5",60,Oui,8003437261367,Lave linge hublot WHIRLPOOL FSCR 10432 Supreme Care,Produit principal
1076026,Cave à vin Le Chai LB590X,actif,Cave à vin Le Chai LB590X,"474,48",Fixe,Boulanger Pro,LE CHAI,GROS ELECTRO MENAGER,Cave à vin,"16,3",60,Oui,3260449040174,Cave à vin Le Chai LB590X,Produit principal
1066364,Lave linge hublot SAMSUNG ADD WASH WW90K6414QW/EF,actif,Lave linge hublot SAMSUNG ADD WASH WW90K6414QW/EF,"409,63",Fixe,Boulanger Pro,SAMSUNG,GROS ELECTRO MENAGER,Lave Linge,"15,3",60,Oui,8806088193571,Lave linge hublot SAMSUNG ADD WASH WW90K6414QW/EF,Produit principal
1104639,Lave linge hublot SAMSUNG QuickDrive WW90M645OPW,actif,Lave linge hublot SAMSUNG QuickDrive WW90M645OPW,"536,96",Fixe,Boulanger Pro,SAMSUNG,GROS ELECTRO MENAGER,Lave Linge,"18,2",60,Oui,8801643158361,Lave linge hublot SAMSUNG QuickDrive WW90M645OPW,Produit principal
1032731,Sèche Linge Miele TDA 140C,actif,Sèche Linge Miele TDA 140C,"498,52",Fixe,Boulanger Pro,MIELE,GROS ELECTRO MENAGER,Sèche Linge,17,60,Oui,4002515517031,Sèche Linge Miele TDA 140C,Produit principal
1088545,Combiné WHIRLPOOL EX BTNF5322OX,actif,Combiné WHIRLPOOL EX BTNF5322OX,"516,93",Fixe,Boulanger Pro,WHIRLPOOL,GROS ELECTRO MENAGER,Réfrigérateur,"18,2",60,Oui,8003437204012,Combiné WHIRLPOOL EX BTNF5322OX,Produit principal
1093733,Sèche Linge Samsung DV80M52103W/EF,actif,Sèche Linge Samsung DV80M52103W/EF,"483,76",Fixe,Boulanger Pro,SAMSUNG,GROS ELECTRO MENAGER,Sèche Linge,"16,7",60,Oui,8806088770499,Sèche Linge Samsung DV80M52103W/EF,Produit principal
1050568,Combiné SAMSUNG RB41J7035SR/EF,actif,Combiné SAMSUNG RB41J7035SR/EF,"579,01",Fixe,Boulanger Pro,SAMSUNG,GROS ELECTRO MENAGER,Réfrigérateur,"19,3",60,Oui,8806086521239,Combiné SAMSUNG RB41J7035SR/EF,Produit principal
1067414,Lave linge hublot WHIRLPOOL FSCR 12420,actif,Lave linge hublot WHIRLPOOL FSCR 12420,"504,68",Fixe,Boulanger Pro,WHIRLPOOL,GROS ELECTRO MENAGER,Lave Linge,"17,7",60,Oui,8003437261756,Lave linge hublot WHIRLPOOL FSCR 12420,Produit principal
1069885,Cave à vin Liebheer WK 201,actif,Cave à vin Liebheer WK 201,"597,06",Fixe,Boulanger Pro,LIEBHERR,GROS ELECTRO MENAGER,Cave à vin,"19,2",60,Oui,9005382189795,Cave à vin Liebheer WK 201,Produit principal
1107072,Table induction Electrolux EIV854,actif,Table induction Electrolux EIV854,"495,16",Fixe,Boulanger Pro,ELECTROLUX,GROS ELECTRO MENAGER,Cuisson,"15,7",60,Oui,7332543590322,Table induction Electrolux EIV854,Produit principal
1096011,Sèche Linge Electrolux EW9H3825RA Perfect Care,actif,Sèche Linge Electrolux EW9H3825RA Perfect Care,"497,09",Fixe,Boulanger Pro,ELECTROLUX,GROS ELECTRO MENAGER,Sèche Linge,17,60,Oui,7332543561193,Sèche Linge Electrolux EW9H3825RA Perfect Care,Produit principal
1083000,Cave à vin Liebheer WK137,actif,Cave à vin Liebheer WK137,"577,81",Fixe,Boulanger Pro,LIEBHERR,GROS ELECTRO MENAGER,Cave à vin,"18,5",60,Oui,9005382192276,Cave à vin Liebheer WK137,Produit principal
1101012,Micro-ondes SAMSUNG CM1529A-1,actif,Micro-ondes SAMSUNG CM1529A-1,"426,81",Fixe,Boulanger Pro,SAMSUNG,GROS ELECTRO MENAGER,Four Micro-ondes,"14,1",60,Oui,8806071596518,Micro-ondes SAMSUNG CM1529A-1,Produit principal
1094969,Table induction De Dietrich DPI7698DG,actif,Table induction De Dietrich DPI7698DG,"550,87",Fixe,Boulanger Pro,DE DIETRICH,GROS ELECTRO MENAGER,Cuisson,"16,9",60,Oui,3660767965966,Table induction De Dietrich DPI7698DG,Produit principal
1084691,Table induction Whirlpool SMP658CNE IXL,actif,Table induction Whirlpool SMP658CNE IXL,"546,9",Fixe,Boulanger Pro,WHIRLPOOL,GROS ELECTRO MENAGER,Cuisson,"16,8",60,Oui,8003437206122,Table induction Whirlpool SMP658CNE IXL,Produit principal
1096875,Sèche Linge Miele TDB 220 WP,actif,Sèche Linge Miele TDB 220 WP,"540,61",Fixe,Boulanger Pro,MIELE,GROS ELECTRO MENAGER,Sèche Linge,"18,1",60,Oui,4002515939482,Sèche Linge Miele TDB 220 WP,Produit principal
155051,Cave à vin Liebheer WKB 3212,actif,Cave à vin Liebheer WKB 3212,"657,71",Fixe,Boulanger Pro,LIEBHERR,GROS ELECTRO MENAGER,Cave à vin,"20,5",60,Oui,9005382146811,Cave à vin Liebheer WKB 3212,Produit principal
1107956,LL Front ASKO W4096P.W,actif,LL Front ASKO W4096P.W,"677,74",Fixe,Boulanger Pro,ASKO,GROS ELECTRO MENAGER,Lave Linge,"21,2",60,Oui,3838782008986,LL Front ASKO W4096P.W,Produit principal
1097862,Four pyrolyse Miele H2265BP,actif,Four pyrolyse Miele H2265BP,"514,48",Fixe,Boulanger Pro,MIELE,GROS ELECTRO MENAGER,Four,"17,5",60,Oui,4002515798447,Four pyrolyse Miele H2265BP,Produit principal
1105983,Lave-vaisselle PL Siemens SN256I05MF,actif,Lave-vaisselle PL Siemens SN256I05MF,"552,28",Fixe,Boulanger Pro,SIEMENS,GROS ELECTRO MENAGER,Lave Vaisselle,"18,3",60,Oui,4242003815595,Lave-vaisselle PL Siemens SN256I05MF,Produit principal
1071732,Table induction Neff T66TT60N0,actif,Table induction Neff T66TT60N0,"620,58",Fixe,Boulanger Pro,NEFF,GROS ELECTRO MENAGER,Cuisson,"18,3",60,Oui,4242004191728,Table induction Neff T66TT60N0,Produit principal
1085964,Lave linge hublot MIELE WDB 004,actif,Lave linge hublot MIELE WDB 004,"580,2",Fixe,Boulanger Pro,MIELE,GROS ELECTRO MENAGER,Lave Linge,"19,5",60,Oui,4002515835517,Lave linge hublot MIELE WDB 004,Produit principal
1087691,Lave linge hublot LG TurboWash F71K22WHS,actif,Lave linge hublot LG TurboWash F71K22WHS,"661,74",Fixe,Boulanger Pro,LG,GROS ELECTRO MENAGER,Lave Linge,"21,7",60,Oui,8806087455366,Lave linge hublot LG TurboWash F71K22WHS,Produit principal
1106878,Lave-vaisselle Samsung WATERWALL DW60M9550BB,actif,Lave-vaisselle Samsung WATERWALL DW60M9550BB,"552,28",Fixe,Boulanger Pro,SAMSUNG,GROS ELECTRO MENAGER,Lave Vaisselle,"17,9",60,Oui,8801643225544,Lave-vaisselle Samsung WATERWALL DW60M9550BB,Produit principal
1026803,Four Email SMEG SF9310XR,actif,Four Email SMEG SF9310XR,"662,28",Fixe,Boulanger Pro,SMEG,GROS ELECTRO MENAGER,Four,"19,9",60,Oui,8017709191450,Four Email SMEG SF9310XR,Produit principal
1104051,Défroisseur STEAMONE DUALYS Plus,actif,Défroisseur STEAMONE DUALYS Plus,"191,38",Portable,Boulanger Pro,STEAMONE,PETIT ELECTRO MENAGER,Repassage,9,36,Oui,3707346022884,Défroisseur STEAMONE DUALYS Plus,Produit principal
1105925,Centrale vapeur CALOR GV9581CO PRO EXPRESS Ultimate Gold,actif,Centrale vapeur CALOR GV9581CO PRO EXPRESS Ultimate Gold,"199,5",Portable,Boulanger Pro,CALOR,PETIT ELECTRO MENAGER,Repassage,"9,2",36,Oui,3121040068830,Centrale vapeur CALOR GV9581CO PRO EXPRESS Ultimate Gold,Produit principal
1084432,Réf Multi Hisense EX RQ689N4AT1,actif,Réf Multi Hisense EX RQ689N4AT1,"736,87",Fixe,Boulanger Pro,HISENSE,GROS ELECTRO MENAGER,Réfrigérateur,"23,6",60,Oui,6921727009050,Réf Multi Hisense EX RQ689N4AT1,Produit principal
1072012,Lave-vaisselle PL Miele G 6630 SC,actif,Lave-vaisselle PL Miele G 6630 SC,"653,99",Fixe,Boulanger Pro,MIELE,GROS ELECTRO MENAGER,Lave Vaisselle,"20,5",60,Oui,4002515693940,Lave-vaisselle PL Miele G 6630 SC,Produit principal
1094554,Aspirateur traineau MIELE Complete C3 Parquet XL Ecoline,actif,Aspirateur traineau MIELE Complete C3 Parquet XL Ecoline,"198,27",Portable,Boulanger Pro,MIELE,PETIT ELECTRO MENAGER,Aspirateur,"9,2",36,Oui,4002515824801,Aspirateur traineau MIELE Complete C3 Parquet XL Ecoline,Produit principal
1070208,Lave-vaisselle  Miele G6630SCI IN,actif,Lave-vaisselle  Miele G6630SCI IN,"728,06",Fixe,Boulanger Pro,MIELE,GROS ELECTRO MENAGER,Lave Vaisselle,"21,9",60,Oui,4002515693964,Lave-vaisselle  Miele G6630SCI IN,Produit principal
1109241,Sèche Linge Asko T409HS.W,actif,Sèche Linge Asko T409HS.W,"874,07",Fixe,Boulanger Pro,ASKO,GROS ELECTRO MENAGER,Sèche Linge,"25,4",60,Oui,3838782011252,Sèche Linge Asko T409HS.W,Produit principal
1076010,Lave-vaisselle Electrolux ESL7740RA Comfortlift,actif,Lave-vaisselle Electrolux ESL7740RA Comfortlift,"666,58",Fixe,Boulanger Pro,ELECTROLUX,GROS ELECTRO MENAGER,Lave Vaisselle,"20,4",60,Oui,7332543526727,Lave-vaisselle Electrolux ESL7740RA Comfortlift,Produit principal
1101679,LL Front ASKO W4114C.W,actif,LL Front ASKO W4114C.W,"867,99",Fixe,Boulanger Pro,ASKO,GROS ELECTRO MENAGER,Lave Linge,"25,2",60,Oui,3838782009037,LL Front ASKO W4114C.W,Produit principal
1087801,Réf Multi Haier HB18FGSAAA,actif,Réf Multi Haier HB18FGSAAA,"940,97",Fixe,Boulanger Pro,HAIER,GROS ELECTRO MENAGER,Réfrigérateur,"27,9",60,Oui,6901018064777,Réf Multi Haier HB18FGSAAA,Produit principal
1022485,Four Electrolux EOB8946AOX,actif,Four Electrolux EOB8946AOX,"662,28",Fixe,Boulanger Pro,ELECTROLUX,GROS ELECTRO MENAGER,Four,"19,6",60,Oui,7332543286454,Four Electrolux EOB8946AOX,Produit principal
1048347,Four combi Siemens IQ700 HM676G0S1F VARIOSPEED,actif,Four combi Siemens IQ700 HM676G0S1F VARIOSPEED,"698,21",Fixe,Boulanger Pro,SIEMENS,GROS ELECTRO MENAGER,Four,"20,4",60,Oui,4242003671993,Four combi Siemens IQ700 HM676G0S1F VARIOSPEED,Produit principal
1047998,Four Double SMEG DOSP6390X,actif,Four Double SMEG DOSP6390X,"868,59",Fixe,Boulanger Pro,SMEG,GROS ELECTRO MENAGER,Four,"24,4",60,Oui,8017709210656,Four Double SMEG DOSP6390X,Produit principal
1049386,Four pyrolyse Bosch Série 8 HBG6769S1F,actif,Four pyrolyse Bosch Série 8 HBG6769S1F,"761,66",Fixe,Boulanger Pro,BOSCH,GROS ELECTRO MENAGER,Four,"21,7",60,Oui,4242002808109,Four pyrolyse Bosch Série 8 HBG6769S1F,Produit principal
1076889,Lave linge hublot MIELE WKH 122 WPS,actif,Lave linge hublot MIELE WKH 122 WPS,"1030,64",Fixe,Boulanger Pro,MIELE,GROS ELECTRO MENAGER,Lave Linge,"29,6",60,Oui,4002515772508,Lave linge hublot MIELE WKH 122 WPS,Produit principal
1106236,LL Front MIELE WCI 320,actif,LL Front MIELE WCI 320,"911,46",Fixe,Boulanger Pro,MIELE,GROS ELECTRO MENAGER,Lave Linge,"26,6",60,Oui,4002515980187,LL Front MIELE WCI 320,Produit principal
1093899,SL Front ASKO T411HD.W,actif,SL Front ASKO T411HD.W,"1045,34",Fixe,Boulanger Pro,ASKO,GROS ELECTRO MENAGER,Sèche Linge,"28,7",60,Oui,3838782011429,SL Front ASKO T411HD.W,Produit principal
1117541,Table induction Siemens EX875KYW1E,actif,Table induction Siemens EX875KYW1E,"982,28",Fixe,Boulanger Pro,SIEMENS,GROS ELECTRO MENAGER,Cuisson,"26,1",60,Oui,4242003765296,Table induction Siemens EX875KYW1E,Produit principal
1071268,Réfrigérateur américain LG GSS6676SC,actif,Réfrigérateur américain LG GSS6676SC,"1105,97",Fixe,Boulanger Pro,LG,GROS ELECTRO MENAGER,Réfrigérateur,"31,7",60,Oui,6934585683140,Réfrigérateur américain LG GSS6676SC,Produit principal
1047955,Réf Multi Samsung RFG23RESL1,actif,Réf Multi Samsung RFG23RESL1,"1140,21",Fixe,Boulanger Pro,SAMSUNG,GROS ELECTRO MENAGER,Réfrigérateur,"31,8",60,Oui,8806086220910,Réf Multi Samsung RFG23RESL1,Produit principal
1084246,Tablette graphique WACOM Intuos Pro PTH-660-S,actif,Tablette graphique WACOM Intuos Pro PTH-660-S,"265,89",Portable,Boulanger Pro,WACOM,INFORMATIQUE,TABLETTE,"12,5",36,Oui,4949268620024,Tablette graphique WACOM Intuos Pro PTH-660-S,Produit principal
1093788,Robot KENWOOD KVL6305S Chef XL Elite,actif,Robot KENWOOD KVL6305S Chef XL Elite,"274,53",Portable,Boulanger Pro,KENWOOD,PETIT ELECTRO MENAGER,Robot,"12,2",36,Oui,5011423197036,Robot KENWOOD KVL6305S Chef XL Elite,Produit principal
1096927,Four SMEG SF4390VCX1,actif,Four SMEG SF4390VCX1,"908,18",Fixe,Boulanger Pro,SMEG,GROS ELECTRO MENAGER,Four,"24,9",60,Oui,8017709235888,Four SMEG SF4390VCX1,Produit principal
1097767,Aspi NILFISK Elite BMSU14P10A1 Superio,actif,Aspi NILFISK Elite BMSU14P10A1 Superio,"258,83",Portable,Boulanger Pro,NILFISK,PETIT ELECTRO MENAGER,Aspirateur,"11,7",36,Oui,5715492189571,Aspi NILFISK Elite BMSU14P10A1 Superio,Produit principal
1072839,Pianos SMEG C9CIMX9,actif,Pianos SMEG C9CIMX9,"1085,92",Fixe,Boulanger Pro,SMEG,GROS ELECTRO MENAGER,Cuisson,"29,5",60,Oui,8017709222918,Pianos SMEG C9CIMX9,Produit principal
1112149,Sèche Linge Siemens Avantgarde WT47X940EU,actif,Sèche Linge Siemens Avantgarde WT47X940EU,"1135,43",Fixe,Boulanger Pro,SIEMENS,GROS ELECTRO MENAGER,Sèche Linge,"30,8",60,Oui,4242003831694,Sèche Linge Siemens Avantgarde WT47X940EU,Produit principal
1066121,Four Combi SIEMENS IQ700 HM676G0S6 HOME,actif,Four Combi SIEMENS IQ700 HM676G0S6 HOME,"937,28",Fixe,Boulanger Pro,SIEMENS,GROS ELECTRO MENAGER,Four,"25,5",60,Oui,4242003739952,Four Combi SIEMENS IQ700 HM676G0S6 HOME,Produit principal
1093842,Robot KENWOOD KVC7305S Chef Titanium,actif,Robot KENWOOD KVC7305S Chef Titanium,298,Portable,Boulanger Pro,KENWOOD,PETIT ELECTRO MENAGER,Robot,13,36,Oui,5011423197012,Robot KENWOOD KVC7305S Chef Titanium,Produit principal
1015964,Scanner CUBE 3D Sense,actif,Scanner CUBE 3D Sense,"323,07",Fixe,Boulanger Pro,CUBE,BUREAUTIQUE,SCANNER,"15,1",36,Oui,840846133537,Scanner CUBE 3D Sense,Produit principal
1093322,Four éco clean NEFF B48FT78N1,actif,Four éco clean NEFF B48FT78N1,"1110,14",Fixe,Boulanger Pro,NEFF,GROS ELECTRO MENAGER,Four,"29,1",60,Oui,4242004214106,Four éco clean NEFF B48FT78N1,Produit principal
146777,Centrale vapeur LAURASTAR LIFT Plus Utlimate Black,actif,Centrale vapeur LAURASTAR LIFT Plus Utlimate Black,"269,45",Portable,Boulanger Pro,LAURASTAR,PETIT ELECTRO MENAGER,Repassage,12,36,Oui,790776004691,Centrale vapeur LAURASTAR LIFT Plus Utlimate Black,Produit principal
1115895,S-cheveux Pro DYSON Supersonic Black/Nic,actif,S-cheveux Pro DYSON Supersonic Black/Nic,"297,16",Portable,Boulanger Pro,DYSON,PETIT ELECTRO MENAGER,Sèche-cheveux,"12,9",36,Oui,5025155036709,S-cheveux Pro DYSON Supersonic Black/Nic,Produit principal
1080526,Robot KITCHENAID 5KSM125EER Rouge Empire,actif,Robot KITCHENAID 5KSM125EER Rouge Empire,"291,658333",Portable,Boulanger Pro,KITCHENAID,PETIT ELECTRO MENAGER,Robot,"12,8",36,Oui,5413184200787,Robot KITCHENAID 5KSM125EER Rouge Empire,Produit principal
1054984,Humidificateur DYSON AM10 WHITE/SILVER,actif,Humidificateur DYSON AM10 WHITE/SILVER,"347,37",Portable,Boulanger Pro,DYSON,PETIT ELECTRO MENAGER,Qualité de l'air,15,36,Oui,5025155018651,Humidificateur DYSON AM10 WHITE/SILVER,Produit principal
1095122,Aspi DYSON Cinetic Big Ball Parquet 2,actif,Aspi DYSON Cinetic Big Ball Parquet 2,"308,325",Portable,Boulanger Pro,DYSON,PETIT ELECTRO MENAGER,Aspirateur,"13,7",36,Oui,5025155027547,Aspi DYSON Cinetic Big Ball Parquet 2,Produit principal
1022923,Pianos  Leisure CK110F324X,actif,Pianos  Leisure CK110F324X,"1174,4",Fixe,Boulanger Pro,LEISURE,GROS ELECTRO MENAGER,Cuisson,"32,1",60,Oui,8690842870552,Pianos  Leisure CK110F324X,Produit principal
1051852,Ventilateur DYSON AM09 HOT+COOL Black Nickel,actif,Ventilateur DYSON AM09 HOT+COOL Black Nickel,"333,6",Portable,Boulanger Pro,DYSON,PETIT ELECTRO MENAGER,Qualité de l'air,"14,5",36,Oui,5025155018644,Ventilateur DYSON AM09 HOT+COOL Black Nickel,Produit principal
1072489,Sèche Linge Miele TKR 850 WP,actif,Sèche Linge Miele TKR 850 WP,"1234,62",Fixe,Boulanger Pro,MIELE,GROS ELECTRO MENAGER,Sèche Linge,"32,5",60,Oui,4002515677742,Sèche Linge Miele TKR 850 WP,Produit principal
1087879,Réfrigérateur américain LG GSK6676SC instaview,actif,Réfrigérateur américain LG GSK6676SC instaview,"1391,35",Fixe,Boulanger Pro,LG,GROS ELECTRO MENAGER,Réfrigérateur,"37,3",60,Oui,6934585685373,Réfrigérateur américain LG GSK6676SC instaview,Produit principal
1080530,Robot KITCHENAID 5KSM175PSECA Pomme d'Amour,actif,Robot KITCHENAID 5KSM175PSECA Pomme d'Amour,"394,28",Portable,Boulanger Pro,KITCHENAID,PETIT ELECTRO MENAGER,Robot,"16,6",36,Oui,5413184200480,Robot KITCHENAID 5KSM175PSECA Pomme d'Amour,Produit principal
1110616,Aspirateur traineau MIELE Blizzard CX1 Electro EcoLine,actif,Aspirateur traineau MIELE Blizzard CX1 Electro EcoLine,"405,22",Portable,Boulanger Pro,MIELE,PETIT ELECTRO MENAGER,Aspirateur,"17,1",36,Oui,4002515824535,Aspirateur traineau MIELE Blizzard CX1 Electro EcoLine,Produit principal
1095126,Aspi DYSON Cinetic Big Ball Absolute 2,actif,Aspi DYSON Cinetic Big Ball Absolute 2,"394,77",Portable,Boulanger Pro,DYSON,PETIT ELECTRO MENAGER,Aspirateur,"16,6",36,Oui,5025155027882,Aspi DYSON Cinetic Big Ball Absolute 2,Produit principal
1046457,Réf Multi SMEG FQ 75 XPED,actif,Réf Multi SMEG FQ 75 XPED,"1607,63",Fixe,Boulanger Pro,SMEG,GROS ELECTRO MENAGER,Réfrigérateur,"41,7",60,Oui,8017709193362,Réf Multi SMEG FQ 75 XPED,Produit principal
1096024,Sèche Linge Miele TMV843WP,actif,Sèche Linge Miele TMV843WP,"1465,99",Fixe,Boulanger Pro,MIELE,GROS ELECTRO MENAGER,Sèche Linge,"37,4",60,Oui,4002515872345,Sèche Linge Miele TMV843WP,Produit principal
1047180,Réfrigérateur multi-portes SAMSUNG RF56J9040SR,actif,Réfrigérateur multi-portes SAMSUNG RF56J9040SR,"1681,01",Fixe,Boulanger Pro,SAMSUNG,GROS ELECTRO MENAGER,Réfrigérateur,"43,8",60,Oui,8806086664561,Réfrigérateur multi-portes SAMSUNG RF56J9040SR,Produit principal
1109218,Table Induc BOSCH PVS851F21E,actif,Table Induc BOSCH PVS851F21E,"1389,96",Fixe,Boulanger Pro,BOSCH,GROS ELECTRO MENAGER,Cuisson,"34,7",60,Oui,4242005049424,Table Induc BOSCH PVS851F21E,Produit principal
1093318,Pianos  Falcon CLASSIC110 ROUGE AIRELLE CHRM,actif,Pianos  Falcon CLASSIC110 ROUGE AIRELLE CHRM,"1747,24",Fixe,Boulanger Pro,Falcon,GROS ELECTRO MENAGER,Cuisson,"44,2",60,Oui,5028683116837,Pianos  Falcon CLASSIC110 ROUGE AIRELLE CHRM,Produit principal
1105916,Réf Multi SAMSUNG RF56M9380SG,actif,Réf Multi SAMSUNG RF56M9380SG,"1995,92",Fixe,Boulanger Pro,SAMSUNG,GROS ELECTRO MENAGER,Réfrigérateur,"50,5",60,Oui,8806088935461,Réf Multi SAMSUNG RF56M9380SG,Produit principal
1047691,Pianos SMEG TR4110P1,actif,Pianos SMEG TR4110P1,"1865,57",Fixe,Boulanger Pro,SMEG,GROS ELECTRO MENAGER,Cuisson,"46,7",60,Oui,8017709176655,Pianos SMEG TR4110P1,Produit principal
1110533,TV SONY KD55XF7096,actif,TV SONY KD55XF7096,"571,15",Fixe,Boulanger Pro,SONY,MULTIMEDIA,TV,"16,5",60,Oui,4548736077492,TV SONY KD55XF7096,Produit principal
1118176,Pianos  Falcon CLASSIC DELUXE INDUCTION 100 CREME/,actif,Pianos  Falcon CLASSIC DELUXE INDUCTION 100 CREME/,"1207,34",Fixe,Boulanger Pro,Falcon,GROS ELECTRO MENAGER,Cuisson,"36,8",60,Oui,5028683095989,Pianos  Falcon CLASSIC DELUXE INDUCTION 100 CREME/,Produit principal
1087875,Table Induc SIEMENS EX875LX34E Inducti,actif,Table Induc SIEMENS EX875LX34E Inducti,"1925,87",Fixe,Boulanger Pro,SIEMENS,GROS ELECTRO MENAGER,Cuisson,46,60,Oui,4242003763988,Table Induc SIEMENS EX875LX34E Inducti,Produit principal
1077616,Purificateur d'air DYSON Pure Hot+Cool Link White,actif,Purificateur d'air DYSON Pure Hot+Cool Link White,"416,68",Portable,Boulanger Pro,DYSON,PETIT ELECTRO MENAGER,Qualité de l'air,"17,4",36,Oui,5025155023631,Purificateur d'air DYSON Pure Hot+Cool Link White,Produit principal
1071941,Trancheuse BERKEL NRL 220 Rouge,actif,Trancheuse BERKEL NRL 220 Rouge,"531,03",Fixe,Boulanger Pro,BERKEL,PETIT ELECTRO MENAGER,Trancheuse,"23,7",36,Oui,8050040420001,Trancheuse BERKEL NRL 220 Rouge,Produit principal
1066933,Imprimante jet d'encre multifonction CANON PIXMA PRO-10S,actif,Imprimante jet d'encre multifonction CANON PIXMA PRO-10S,"465,87",Fixe,Boulanger Pro,CANON,BUREAUTIQUE,IMPRIMANTE,"20,3",36,Oui,4549292022070,Imprimante jet d'encre multifonction CANON PIXMA PRO-10S,Produit principal
1105892,TV SAMSUNG QE49Q6F 2018,actif,TV SAMSUNG QE49Q6F 2018,"636,52",Fixe,Boulanger Pro,SAMSUNG,MULTIMEDIA,TV,"17,8",60,Oui,8801643204617,TV SAMSUNG QE49Q6F 2018,Produit principal
1105913,TV SAMSUNG UE55NU7655 INCURVE,actif,TV SAMSUNG UE55NU7655 INCURVE,"643,36",Fixe,Boulanger Pro,SAMSUNG,MULTIMEDIA,TV,"18,1",60,Oui,8801643210014,TV SAMSUNG UE55NU7655 INCURVE,Produit principal
1111904,TV SAMSUNG THE FRAME UE43LS03 2018,actif,TV SAMSUNG THE FRAME UE43LS03 2018,"790,48",Fixe,Boulanger Pro,SAMSUNG,MULTIMEDIA,TV,"21,8",60,Oui,8801643356897,TV SAMSUNG THE FRAME UE43LS03 2018,Produit principal
1091262,Blender KITCHENAID 5KSB8270EMS Gris Et,actif,Blender KITCHENAID 5KSB8270EMS Gris Et,"494,53",Portable,Boulanger Pro,KITCHENAID,PETIT ELECTRO MENAGER,Robot,20,36,Oui,5413184201777,Blender KITCHENAID 5KSB8270EMS Gris Et,Produit principal
1091565,Tablette IPAD Pro 10.5 64Go Gris Sidéral,actif,Tablette IPAD Pro 10.5 64Go Gris Sidéral,"586,74",Portable,Boulanger Pro,APPLE,INFORMATIQUE,TABLETTE,"24,5",36,Oui,190198470836,Tablette IPAD Pro 10.5 64Go Gris Sidéral,Produit principal
1107244,TV SONY KD65XF7596,actif,TV SONY KD65XF7596,"832,5",Fixe,Boulanger Pro,SONY,MULTIMEDIA,TV,"22,7",60,Oui,4548736076815,TV SONY KD65XF7596,Produit principal
1101532,Trancheuse WISMER WEG 300 Inox,actif,Trancheuse WISMER WEG 300 Inox,"590,1",Fixe,Boulanger Pro,WISMER,PETIT ELECTRO MENAGER,Trancheuse,24,36,Oui,3700378101633,Trancheuse WISMER WEG 300 Inox,Produit principal
1110718,Portable HP Envy 17-bw0007nf,actif,Portable HP Envy 17-bw0007nf,"693,38",Portable,Boulanger Pro,HP,INFORMATIQUE,PC,"28,8",36,Oui,193015166523,Portable HP Envy 17-bw0007nf,Produit principal
1111965,TV SAMSUNG THE FRAME UE49LS03 2018,actif,TV SAMSUNG THE FRAME UE49LS03 2018,"996,03",Fixe,Boulanger Pro,SAMSUNG,MULTIMEDIA,TV,"26,2",60,Oui,8801643356910,TV SAMSUNG THE FRAME UE49LS03 2018,Produit principal
1091348,Tablette IPAD Pro 10.5 256Go Gris Sidéral,actif,Tablette IPAD Pro 10.5 256Go Gris Sidéral,"724,12",Portable,Boulanger Pro,APPLE,INFORMATIQUE,TABLETTE,"30,3",36,Oui,190198313287,Tablette IPAD Pro 10.5 256Go Gris Sidéral,Produit principal
1114001,Pack KITCHENAID Pro 5KSM7990XEWH Blanc,actif,Pack KITCHENAID Pro 5KSM7990XEWH Blanc,"608,88",Portable,Boulanger Pro,KITCHENAID,PETIT ELECTRO MENAGER,Robot,"24,8",36,Oui,5413184160128,Pack KITCHENAID Pro 5KSM7990XEWH Blanc,Produit principal
1106757,Portable ACER Swift SF514-52T-80TF,actif,Portable ACER Swift SF514-52T-80TF,"748,7",Portable,Boulanger Pro,ACER,INFORMATIQUE,PC,"31,1",36,Oui,4713883756112,Portable ACER Swift SF514-52T-80TF,Produit principal
1110861,TV SAMSUNG QE55Q6F 2018,actif,TV SAMSUNG QE55Q6F 2018,"693,27",Fixe,Boulanger Pro,SAMSUNG,MULTIMEDIA,TV,"19,1",60,Oui,8801643201999,TV SAMSUNG QE55Q6F 2018,Produit principal
1102882,Portable HP Pavilion 14-bf106nf,actif,Portable HP Pavilion 14-bf106nf,"744,76",Portable,Boulanger Pro,HP,INFORMATIQUE,PC,31,36,Oui,192018853058,Portable HP Pavilion 14-bf106nf,Produit principal
1110654,Portable HP OMEN 17-an106nf,actif,Portable HP OMEN 17-an106nf,"952,06",Portable,Boulanger Pro,HP,INFORMATIQUE,PC,"39,3",36,Oui,193015180499,Portable HP OMEN 17-an106nf,Produit principal
1093268,Réf Multi LG LSR100,actif,Réf Multi LG LSR100,"4405,97",Fixe,Boulanger Pro,LG,GROS ELECTRO MENAGER,Réfrigérateur,"99,6",60,Oui,8801031692996,Réf Multi LG LSR100,Produit principal
1105911,TV SAMSUNG QE55Q7F 2018,actif,TV SAMSUNG QE55Q7F 2018,"1062,5",Fixe,Boulanger Pro,SAMSUNG,MULTIMEDIA,TV,"28,2",60,Oui,8801643158835,TV SAMSUNG QE55Q7F 2018,Produit principal
1091523,Tablette IPAD Pro 12.9 256Go Gris Sidéral 2017,actif,Tablette IPAD Pro 12.9 256Go Gris Sidéral 2017,"866,6",Portable,Boulanger Pro,APPLE,INFORMATIQUE,TABLETTE,"35,7",36,Oui,190198282538,Tablette IPAD Pro 12.9 256Go Gris Sidéral 2017,Produit principal
1106728,Portable HP Spectre x360 13-ae019nf,actif,Portable HP Spectre x360 13-ae019nf,"913,71",Portable,Boulanger Pro,HP,INFORMATIQUE,PC,38,36,Oui,192545419802,Portable HP Spectre x360 13-ae019nf,Produit principal
1111967,TV SAMSUNG THE FRAME UE55LS03 2018,actif,TV SAMSUNG THE FRAME UE55LS03 2018,"1191,9",Fixe,Boulanger Pro,SAMSUNG,MULTIMEDIA,TV,31,60,Oui,8801643356934,TV SAMSUNG THE FRAME UE55LS03 2018,Produit principal
1091526,Tablette IPAD Pro 12.9 256Go Cell Gris Sidéral 2017,actif,Tablette IPAD Pro 12.9 256Go Cell Gris Sidéral 2017,"994,76",Portable,Boulanger Pro,APPLE,INFORMATIQUE,TABLETTE,"40,6",36,Oui,190198299987,Tablette IPAD Pro 12.9 256Go Cell Gris Sidéral 2017,Produit principal
1091419,Ordinateur IMAC 21.5'' Retina 4K 3Ghz 1To,actif,Ordinateur IMAC 21.5'' Retina 4K 3Ghz 1To,"1125,08",Fixe,Boulanger Pro,APPLE,INFORMATIQUE,PC,"46,3",36,Oui,190198085702,Ordinateur IMAC 21.5'' Retina 4K 3Ghz 1To,Produit principal
1111964,TV SONY KD70XF8305,actif,TV SONY KD70XF8305,"1082,14",Fixe,Boulanger Pro,SONY,MULTIMEDIA,TV,"28,8",60,Oui,4548736077652,TV SONY KD70XF8305,Produit principal
1084364,Centre repassage MIELE FASHION MASTER B3847,actif,Centre repassage MIELE FASHION MASTER B3847,"1187,49",Portable,Boulanger Pro,MIELE,PETIT ELECTRO MENAGER,Repassage,"48,4",36,Oui,4002515781258,Centre repassage MIELE FASHION MASTER B3847,Produit principal
